IndustryCode,Description,Employment,Output,EmployeeCompensation,ProprietorIncome,OtherPropertyTypeIncome,TaxOnProductionAndImports
0,Total,591456.5896,1.20179E+11,33676055946,3850313316,31664578965,3990774945
1,Oilseed farming,80.4704361,62723007.2,87991.55056,162422073.4,-95411048.89,-7488450.05
2,Grain farming,408.0770569,110101173.4,4552684.307,124775817.9,-8778287.888,-15954059.6
3,Vegetable and melon farming,461.2342529,54517280.58,6051521.301,27793075.56,6102637.768,-12669.13023
4,Fruit farming,33.28089905,2886447.191,307733.0589,1729653.835,452884.1674,-453.5192566
5,Tree nut farming,0,0,0,0,0,0
6,"Greenhouse, nursery, and floriculture production",238.4170685,24369968.41,4358213.902,11445483.21,2166028.261,-10083.29447
7,Tobacco farming,0,0,0,0,0,0
8,Cotton farming,0,0,0,0,0,0
9,Sugarcane and sugar beet farming,0,0,0,0,0,0
10,All other crop farming,424.3061829,12387434.96,2227299.929,6622616.768,1144231.2,-1774323.225
11,"Beef cattle ranching and farming, including feedlots and dual-purpose ranching and farming",52.81005096,8133206.367,70897.57919,6842133.045,1132329.941,-318813.6816
12,Dairy cattle and milk production,30.89772415,14732000.35,381235.6293,4508411.407,698808.1932,-261496.7227
13,Poultry and egg production,1878.598511,1107728027,37155807.5,84186660.77,21188829.42,-9044552.803
14,"Animal production, except cattle and poultry and eggs",58.05352402,7513808.727,438214.0934,15697090.15,-8747741.699,-232978.8357
15,"Forestry, forest products, and timber tract production",31.50281143,3551169.872,2464687.824,0,471939.8618,0
16,Commercial logging,43.59935379,20816564.56,2970231.295,15865507.13,510220.17,9805.649519
17,Commercial fishing,358.8760071,32945602.42,656108.0813,21529302.6,6711787.224,1319938.66
18,Commercial hunting and trapping,0,0,0,0,0,0
19,Support activities for agriculture and forestry,958.6954956,20885015.49,30233596.8,6102531.433,-23171134.95,496475.4283
20,Oil and gas extraction,357.1114502,114496505.7,0,33308525.09,0,0
21,Coal mining,0,0,0,0,0,0
22,"Copper, nickel, lead, and zinc mining",0,0,0,0,0,0
23,Iron ore mining,0,0,0,0,0,0
24,Gold ore mining,0,0,0,0,0,0
25,Silver ore mining,0,0,0,0,0,0
26,Uranium-radium-vanadium ore mining,0,0,0,0,0,0
27,Other metal ore mining,0,0,0,0,0,0
28,Stone mining and quarrying,0,0,0,0,0,0
29,Sand and gravel mining,37.38880157,5298303.127,2102755.547,-1905822.396,1531176.448,463130.1165
30,"Other clay, ceramic, refractory minerals mining",0,0,0,0,0,0
31,"Potash, soda, and borate mineral mining",0,0,0,0,0,0
32,Phosphate rock mining,0,0,0,0,0,0
33,Other chemical and fertilizer mineral mining,0,0,0,0,0,0
34,Other nonmetallic minerals,0,0,0,0,0,0
35,Drilling oil and gas wells,27.50069809,8286896.706,22771.42555,1932306.409,32887.41037,10869.99942
36,Support activities for oil and gas operations,56.02720642,15293336.87,1428327.799,2942500.591,1329142.809,214488.9235
37,Metal mining services,38.39162064,12137399.67,0,3579906.94,0,0
38,Other nonmetallic minerals services,38.39162064,12040452,0,3579373.598,0,0
39,Electric power generation - Hydroelectric,0,0,0,0,0,0
40,Electric power generation - Fossil fuel,171.3528595,223918273.9,23465866.09,1320037.723,35326007.84,21488698.96
41,Electric power generation - Nuclear,0,0,0,0,0,0
42,Electric power generation - Solar,0.820855618,442597.1508,155145.1534,0,161694.6906,17452.65722
43,Electric power generation - Wind,0,0,0,0,0,0
44,Electric power generation - Geothermal,0,0,0,0,0,0
45,Electric power generation - Biomass,0,0,0,0,0,0
46,Electric power generation - All other,23.19377518,3585413.694,2778933.287,405755.6689,-2657237.53,299620.1515
47,Electric power transmission and distribution,1513.409058,1953776611,244413299.6,3447522.64,347966522.2,171518859.9
48,Natural gas distribution,201.7051849,169741149.9,37541061.4,35028.57313,39944824.22,8967103.958
49,"Water, sewage and other systems",470.5916748,127852874.8,37640316.01,5277753.83,24374820.71,6708449.364
50,Construction of new health care structures,948.3686523,153369369.5,43285324.1,20936023.71,30158981.32,603527.5459
51,Construction of new manufacturing structures,1464.221191,225325546.3,64851524.35,33086929.32,23268918.99,960216.2242
52,Construction of new power and communication structures,2016.86084,384115234.4,89089096.07,46748603.82,100029007,2297728.3
53,Construction of new educational and vocational structures,2394.36499,346460296.6,119128944.4,43964340.21,62200500.49,1168127.418
54,Construction of new highways and streets,1914.530151,416088531.5,90128387.45,40497356.41,100188301.1,1411664.605
55,"Construction of new commercial structures, including farm structures",3659.401123,485789154.1,156602890,77575286.87,43652793.88,2308124.304
56,Construction of other new nonresidential structures,4657.426758,440000671.4,206110366.8,105751647.9,-86471343.99,1828277.946
57,Construction of new single-family residential structures,5732.629395,879947876,246917053.2,133721862.8,148721191.4,10945589.07
58,Construction of new multifamily residential structures,1775.162354,213098068.2,76981124.88,41610324.86,50493270.87,1812315.464
59,Construction of other new residential structures,4010.078369,843151367.2,177341766.4,92160995.48,135980819.7,5162106.514
60,Maintenance and repair construction of nonresidential structures,2714.873047,570326232.9,118685340.9,63534996.03,73536903.38,3465825.319
61,Maintenance and repair construction of residential structures,1324.2771,287031524.7,55713954.93,27286338.81,43556537.63,2127853.87
62,"Maintenance and repair construction of highways, streets, bridges, and tunnels",978.0203247,105395675.7,43036727.91,22695102.69,-14988864.9,766231.1196
63,Dog and cat food manufacturing,67.35901642,82094047.55,3469565.63,1445121.765,5040787.697,828240.2754
64,Other animal food manufacturing,177.0231934,174455108.6,10578896.52,270002.1565,3938889.742,1826777.697
65,Flour milling,0,0,0,0,0,0
66,Rice milling,0,0,0,0,0,0
67,Malt manufacturing,0,0,0,0,0,0
68,Wet corn milling,0,0,0,0,0,0
69,Soybean and other oilseed processing,0,0,0,0,0,0
70,Fats and oils refining and blending,0,0,0,0,0,0
71,Breakfast cereal manufacturing,0,0,0,0,0,0
72,Beet sugar manufacturing,0,0,0,0,0,0
73,Sugar cane mills and refining,0,0,0,0,0,0
74,Nonchocolate confectionery manufacturing,21.48842621,9034089.088,803842.783,1033013.582,199362.5015,25718.35741
75,Chocolate and confectionery manufacturing from cacao beans,0,0,0,0,0,0
76,Confectionery manufacturing from purchased chocolate,37.28004074,12878791.81,1535329.223,775058.2099,359027.7433,38686.58841
77,"Frozen fruits, juices and vegetables manufacturing",78.98371887,35292938.23,5622995.853,204273.6262,2567646.027,109470.4568
78,Frozen specialties manufacturing,28.4467392,10954351.43,1852414.966,323101.0735,516905.9634,25652.77182
79,Canned fruits and vegetables manufacturing,11.1171627,5293267.727,250806.0336,604413.867,109213.6353,14107.23384
80,Canned specialties,0,0,0,0,0,0
81,Dehydrated food products manufacturing,0,0,0,0,0,0
82,Cheese manufacturing,0,0,0,0,0,0
83,"Dry, condensed, and evaporated dairy product manufacturing",0,0,0,0,0,0
84,Fluid milk manufacturing,203.5334625,150309631.3,18315673.83,367570.0426,6423190.117,507867.8131
85,Creamery butter manufacturing,0,0,0,0,0,0
86,Ice cream and frozen dessert manufacturing,30.24850845,13319076.54,1820862.055,773632.288,557077.0502,47038.79356
87,Frozen cakes and other pastries manufacturing,516.3637695,40780395.51,14853694.92,1714349.031,2745184.422,796596.5867
88,Poultry processing,8526.319336,2575181885,436435394.3,95738.42585,76912696.84,7023282.528
89,"Animal, except poultry, slaughtering",8.217806816,5718882.561,539145.1716,19205.3467,154929.8763,49524.86977
90,Meat processed from carcasses,150.399292,77055213.93,8543713.57,104869.3135,443493.6643,268030.3454
91,Rendering and meat byproduct processing,8.217806816,3255457.401,539145.1716,19318.07771,198678.568,36336.93233
92,Seafood product preparation and packaging,9.692396164,4280213.356,401748.6274,623741.4479,54744.38518,14736.64679
93,"Bread and bakery product, except frozen, manufacturing",751.2991943,98453399.66,19214580.54,11805793.76,3852719.307,916971.2663
94,Cookie and cracker manufacturing,0,0,0,0,0,0
95,"Dry pasta, mixes, and dough manufacturing",0,0,0,0,0,0
96,Tortilla manufacturing,0,0,0,0,0,0
97,Roasted nuts and peanut butter manufacturing,32.60478592,14214776.99,2577584.267,0,637944.4599,0
98,Other snack food manufacturing,33.16993332,15990509.03,2663003.206,0,541274.3092,0
99,Coffee and tea manufacturing,0,0,0,0,0,0
100,Flavoring syrup and concentrate manufacturing,0,0,0,0,0,0
101,"Mayonnaise, dressing, and sauce manufacturing",78.31059265,45674083.71,6728454.59,1254106.879,3349286.318,134841.3974
102,Spice and extract manufacturing,0,0,0,0,0,0
103,All other food manufacturing,500.1112671,187356445.3,38978176.12,1664366.364,7533391.953,481606.4537
104,Bottled and canned soft drinks & water,12.19657516,9378961.563,702119.7677,1029363.394,396529.0785,42588.49099
105,Manufactured ice,0,0,0,0,0,0
106,Breweries,293.342926,152647979.7,16419771.19,28193574.91,12353456.5,5659541.13
107,Wineries,46.38538361,20349149.7,765475.5116,7810001.373,275199.1451,240932.8818
108,Distilleries,22.77953911,30260086.06,820607.9602,11493451.12,1176658.988,3045731.544
109,Tobacco product manufacturing,153.3307953,367238647.5,13488306.05,1692464.948,76548698.43,66437789.92
110,"Fiber, yarn, and thread mills",0,0,0,0,0,0
111,Broadwoven fabric mills,0,0,0,0,0,0
112,Narrow fabric mills and schiffli machine embroidery,0,0,0,0,0,0
113,Nonwoven fabric mills,55.54885483,22402151.11,3748072.147,-6098.187994,208317.2351,182532.4744
114,Knit fabric mills,0,0,0,0,0,0
115,Textile and fabric finishing mills,49.41190338,12747451.78,3127185.106,-1100.091846,55270.97732,85278.14597
116,Fabric coating mills,0,0,0,0,0,0
117,Carpet and rug mills,1.472764611,426865.2797,45068.62164,-2277.905121,2047.42793,4922.108725
118,Curtain and linen mills,21.2921505,3930532.932,781403.1243,-6062.596105,20943.86518,32838.62397
119,Textile bag and canvas mills,22.55387497,3628999.949,1153859.735,-3005.51462,18710.15877,26491.57494
120,"Rope, cordage, twine, tire cord and tire fabric mills",0,0,0,0,0,0
121,Other textile product mills,61.98280716,9015540.123,3154547.453,-14022.74799,43398.41753,65227.59795
122,Hosiery and sock mills,12.81049061,1114983.082,276132.5538,32103.26284,93930.65423,27785.08328
123,Other apparel knitting mills,12.81054783,1174723.625,276132.5538,31669.16594,68817.64531,27026.67005
124,Cut and sew apparel contractors,44.30303574,1816513.538,368672.6987,33240.47104,16513.49477,35373.35992
125,Mens and boys cut and sew apparel manufacturing,12.80995369,1574825.406,276132.5538,31370.46099,82771.87496,27738.94928
126,Womens and girls cut and sew apparel manufacturing,12.80976582,2336519.241,276132.5538,31151.1755,80282.49443,26017.82978
127,Other cut and sew apparel manufacturing,51.38169861,4456204.891,1497271.061,32968.67758,-891913.7716,48510.82712
128,Apparel accessories and other apparel manufacturing,93.85579681,6963285.446,2114997.864,36384.81721,-1464515.209,67382.49213
129,Leather and hide tanning and finishing,0,0,0,0,0,0
130,Footwear manufacturing,0,0,0,0,0,0
131,Other leather and allied product manufacturing,15.88456059,1482005.239,574766.6955,-3898.811061,-241493.1208,8466.899395
132,Sawmills,0,0,0,0,0,0
133,Wood preservation,19.28595161,6270256.519,837985.456,875258.3265,-3623045.683,93308.64251
134,Veneer and plywood manufacturing,5.574299335,1857054.71,89993.45452,796253.1447,-92066.87659,11833.32317
135,Engineered wood member and truss manufacturing,92.87593842,19020734.79,4270595.551,3467419.863,-2683448.315,156322.1961
136,Reconstituted wood product manufacturing,0,0,0,0,0,0
137,Wood windows and door manufacturing,15.55187511,3363483.191,789290.4282,779877.4838,-552685.4396,29245.5107
138,"Cut stock, resawing lumber, and planing",16.18993187,3034300.327,598703.0864,868339.5386,-885944.128,31745.37793
139,"Other millwork, including flooring",37.85294724,8563520.432,1198591.709,3370140.314,-978904.0685,64903.28908
140,Wood container and pallet manufacturing,100.3389511,15244374.28,4348097.324,2474133.73,-1459563.136,123606.3465
141,Manufactured home (mobile home) manufacturing,0,0,0,0,0,0
142,Prefabricated wood building manufacturing,61.79202652,10793732.64,2957371.235,1856134.772,-760741.1146,85156.35133
143,All other miscellaneous wood product manufacturing,51.86898041,9864649.773,1805534.959,3287978.649,-1095253.11,74107.19246
144,Pulp mills,0,0,0,0,0,0
145,Paper mills,0,0,0,0,0,0
146,Paperboard mills,0,0,0,0,0,0
147,Paperboard container manufacturing,187.4337311,99873168.95,18458354.95,35242.93378,10827295.3,661640.5249
148,Paper bag and coated and treated paper manufacturing,521.8936157,273484161.4,48868270.87,11979.6358,46382003.78,1726828.575
149,Stationery product manufacturing,0,0,0,0,0,0
150,Sanitary paper product manufacturing,580.1174316,560502380.4,63763278.96,75944.46093,174025421.1,3467874.289
151,All other converted paper product manufacturing,21.5737381,6436257.362,853192.8658,119782.8725,488904.8636,53924.91072
152,Printing,661.8029175,86711715.7,28897729.87,4224268.913,-4815218.449,1020749.807
153,Support activities for printing,18.21567917,1634770.274,854432.0464,55934.14977,-198643.5652,18981.49773
154,Petroleum refineries,598.1890259,4573064453,140444076.5,931879.2224,479151306.2,28914796.83
155,Asphalt paving mixture and block manufacturing,47.51059723,36427654.27,4616441.25,369047.8802,1269860.744,87497.23434
156,Asphalt shingle and coating materials manufacturing,74.23294067,61762874.6,8516455.65,172221.0199,8967593.193,273299.6941
157,Petroleum lubricating oil and grease manufacturing,29.26761436,30360826.49,3424834.49,210751.012,4319279.671,116735.3541
158,All other petroleum and coal products manufacturing,0,0,0,0,0,0
159,Petrochemical manufacturing,0,0,0,0,0,0
160,Industrial gas manufacturing,48.19665146,66874610.9,7217092.037,336094.2304,23343772.89,1817962.885
161,Synthetic dye and pigment manufacturing,184.3568726,185349685.7,24181684.49,203190.1181,60408306.12,4068574.429
162,Other basic inorganic chemical manufacturing,214.4074097,221031082.2,29693607.33,160181.9396,67299133.3,5536178.589
163,Other basic organic chemical manufacturing,678.31073,1173290039,102290283.2,315171.3312,187350387.6,29732986.45
164,Plastics material and resin manufacturing,317.1273499,451956726.1,41203907.01,0,49169078.83,12670247.08
165,Synthetic rubber manufacturing,0,0,0,0,0,0
166,Artificial and synthetic fibers and filaments manufacturing,265.553772,223970077.5,31248886.11,0,28026744.84,5202133.656
167,Nitrogenous fertilizer manufacturing,42.78669739,54413440.7,5277171.612,599771.7977,14896705.63,1369144.917
168,Phosphatic fertilizer manufacturing,0,0,0,0,0,0
169,Fertilizer mixing,44.85720444,32547348.02,3071765.661,3065932.751,7204795.837,790695.0116
170,Pesticide and other agricultural chemical manufacturing,0,0,0,0,0,0
171,Medicinal and botanical manufacturing,7.503704071,15549999.24,4094636.44,772865.5338,7831868.172,124474.9054
172,Pharmaceutical preparation manufacturing,55.91902542,82618164.06,2873447.418,10156975.75,16668380.74,5511031.151
173,In-vitro diagnostic substance manufacturing,361.0264893,196964904.8,44996238.71,1300590.277,52622459.41,4137315.273
174,Biological product (except diagnostic) manufacturing,20.08560944,13208207.13,119474.2173,5429807.663,350948.3635,387008.6372
175,Paint and coating manufacturing,38.53107071,34963111.88,3335906.029,1205150.366,7617368.698,885068.5954
176,Adhesive manufacturing,3.886854649,2999650.955,327314.1384,266506.6123,498148.5307,69121.33098
177,Soap and other detergent manufacturing,14.28808594,24390981.67,1352019.191,3228058.338,7322021.961,539077.0435
178,Polish and other sanitation good manufacturing,201.3317108,195003479,28613065.72,3854882.479,69194229.13,4063876.152
179,Surface active agent manufacturing,44.22585297,71196594.24,6464879.513,3328569.412,29701120.38,1288850.069
180,Toilet preparation manufacturing,47.26682663,61606433.87,4563064.575,2987810.135,27832275.39,1452865.243
181,Printing ink manufacturing,46.44287109,22167125.7,4793851.852,790518.1646,235671.8928,562623.1432
182,Explosives manufacturing,0,0,0,0,0,0
183,Custom compounding of purchased resins,57.71999741,40682777.4,4686429.024,3751364.47,7635972.023,926059.1865
184,Photographic film and chemical manufacturing,0,0,0,0,0,0
185,Other miscellaneous chemical product manufacturing,72.58654785,58901443.48,6113321.304,12677437.78,6812335.014,1372794.032
186,Plastics packaging materials and unlaminated film and sheet manufacturing,985.5181885,480036224.4,79282432.56,934419.4531,76190010.07,3597364.426
187,Unlaminated plastics profile shape manufacturing,89.79113007,52874202.73,9546531.677,68841.30836,16996730.8,294300.4966
188,Plastics pipe and pipe fitting manufacturing,3.656808138,2310475.349,343195.3192,44361.84838,722930.0737,15588.99321
189,"Laminated plastics plate, sheet (except packaging), and shape manufacturing",120.7367172,44383457.18,8256266.594,137323.8415,10518117.9,331144.1839
190,Polystyrene foam product manufacturing,27.73484421,11764013.29,2436948.061,123344.2053,2313981.056,88083.72915
191,Urethane and other foam product (except polystyrene) manufacturing,64.81774902,28418462.75,4964148.521,1479399.204,4530846.596,205113.9325
192,Plastics bottle manufacturing,164.1817932,85862541.2,16581413.27,509064.4956,15581783.29,562311.7685
193,Other plastics product manufacturing,259.4768372,73171150.21,12949017.52,1256723.762,9290039.063,597380.8169
194,Tire manufacturing,6.777139664,2724733.829,438796.5798,93019.96976,217673.7487,28966.21451
195,Rubber and plastics hoses and belting manufacturing,27.35440063,9588544.846,2181545.973,95216.49778,1929725.885,68443.81988
196,Other rubber product manufacturing,27.59766579,9093936.92,1595509.171,75169.30997,1128550.768,78896.8578
197,"Pottery, ceramics, and plumbing fixture manufacturing",32.31918716,6427399.158,2608662.128,754712.8201,217313.841,54351.24785
198,"Brick, tile, and other structural clay product manufacturing",87.08983612,24674385.07,7637789.249,1655688.167,1832294.583,268927.7232
199,Flat glass manufacturing,0,0,0,0,0,0
200,Other pressed and blown glass and glassware manufacturing,7.424950123,1898246.169,66647.20178,739551.9614,8794.564754,16046.15152
201,Glass container manufacturing,0,0,0,0,0,0
202,Glass product manufacturing made of purchased glass,5.116684914,1166224.003,106164.3437,243330.7767,20421.65026,12461.4425
203,Cement manufacturing,0,0,0,0,0,0
204,Ready-mix concrete manufacturing,326.9802551,123973724.4,23794185.64,1976672.769,5017829.895,1305454.016
205,Concrete block and brick manufacturing,51.31809235,14724075.32,3235584.736,86855.82131,872835.5169,196596.2797
206,Concrete pipe manufacturing,39.26050949,10737459.18,2618601.799,18956.64074,532505.5718,148834.1242
207,Other concrete product manufacturing,62.61897278,13354780.2,3618893.862,209854.2899,519573.7481,147799.3727
208,Lime manufacturing,0,0,0,0,0,0
209,Gypsum product manufacturing,11.43273354,5316714.287,410212.9638,250628.0541,205790.9966,72422.72794
210,Abrasive product manufacturing,0,0,0,0,0,0
211,Cut stone and stone product manufacturing,46.85998154,7105449.677,1434046.149,2030820.847,70308.76726,60652.46835
212,Ground or treated mineral and earth manufacturing,0,0,0,0,0,0
213,Mineral wool manufacturing,0,0,0,0,0,0
214,Miscellaneous nonmetallic mineral products manufacturing,17.33911514,5860020.638,956593.7519,299630.5823,452121.4962,73158.57708
215,Iron and steel mills and ferroalloy manufacturing,98.42082977,94742225.65,9430014.61,-31035.4773,6889612.675,1296400.07
216,"Iron, steel pipe and tube manufacturing from purchased steel",47.95648956,20060834.88,3495487.69,-10600.59108,1828025.46,269121.9151
217,Rolled steel shape manufacturing,15.47619915,9466856.956,895825.5649,-18360.33165,1201264.858,132423.2072
218,Steel wire drawing,0,0,0,0,0,0
219,Alumina refining and primary aluminum production,31.66763115,22500064.85,2385881.901,-45089.54659,1913016.677,290652.1559
220,Secondary smelting and alloying of aluminum,0,0,0,0,0,0
221,"Aluminum sheet, plate, and foil manufacturing",0,0,0,0,0,0
222,"Other aluminum rolling, drawing and extruding",0,0,0,0,0,0
223,Nonferrous metal (exc aluminum) smelting and refining,0,0,0,0,0,0
224,"Copper rolling, drawing, extruding and alloying",24.17847061,20667949.68,1590223.074,-26450.92644,754549.4437,241295.9188
225,"Nonferrous metal, except copper and aluminum, shaping",0,0,0,0,0,0
226,Secondary processing of other nonferrous metals,0,0,0,0,0,0
227,Ferrous metal foundries,3.142469406,796000.6595,141052.0822,-14190.16439,151062.7717,11935.72674
228,Nonferrous metal foundries,0,0,0,0,0,0
229,Custom roll forming,0,0,0,0,0,0
230,Crown and closure manufacturing and metal stamping,14.17300987,3809365.749,1026055.813,7641.103584,316018.5814,39734.09534
231,Iron and steel forging,0,0,0,0,0,0
232,Nonferrous forging,0,0,0,0,0,0
233,"Cutlery, utensil, pot, and pan manufacturing",0,0,0,0,0,0
234,Handtool manufacturing,3.592370987,721455.3356,171879.4405,25529.60999,72712.42887,10835.33932
235,Prefabricated metal buildings and components manufacturing,2.354862928,629046.2017,116778.329,10186.6303,32215.06253,8989.900351
236,Fabricated structural metal manufacturing,331.3673401,96028587.34,18109249.11,291373.9085,5971220.97,1311263.442
237,Plate work manufacturing,139.2501984,28090883.26,8624516.487,55025.44343,84594.82342,362090.1108
238,Metal window and door manufacturing,20.63788033,4956860.065,1293612.957,20517.21886,461691.4988,63453.80843
239,Sheet metal work manufacturing,487.1080627,103658721.9,33211807.25,232609.7339,6462600.231,1195999.861
240,Ornamental and architectural metal work manufacturing,45.9913063,10075545.31,3125823.975,27662.05743,720490.1576,113190.6286
241,Power boiler and heat exchanger manufacturing,9.514381409,2817963.839,825711.0119,18709.04304,233616.218,35117.84971
242,Metal tank (heavy gauge) manufacturing,0.605511963,126845.777,13185.58026,10981.02797,1877.563656,1938.472968
243,Metal cans manufacturing,0,0,0,0,0,0
244,"Metal barrels, drums and pails manufacturing",0,0,0,0,0,0
245,Hardware manufacturing,0,0,0,0,0,0
246,Spring and wire product manufacturing,6.945456982,1753788.233,459451.9138,14154.99765,111990.5114,20188.87177
247,Machine shops,314.940979,48776172.64,22326965.33,675475.7762,2257563.353,522611.4988
248,"Turned product and screw, nut, and bolt manufacturing",0,0,0,0,0,0
249,Metal heat treating,21.60452271,5576550.007,1589585.066,15476.76604,597863.0781,68003.74389
250,Metal coating and nonprecious engraving,31.56088448,6877650.261,1506129.026,99515.61689,793482.8997,89324.33277
251,"Electroplating, anodizing, and coloring metal",29.18922806,3901419.64,1401494.026,34511.20481,101549.8862,46791.03196
252,"Valve and fittings, other than plumbing, manufacturing",73.58628845,30515426.64,10811141.97,70904.29962,4486306.667,306925.6842
253,Plumbing fixture fitting and trim manufacturing,48.14439774,34784267.43,6626001.358,9244.897403,8564771.652,483884.8114
254,Ball and roller bearing manufacturing,20.45033455,8017646.79,2700323.343,7593.370043,1499401.689,67707.40449
255,Small arms ammunition manufacturing,0,0,0,0,0,0
256,"Ammunition, except for small arms, manufacturing",0,0,0,0,0,0
257,"Small arms, ordnance, and accessories manufacturing",0,0,0,0,0,0
258,Fabricated pipe and pipe fitting manufacturing,109.8917389,29373826.98,13317793.85,158968.0761,1408955.336,293631.8815
259,Other fabricated metal manufacturing,0,0,0,0,0,0
260,Farm machinery and equipment manufacturing,0,0,0,0,0,0
261,Lawn and garden equipment manufacturing,0,0,0,0,0,0
262,Construction machinery manufacturing,0,0,0,0,0,0
263,Mining machinery and equipment manufacturing,0,0,0,0,0,0
264,Oil and gas field machinery and equipment manufacturing,0,0,0,0,0,0
265,Semiconductor machinery manufacturing,0,0,0,0,0,0
266,Food product machinery manufacturing,0,0,0,0,0,0
267,"Sawmill, woodworking, and paper machinery",0,0,0,0,0,0
268,Printing machinery and equipment manufacturing,82.48152161,23841165.54,6527069.092,-19132.39062,2552666.187,203438.1032
269,All other industrial machinery manufacturing,224.96698,73182624.82,18115617.75,-36703.19542,16742658.62,541342.9737
270,Optical instrument and lens manufacturing,44.37747955,20258880.62,4044871.33,-25703.15264,6687990.665,117887.6832
271,Photographic and photocopying equipment manufacturing,0,0,0,0,0,0
272,Other commercial service industry machinery manufacturing,19.5718956,5281453.133,188267.8717,-142846.8227,426771.1043,73073.12638
273,Air purification and ventilation equipment manufacturing,0,0,0,0,0,0
274,Heating equipment (except warm air furnaces) manufacturing,0,0,0,0,0,0
275,"Air conditioning, refrigeration, and warm air heating equipment manufacturing",62.09980392,36044357.3,5293749.809,-79915.68744,13148295.4,289052.8738
276,Industrial mold manufacturing,0,0,0,0,0,0
277,"Special tool, die, jig, and fixture manufacturing",0,0,0,0,0,0
278,Cutting tool and machine tool accessory manufacturing,59.50059509,10643067.36,3207758.904,-24439.38516,926255.1665,99117.49512
279,Machine tool manufacturing,52.17707062,9236662.865,1176532.388,-314004.2722,430756.1219,107506.6924
280,Rolling mill and other metalworking machinery manufacturing,0,0,0,0,0,0
281,Turbine and turbine generator set units manufacturing,0,0,0,0,0,0
282,"Speed changer, industrial high-speed drive, and gear manufacturing",84.51264191,31339256.29,6456382.751,-16673.12346,8989522.934,235644.9515
283,Mechanical power transmission equipment manufacturing,0,0,0,0,0,0
284,Other engine equipment manufacturing,0,0,0,0,0,0
285,Pump and pumping equipment manufacturing,9.864308357,4761119.843,610465.5266,-28983.83886,1341105.461,43319.47863
286,Air and gas compressor manufacturing,0,0,0,0,0,0
287,Elevator and moving stairway manufacturing,0,0,0,0,0,0
288,Conveyor and conveying equipment manufacturing,30.59484863,7040629.864,2123586.416,-44460.25565,151966.4079,74115.24653
