IndustryCode,Description,Employment,Output,EmployeeCompensation,ProprietorIncome,OtherPropertyTypeIncome,TaxOnProductionAndImports
0,Total,7928498.405,1.54748E+12,4.68921E+11,54158685431,2.84445E+11,60116426256
1,Oilseed farming,11453.8877,6251526367,8833423.615,1034025391,1449730469,-2563276.291
2,Grain farming,33146.50781,8393161133,333711517.3,580005554.2,1256541138,18768791.2
3,Vegetable and melon farming,812.4422607,110466194.2,11787714,3433204.651,9676516.533,8806.53318
4,Fruit farming,215.3726044,20402959.82,2091093.779,745343.8044,2505087.852,2181.73163
5,Tree nut farming,16.80626869,819915.3543,285304.6954,24018.87253,14669.38481,138.5945798
6,"Greenhouse, nursery, and floriculture production",2911.698242,403048614.5,69291641.24,11539965.63,28033212.66,13953.42685
7,Tobacco farming,7.36615181,752789.557,135344.3414,28110.79286,78378.71462,-11587.12432
8,Cotton farming,0,0,0,0,0,0
9,Sugarcane and sugar beet farming,0,0,0,0,0,0
10,All other crop farming,3177.384277,75836448.67,13108261.11,2471690.655,5481717.587,-2868622.065
11,"Beef cattle ranching and farming, including feedlots and dual-purpose ranching and farming",5391.172852,614077941.9,5149215.221,31513690.95,66945144.65,10066019.06
12,Dairy cattle and milk production,596.0020752,309869995.1,7708699.226,5781083.584,11502230.64,3629897.833
13,Poultry and egg production,279.8065186,172117385.9,5549937.725,797448.7543,2576349.735,732415.1993
14,"Animal production, except cattle and poultry and eggs",12562.87598,1308870728,78658500.67,178680267.3,320337982.2,21966997.15
15,"Forestry, forest products, and timber tract production",698.1580811,53424781.8,34252693.18,256311.2378,4483862.877,812567.5321
16,Commercial logging,1172.277222,84818504.33,36951717.38,720451.2954,5955817.223,1913249.493
17,Commercial fishing,456.2402039,5831638.336,588251.3523,-818180.4419,1381030.083,4583105.564
18,Commercial hunting and trapping,398.1503601,10883687.02,1017073.87,-65322.25013,45316.81538,3251569.271
19,Support activities for agriculture and forestry,10419.16211,495398651.1,271493835.4,197170745.8,-66267059.33,14495151.52
20,Oil and gas extraction,14250.26855,3342852295,40981616.97,60225425.72,-44968166.35,46866928.1
21,Coal mining,2660.929932,1144244385,266310363.8,9102292.061,292450958.3,88957420.35
22,"Copper, nickel, lead, and zinc mining",0,0,0,0,0,0
23,Iron ore mining,0,0,0,0,0,0
24,Gold ore mining,49.98234177,15304809.57,196390.5841,2540242.195,142334.9231,1866778.851
25,Silver ore mining,0,0,0,0,0,0
26,Uranium-radium-vanadium ore mining,0,0,0,0,0,0
27,Other metal ore mining,65.74842834,16144847.87,15547.49906,1854653.597,12602.0601,1680228.233
28,Stone mining and quarrying,1931.009033,661928894,152080535.9,6088627.815,239395752,34171669.01
29,Sand and gravel mining,1547.598633,360325927.7,139141647.3,7106737.137,62367012.02,23102861.4
30,"Other clay, ceramic, refractory minerals mining",49.34120941,9306089.401,2055887.461,258899.6589,989095.9263,708940.804
31,"Potash, soda, and borate mineral mining",0,0,0,0,0,0
32,Phosphate rock mining,0,0,0,0,0,0
33,Other chemical and fertilizer mineral mining,152.465332,34062278.75,7927115.917,1757755.995,5177475.929,3230686.665
34,Other nonmetallic minerals,16.74865723,2317926.645,239407.897,304507.643,115073.0774,267795.9204
35,Drilling oil and gas wells,1417.241943,349543396,17206136.7,-2759363.651,4022247.314,7020620.823
36,Support activities for oil and gas operations,2804.922607,543616638.2,57527931.21,-14822178.84,15716509.82,15654261.59
37,Metal mining services,1546.98938,354517395,4814922.333,4424143.314,-4685301.304,5139657.497
38,Other nonmetallic minerals services,1771.524902,431153961.2,25176149.37,3628888.13,4861608.028,7063269.615
39,Electric power generation - Hydroelectric,248.2084808,165031982.4,42710262.3,0,50161365.51,14344821.93
40,Electric power generation - Fossil fuel,3129.723633,4407056152,471428680.4,16978555.68,759021728.5,560224853.5
41,Electric power generation - Nuclear,3837.602051,3865148438,832872619.6,0,613196411.1,442964752.2
42,Electric power generation - Solar,767.9379272,201278381.3,8641860.962,58055271.15,9632633.209,23626007.08
43,Electric power generation - Wind,1208.159302,1495909912,111874465.9,42469280.24,502877990.7,169921875
44,Electric power generation - Geothermal,0,0,0,0,0,0
45,Electric power generation - Biomass,174.6646729,72872055.05,4170910.358,10189538,5791926.861,7921178.818
46,Electric power generation - All other,147.6302032,29113958.36,1789896.965,8681757.927,-1652899.027,2738137.484
47,Electric power transmission and distribution,11146.34277,15295783203,1840314087,32080360.41,2830423584,1854838623
48,Natural gas distribution,4765.268555,3456038574,547141296.4,11062558.17,625053955.1,305932251
49,"Water, sewage and other systems",1972.926392,534396362.3,125915763.9,51134819.03,89456253.05,42120311.74
50,Construction of new health care structures,10276.33301,1643397217,516129577.6,154795074.5,329162231.4,10656507.49
51,Construction of new manufacturing structures,16762.45703,2610522217,861657592.8,247002502.4,305281372.1,15624772.07
52,Construction of new power and communication structures,22671.5918,4347049316,1150144043,347346862.8,1158905762,50015361.79
53,Construction of new educational and vocational structures,27193.32617,3893400879,1516836426,324864440.9,672119567.9,16732593.54
54,Construction of new highways and streets,21174.42578,4576005859,1124020142,300185394.3,1097890381,20413991.93
55,"Construction of new commercial structures, including farm structures",40748.36719,5390598633,1956713989,605503112.8,485725494.4,52690025.33
56,Construction of other new nonresidential structures,51052.26563,4388289063,2543100098,780207824.7,-1298790039,31369920.73
57,Construction of new single-family residential structures,62471.33203,9473434570,3028774902,1002046082,1581394043,159968215.9
58,Construction of new multifamily residential structures,19319.10938,2283030273,943841980,308742645.3,544884765.6,26286489.49
59,Construction of other new residential structures,43836.91016,9150632813,2187851318,679472656.3,1483936890,71356208.8
60,Maintenance and repair construction of nonresidential structures,29744.92578,6225561523,1475285156,470760070.8,820877685.5,50103759.77
61,Maintenance and repair construction of residential structures,14369.13867,3128099365,670532104.5,202852981.6,482241302.5,54321891.78
62,"Maintenance and repair construction of highways, streets, bridges, and tunnels",10858.97656,1124029175,548054382.3,169658935.5,-204908737.2,12922126.77
63,Dog and cat food manufacturing,830.2009888,1106278320,53571186.07,-1437850.237,155972595.2,19271327.97
64,Other animal food manufacturing,2122.412598,2221967041,168604476.9,1615310.55,116444709.8,42879665.37
65,Flour milling,1010.294678,1193130859,95329940.8,-338481.009,105148246.8,6139760.017
66,Rice milling,1.874760747,1157383.561,34140.37079,-17785.1487,25557.33547,5260.495003
67,Malt manufacturing,23.53043365,33485103.61,907430.8276,-36476.07192,1682073.474,238377.7797
68,Wet corn milling,6242.297852,12310783203,868547180.2,-62250.10008,1161246338,80031990.05
69,Soybean and other oilseed processing,825.538147,3860815430,62871902.47,-64067.37119,261201080.3,20291959.76
70,Fats and oils refining and blending,619.9246826,1002582581,54991138.46,-385497.3316,55236122.13,5312414.169
71,Breakfast cereal manufacturing,860.8502808,783747985.8,87081428.53,-272174.8352,133444229.1,4498585.224
72,Beet sugar manufacturing,78.49724579,51360984.8,5162490.845,-23514.95251,6250195.98,487077.9812
73,Sugar cane mills and refining,16.90369797,17082321.17,1340877.175,-45755.69555,1789492.965,99032.78202
74,Nonchocolate confectionery manufacturing,2938.431396,1363174316,269992034.9,-1038284.779,134189025.9,6625828.743
75,Chocolate and confectionery manufacturing from cacao beans,982.3389282,705984069.8,80398818.97,-223903.1792,94678077.7,4428460.121
76,Confectionery manufacturing from purchased chocolate,3935.625732,1556270752,324256012,-1361571.193,151952652,7711637.497
77,"Frozen fruits, juices and vegetables manufacturing",579.473938,259029968.3,32082725.52,-468454.1821,29358400.34,1519735.336
78,Frozen specialties manufacturing,2731.545654,1073302856,178982360.8,-1294493.318,100086898.8,4654807.568
79,Canned fruits and vegetables manufacturing,1662.375977,1027293701,202279922.5,-666502.7142,176516525.3,3972270.727
80,Canned specialties,252.3196716,208606109.6,15439933.78,-157959.1334,23775062.56,953209.877
81,Dehydrated food products manufacturing,991.5072632,461172882.1,65552932.74,-718607.9621,60169143.68,2322198.629
82,Cheese manufacturing,1466.647705,1336522827,101553512.6,-1033878.088,43932975.77,7298232.079
83,"Dry, condensed, and evaporated dairy product manufacturing",1204.535034,1593006836,83282928.47,-325145.3936,140868454,8889564.514
84,Fluid milk manufacturing,2642.102539,1927565796,174200103.8,-219432.1305,122424980.2,12468785.29
85,Creamery butter manufacturing,136.2843018,245616882.3,7729567.528,-13151.21725,24706075.67,2357688.189
86,Ice cream and frozen dessert manufacturing,781.7407227,332523986.8,42931823.73,-578624.1889,26321542.74,2296510.22
87,Frozen cakes and other pastries manufacturing,6793.817871,607516784.7,210751068.1,4723352.432,60542331.7,59536537.17
88,Poultry processing,159.1451111,59635185.24,15674550.06,-174680.1585,5535628.319,248109.296
89,"Animal, except poultry, slaughtering",5997.393555,4143760742,363124725.3,-667384.5649,136080917.4,28254396.44
90,Meat processed from carcasses,12286.09863,6441532715,812811645.5,-955281.198,62294006.35,37377548.22
91,Rendering and meat byproduct processing,469.6703796,191900436.4,42346954.35,882013.2613,6357931.137,1604659.081
92,Seafood product preparation and packaging,200.2874146,77672119.14,9489720.345,-805093.1096,2591387.51,575027.9427
93,"Bread and bakery product, except frozen, manufacturing",22084.42969,3285890625,1011487610,-9989057.541,367844543.5,74559608.46
94,Cookie and cracker manufacturing,1391.486084,523283691.4,104812294,-577547.4906,51468318.94,3008936.167
95,"Dry pasta, mixes, and dough manufacturing",4025.190186,2281863770,224547500.6,-697287.6191,326900390.6,14861331.94
96,Tortilla manufacturing,1316.602417,323637207,91887428.28,-305564.8506,20840953.83,1882576.585
97,Roasted nuts and peanut butter manufacturing,720.0481567,341506256.1,51444435.12,-467446.4166,46461879.73,1158635.736
98,Other snack food manufacturing,2032.118896,1090256592,141709579.5,-1236584.544,159157241.8,7292154.789
99,Coffee and tea manufacturing,622.2362061,389665771.5,28499563.22,-1255924.463,30098133.09,2442537.785
100,Flavoring syrup and concentrate manufacturing,886.3410034,2598548584,86994384.77,-793798.089,758909606.9,13134398.46
101,"Mayonnaise, dressing, and sauce manufacturing",786.5883789,454416931.2,54698524.48,-1000759.006,54564014.43,2560007.334
102,Spice and extract manufacturing,3072.187012,1822735107,287394775.4,-1490030.646,169889877.3,10285737.04
103,All other food manufacturing,5324.464844,1921088013,317556823.7,-5832139.969,122994094.8,9702932.358
104,Bottled and canned soft drinks & water,4310.782715,3198180908,289541961.7,4749767.303,327694458,28456569.67
105,Manufactured ice,220.7577972,29888181.69,10056650.16,368996.6202,-5394162.178,275106.9665
106,Breweries,2308.143311,1057372559,100177322.4,13569870,151037429.8,84260543.82
107,Wineries,651.9697876,198353210.4,17512716.29,3592666.149,12617200.85,6400251.865
108,Distilleries,563.6613159,670406799.3,48025756.84,2981404.781,138001205.4,141818069.5
109,Tobacco product manufacturing,84.94873047,292988616.9,8674040.794,163370.043,98649658.2,69671279.91
110,"Fiber, yarn, and thread mills",69.44467926,24389181.14,4065182.209,71473.62083,1811876.655,339120.5966
111,Broadwoven fabric mills,67.70315552,15695537.57,2675556.898,178598.5827,1231506.824,209649.5181
112,Narrow fabric mills and schiffli machine embroidery,181.5822144,32806098.94,10258121.49,79132.43026,1145247.34,335773.7064
113,Nonwoven fabric mills,230.3713074,105159980.8,14367173.19,52610.94496,13678037.64,1295896.53
114,Knit fabric mills,22.42586327,5060008.049,1078238.964,64307.04892,391225.8446,63324.25773
115,Textile and fabric finishing mills,387.3442383,101422256.5,19347618.1,748628.7355,5857418.537,1147627.711
116,Fabric coating mills,181.5257263,66548782.35,11486390.11,240154.8624,4253017.902,696390.9268
117,Carpet and rug mills,35.88514709,14155849.46,2649544.001,50555.19193,2061772.108,205497.6821
118,Curtain and linen mills,795.7823486,172431976.3,36619720.46,982768.1184,16812482.83,2103523.254
119,Textile bag and canvas mills,1321.970459,236158905,70401733.4,938381.8507,19554330.83,2660136.223
120,"Rope, cordage, twine, tire cord and tire fabric mills",63.53962326,17582429.89,3032408.953,176240.9657,2292176.485,239021.7185
121,Other textile product mills,812.6832275,119401191.7,33125736.24,1397567.63,7806162.357,1466118.217
122,Hosiery and sock mills,118.8634415,12030024.53,2880705.595,35184.62181,1210226.536,1547773.48
123,Other apparel knitting mills,146.5400238,14676940.92,3275804.52,93640.34235,939735.4126,1547393.918
124,Cut and sew apparel contractors,670.3032227,35074375.15,11645677.57,463836.7295,410473.6149,1936585.426
125,Mens and boys cut and sew apparel manufacturing,1944.61377,293650848.4,94390541.08,653060.4362,17854103.09,5143477.44
126,Womens and girls cut and sew apparel manufacturing,343.745575,61672611.24,5658172.607,396133.244,1920398.593,2096612.692
127,Other cut and sew apparel manufacturing,928.3129272,112425697.3,34789718.63,357232.6005,6343167.305,2834419.727
128,Apparel accessories and other apparel manufacturing,1047.442505,137665329,55567832.95,496634.99,9426352.501,2880884.171
129,Leather and hide tanning and finishing,215.1662903,68157302.86,9458502.769,340968.9367,4019901.276,957968.9503
130,Footwear manufacturing,381.2390747,71111228.94,23256706.24,118544.8095,1525146.604,939421.1769
131,Other leather and allied product manufacturing,575.4262695,66817169.19,23448030.47,505463.3021,511474.0729,904295.3849
132,Sawmills,531.9248047,134239486.7,17536989.21,-711096.108,8773967.743,1667428.732
133,Wood preservation,398.8379211,237323791.5,20607896.8,-279979.5866,47124767.3,2635272.026
134,Veneer and plywood manufacturing,138.7263031,33725791.93,4876505.852,-154762.7896,2446300.03,400718.3611
135,Engineered wood member and truss manufacturing,400.2150879,87221694.95,19092567.44,-158078.7599,7859488.964,919207.3345
136,Reconstituted wood product manufacturing,175.4873962,91581054.69,9548870.087,-18877.34793,14393372.54,1097357.273
137,Wood windows and door manufacturing,1026.184937,235535400.4,56402946.47,-342427.5517,23906305.31,2632311.344
138,"Cut stock, resawing lumber, and planing",66.03272247,14567357.06,2397707.701,-68425.32754,2184880.495,176971.6293
139,"Other millwork, including flooring",765.3609619,154418136.6,34906250,-622244.0004,19094768.52,1786980.271
140,Wood container and pallet manufacturing,2993.504395,456443328.9,130908569.3,-1614692.211,30989202.5,5037841.797
141,Manufactured home (mobile home) manufacturing,31.67069054,6891875.744,945934.5937,-54074.40662,782060.3251,100159.2129
142,Prefabricated wood building manufacturing,393.5223389,67274650.57,21044088.36,-209482.044,3311794.758,740736.8422
143,All other miscellaneous wood product manufacturing,978.3166504,174294464.1,47302986.15,-966460.8836,16801132.2,1906810.403
144,Pulp mills,8.434206009,6220441.341,876067.8172,489081.5318,297947.8538,74118.85262
145,Paper mills,489.8684692,414143707.3,68735786.44,7911773.205,53642822.27,4763506.413
146,Paperboard mills,548.8233643,442522338.9,41586879.73,13264792.44,28651245.12,6319019.318
147,Paperboard container manufacturing,12113.01855,5844224121,974290405.3,31771121.98,246984939.6,74453155.52
148,Paper bag and coated and treated paper manufacturing,3748.634766,1756646729,319799072.3,16350751.88,131176116.9,21599596.02
149,Stationery product manufacturing,842.0315552,343719818.1,64718986.51,5719457.626,13846934.32,4491313.934
150,Sanitary paper product manufacturing,124.8409348,99789924.62,12974993.71,1526183.367,15303975.11,1299600.124
151,All other converted paper product manufacturing,956.0557861,314905059.8,73303268.43,1243596.315,18153299.33,4151506.424
152,Printing,28883.57617,5490029785,2022959839,122512229.9,773501892.1,66593231.2
153,Support activities for printing,2171.498291,309715179.4,138919250.5,10371215.82,48994861.6,3655781.031
154,Petroleum refineries,3035.565918,26748449219,673620666.5,-20240856.17,6007426758,176854934.7
155,Asphalt paving mixture and block manufacturing,794.4233398,656290649.4,106302482.6,-31259273.53,76435653.69,1764552.236
156,Asphalt shingle and coating materials manufacturing,323.5963745,285556335.4,28777847.29,-14947897.91,79209838.87,1438308.835
157,Petroleum lubricating oil and grease manufacturing,1489.798096,1960289063,192924240.1,-10380848.88,636007690.4,7158069.611
158,All other petroleum and coal products manufacturing,318.8130493,321722747.8,43744075.78,-6674082.279,100857299.8,1822760.701
159,Petrochemical manufacturing,152.1622314,821901855.5,19591545.1,821489.9898,81201980.59,20489953.99
160,Industrial gas manufacturing,598.5564575,611186584.5,80475715.64,6753800.869,86855079.65,12871212.01
161,Synthetic dye and pigment manufacturing,346.0784912,240776931.8,29575292.59,1066640.019,24652484.89,4353413.582
162,Other basic inorganic chemical manufacturing,1494.494385,1258186401,231393981.9,4919088.84,174992767.3,21995702.74
163,Other basic organic chemical manufacturing,2526.512451,3733990234,291814605.7,21253246.31,178339996.3,63163394.93
164,Plastics material and resin manufacturing,2688.264404,3512851074,339163848.9,19688453.67,135046936,61238647.46
165,Synthetic rubber manufacturing,151.1683655,127127121,10411663.06,1360212.088,3977249.861,2254858.255
166,Artificial and synthetic fibers and filaments manufacturing,246.9394073,177879104.6,14802516.94,7571681.023,4429913.044,2762518.406
167,Nitrogenous fertilizer manufacturing,200.6911469,208850280.8,23738796.23,7722209.454,22359869,3663826.466
168,Phosphatic fertilizer manufacturing,6.575180054,7100751.4,763957.0832,212597.7427,715652.2274,140311.5243
169,Fertilizer mixing,163.7214508,99919738.77,8828628.54,15324344.64,6909528.255,1648569.465
170,Pesticide and other agricultural chemical manufacturing,742.9165039,1106390991,83226226.81,3996195.078,114204200.7,20721868.52
171,Medicinal and botanical manufacturing,1386.572021,785977539.1,157841430.7,10574831.01,100737823.5,13071051.6
172,Pharmaceutical preparation manufacturing,13802.63184,22539582031,3419264893,29329299.93,6618270020,770803588.9
173,In-vitro diagnostic substance manufacturing,866.7891846,369640075.7,96774543.76,3975172.758,37763965.61,5661777.02
174,Biological product (except diagnostic) manufacturing,707.0248413,407964691.2,78633369.45,965171.3967,77072151.18,7671988.964
175,Paint and coating manufacturing,3887.641357,2977267334,380532257.1,44307712.55,289937347.4,50882362.37
176,Adhesive manufacturing,1443.41748,902309692.4,127550087,12613644.6,64773353.58,14607149.12
177,Soap and other detergent manufacturing,2045.999268,2290202881,176642593.4,39395973.21,319201629.6,43796016.69
178,Polish and other sanitation good manufacturing,479.9895325,322492950.4,38878501.89,33865097.05,31371589.66,5533874.035
179,Surface active agent manufacturing,976.2068481,972780212.4,111112022.4,3831860.781,170331497.2,16188323.97
180,Toilet preparation manufacturing,3102.603516,2457597168,233042327.9,70005004.88,474294860.8,54319740.3
181,Printing ink manufacturing,1184.67981,528864074.7,108820503.2,7445746.422,1785070.658,8177603.722
182,Explosives manufacturing,252.4958344,89339714.05,18086423.87,1145352.84,1572459.817,1547783.971
183,Custom compounding of purchased resins,883.8564453,488408264.2,69085426.33,11039582.25,37560405.73,8069830.894
184,Photographic film and chemical manufacturing,705.6066284,483692382.8,51380844.12,7825450.897,41623348.24,8332739.83
185,Other miscellaneous chemical product manufacturing,1931.313965,1172869751,190978012.1,40686241.15,71010673.52,20749885.56
186,Plastics packaging materials and unlaminated film and sheet manufacturing,5313.007324,2589619629,447966796.9,5955674.171,385180236.8,25198850.63
187,Unlaminated plastics profile shape manufacturing,1227.083984,604124389.6,93691833.5,1079857.23,149251495.4,5225749.493
188,Plastics pipe and pipe fitting manufacturing,577.8638306,302729492.2,38815288.54,396407.336,73156837.46,3197362.661
189,"Laminated plastics plate, sheet (except packaging), and shape manufacturing",695.2062988,250899612.4,48233036.04,449934.6316,54978904.72,2477242.231
190,Polystyrene foam product manufacturing,1454.448853,540827880.9,95299530.03,1875542.164,80965766.91,5999943.733
191,Urethane and other foam product (except polystyrene) manufacturing,920.9525757,379312652.6,70950981.14,1704343.438,57941555.02,3778857.946
192,Plastics bottle manufacturing,1965.723389,890301391.6,134707840,3477834.94,113262367.2,8746751.785
193,Other plastics product manufacturing,23703.04102,7665778809,1880933350,23328678.13,1207400269,70874023.44
194,Tire manufacturing,4403.208984,1775191284,335632782,1639899.731,148971908.6,24421216.96
195,Rubber and plastics hoses and belting manufacturing,881.897522,278145446.8,57306610.11,1307279.706,45355834.96,2866456.985
196,Other rubber product manufacturing,2271.311035,808270202.6,175025650,2473196.507,110769630.4,8435296.059
197,"Pottery, ceramics, and plumbing fixture manufacturing",354.0073242,58943958.28,13814287.19,10159477.23,3448303.223,787287.3545
198,"Brick, tile, and other structural clay product manufacturing",574.8604126,178336074.8,46345302.58,8691071.51,33315074.92,2345572.71
199,Flat glass manufacturing,586.1306152,226969741.8,39930141.45,2969403.744,39543682.1,2977675.676
200,Other pressed and blown glass and glassware manufacturing,119.8597488,30468420.03,4010810.375,7302788.258,1585886.24,340925.2465
201,Glass container manufacturing,1075.077637,428577728.3,102313987.7,1773640.871,67381340.03,5296582.699
202,Glass product manufacturing made of purchased glass,1203.575317,324514312.7,68471427.92,28351928.71,39466533.66,3864844.799
203,Cement manufacturing,298.7936707,209502014.2,33334697.72,1056247.83,43962524.41,2824421.883
204,Ready-mix concrete manufacturing,3916.03833,1664848267,320856140.1,20189991,202750946,20666866.3
205,Concrete block and brick manufacturing,893.2175903,320809478.8,72693656.92,4992789.745,58760246.28,4525537.491
206,Concrete pipe manufacturing,345.3123779,112547157.3,28084445.95,369540.4232,17113073.35,1730792.88
207,Other concrete product manufacturing,2250.620117,611078613.3,191696395.9,11494709.01,82469390.87,7024534.702
208,Lime manufacturing,8.061585426,4654951.572,677781.7607,40953.35677,886089.0865,73673.73258
209,Gypsum product manufacturing,191.5969086,111001380.9,14240406.99,389822.6321,21406557.08,1601039.529
210,Abrasive product manufacturing,1369.535034,540039001.5,95957038.88,2851914.644,172684967,7145173.073
211,Cut stone and stone product manufacturing,1009.255249,150848999,54356987,11194904.33,7985630.035,1720617.771
212,Ground or treated mineral and earth manufacturing,308.7763672,208520492.6,32808509.83,2276690.483,57069561,2551492.214
213,Mineral wool manufacturing,254.2381897,111180816.7,17568866.73,1044298.291,23350120.54,1578611.374
214,Miscellaneous nonmetallic mineral products manufacturing,306.7502136,132338302.6,22887413.02,3172972.918,32413936.61,1710017.085
215,Iron and steel mills and ferroalloy manufacturing,4441.850586,4203652344,472156189,-4296973.705,180573364.3,73020751.95
216,"Iron, steel pipe and tube manufacturing from purchased steel",2617.136719,1196613892,306243408.2,-1950078.964,83835273.74,18331518.17
217,Rolled steel shape manufacturing,1260.170898,772772949.2,100569503.8,-2619700.909,70593902.59,13423545.84
218,Steel wire drawing,338.0735474,123448616,26268682.48,-886646.688,10463843.35,2054150.82
219,Alumina refining and primary aluminum production,15.24006748,8236714.363,417420.0892,-1173011.422,175197.8397,175961.9564
220,Secondary smelting and alloying of aluminum,142.5337982,132707916.3,10095297.81,-299098.7301,3148057.938,2155197.144
221,"Aluminum sheet, plate, and foil manufacturing",183.227356,148842422.5,17123800.28,-827077.0907,8955810.547,2586441.278
222,"Other aluminum rolling, drawing and extruding",805.9020386,335499267.6,54707660.68,-712994.0391,12577136.99,5308357.716
223,Nonferrous metal (exc aluminum) smelting and refining,40.745327,42448963.17,3901880.503,-339271.009,9862117.767,814287.2453
224,"Copper rolling, drawing, extruding and alloying",1918.922363,1706292969,197227081.3,-961522.5196,48987102.51,23874088.29
225,"Nonferrous metal, except copper and aluminum, shaping",450.2486572,189320938.1,36544826.51,-3163335.085,6064368.248,2811811.447
226,Secondary processing of other nonferrous metals,102.0266266,115939285.3,7270568.371,-1292727.232,12619530.68,2024881.601
227,Ferrous metal foundries,3023.895508,905094299.3,261636169.4,-4533887.386,146676757.8,14273025.51
228,Nonferrous metal foundries,3542.265381,806670776.4,233230819.7,-5746170.521,65478050.23,11734845.16
229,Custom roll forming,188.0355377,102633262.6,15419537.54,337772.1012,9365476.608,979162.1566
230,Crown and closure manufacturing and metal stamping,7156.70166,2088821533,551715087.9,2497666.359,295058166.5,17607057.57
231,Iron and steel forging,2767.377686,953035278.3,238417358.4,1204528.093,101942428.6,9343533.516
232,Nonferrous forging,389.1311035,110608139,25615997.31,477488.9946,7519386.768,1152048.349
233,"Cutlery, utensil, pot, and pan manufacturing",52.78020096,38374732.97,5483420.849,174173.8319,15958767.89,326465.8451
234,Handtool manufacturing,2207.539795,557156677.2,161055664.1,1287324.19,118307403.6,5816535.473
235,Prefabricated metal buildings and components manufacturing,1529.950684,467606811.5,109470161.4,1152645.826,52437702.18,5115712.166
