IndustryCode,Description,Employment,Output,EmployeeCompensation,ProprietorIncome,OtherPropertyTypeIncome,TaxOnProductionAndImports
236,Fabricated structural metal manufacturing,2745.222168,927618408.2,211313522.3,3003393.412,120987693.8,9534648.895
237,Plate work manufacturing,2277.873291,481590667.7,160443588.3,2987414.837,2732641.22,5200667.858
238,Metal window and door manufacturing,2334.278076,612270507.8,155274734.5,1850856.9,96227561.95,6298266.411
239,Sheet metal work manufacturing,4040.018799,918842041,289973297.1,3354147.434,97976966.86,8707660.675
240,Ornamental and architectural metal work manufacturing,1420.13562,337042358.4,103088462.8,1626971.722,41259578.7,3068251.133
241,Power boiler and heat exchanger manufacturing,81.78084564,29121969.22,9351770.401,257265.9254,4594306.469,264938.8909
242,Metal tank (heavy gauge) manufacturing,1229.953003,300543853.8,76368064.88,1052431.464,18882453.92,3424064.636
243,Metal cans manufacturing,2113.30127,1760624268,175341781.6,230440.9295,262362243.7,17714391.71
244,"Metal barrels, drums and pails manufacturing",1764.086182,559330200.2,129996780.4,533825.8147,33871055.6,5374416.828
245,Hardware manufacturing,1410.9646,478853942.9,90565116.88,1189525.604,67453796.39,5593854.904
246,Spring and wire product manufacturing,4465.125488,1230052856,336258850.1,2062621.593,142320037.8,11378916.74
247,Machine shops,16363.92676,2584565674,1147674561,16862564.09,201502380.4,23810710.91
248,"Turned product and screw, nut, and bolt manufacturing",10525.31445,2772351807,807761840.8,4642186.642,370647155.8,25999691.01
249,Metal heat treating,1563.656372,425475250.2,109470184.3,943922.6985,71493247.99,4319103.718
250,Metal coating and nonprecious engraving,2934.728027,757977966.3,177297042.8,3076208.115,162191482.5,7278180.599
251,"Electroplating, anodizing, and coloring metal",4912.51123,755179199.2,315085540.8,3581205.606,39643123.63,6908727.646
252,"Valve and fittings, other than plumbing, manufacturing",4851.992676,1675628296,393789337.2,1831431.27,283747802.7,17758253.1
253,Plumbing fixture fitting and trim manufacturing,753.2077026,496897796.6,58940292.36,201229.5276,132290222.2,6645341.396
254,Ball and roller bearing manufacturing,2244.321045,753837036.1,171172790.5,369780.7491,165039596.6,6521095.753
255,Small arms ammunition manufacturing,1041.977295,395385589.6,83041030.88,94304.83729,128471099.9,7979387.76
256,"Ammunition, except for small arms, manufacturing",0,0,0,0,0,0
257,"Small arms, ordnance, and accessories manufacturing",686.159668,270737182.6,43039394.38,454254.359,79847610.47,4124132.156
258,Fabricated pipe and pipe fitting manufacturing,960.0671997,219285537.7,77774986.27,962332.7255,14287495.61,2250914.097
259,Other fabricated metal manufacturing,7395.724121,1885833740,615972717.3,4931451.797,244867950.4,18868028.64
260,Farm machinery and equipment manufacturing,5037.183105,2249141113,392575103.8,2692715.406,185078231.8,28188106.54
261,Lawn and garden equipment manufacturing,1427.776611,759119140.6,80782135.01,751099.1693,74253173.83,8850531.578
262,Construction machinery manufacturing,13432.15527,10624015625,2185292236,3481559.992,2477328369,120064102.2
263,Mining machinery and equipment manufacturing,724.6116943,214381195.1,55265956.88,910839.498,17973243.71,2866023.54
264,Oil and gas field machinery and equipment manufacturing,28.48053551,8751136.78,1467673.54,132430.2107,313060.5221,146779.5074
265,Semiconductor machinery manufacturing,6.227033138,3256563.902,1013402.104,69918.32703,149091.2884,30528.94585
266,Food product machinery manufacturing,1278.310303,424451568.6,113457572.9,2382293.94,32929241.18,5361040.115
267,"Sawmill, woodworking, and paper machinery",307.0639648,83872970.58,25936107.64,321492.523,2611181.974,1147030.83
268,Printing machinery and equipment manufacturing,448.1741943,122147178.6,35026802.06,695809.7816,5887752.533,1330083.966
269,All other industrial machinery manufacturing,2875.705322,798940673.8,216193191.5,5100052.834,85878913.88,8327108.383
270,Optical instrument and lens manufacturing,212.3102417,72592460.63,15514239.31,241382.9267,11025408.74,678188.92
271,Photographic and photocopying equipment manufacturing,105.2702713,47479599,9167519.569,148122.0871,5823735.714,399788.022
272,Other commercial service industry machinery manufacturing,4734.86084,2003811157,421058960,5703147.888,410237121.6,21026615.14
273,Air purification and ventilation equipment manufacturing,1900.460327,540164428.7,134449417.1,1123731.494,71901885.99,6435770.512
274,Heating equipment (except warm air furnaces) manufacturing,774.2406006,233954818.7,57125103,821664.8102,37900787.35,2653171.778
275,"Air conditioning, refrigeration, and warm air heating equipment manufacturing",2601.049072,1146124634,193846679.7,2294213.533,206936767.6,14534091.95
276,Industrial mold manufacturing,2130.568359,397964141.8,165525955.2,2987405.062,31166959.76,3950240.612
277,"Special tool, die, jig, and fixture manufacturing",4329.378906,801295288.1,306687500,5742097.855,123307724,8141512.871
278,Cutting tool and machine tool accessory manufacturing,2361.050537,464641937.3,180124725.3,2109733.582,22355043.41,4729199.409
279,Machine tool manufacturing,2810.074707,674935302.7,207479827.9,5880680.084,32649513.24,6912555.695
280,Rolling mill and other metalworking machinery manufacturing,943.0303955,276005737.3,89296508.79,857792.0198,31968851.09,2621467.113
281,Turbine and turbine generator set units manufacturing,640.2107544,386524047.9,122803840.6,1143860.698,51070293.43,3118255.854
282,"Speed changer, industrial high-speed drive, and gear manufacturing",1683.699585,539466918.9,138217025.8,617896.7953,82714591.98,5645253.181
283,Mechanical power transmission equipment manufacturing,1113.73291,349044921.9,86165534.97,691867.1131,66859512.33,3488567.591
284,Other engine equipment manufacturing,3815.7229,4381396973,754237854,456189.9006,843023681.6,47536594.39
285,Pump and pumping equipment manufacturing,2150.975342,1066372681,228515487.7,1272706.747,215769805.9,11300682.07
286,Air and gas compressor manufacturing,886.5949097,477528259.3,96276489.26,1973353.386,73895637.51,5299535.275
287,Elevator and moving stairway manufacturing,1112.373047,532519958.5,99281875.61,675364.2559,76122772.22,5456589.699
288,Conveyor and conveying equipment manufacturing,1662.137817,406809783.9,138831710.8,1615047.455,4270114.899,4829864.025
289,"Overhead cranes, hoists, and monorail systems manufacturing",281.79422,158565811.2,27485113.14,355319.9172,33999198.91,1734389.305
290,"Industrial truck, trailer, and stacker manufacturing",1147.422119,471500732.4,97046829.22,701482.0576,65262100.22,5336531.162
291,Power-driven handtool manufacturing,124.869545,65332283.02,8748585.701,199157.2082,14845372.2,779809.8326
292,Welding and soldering equipment manufacturing,901.1344604,526574157.7,219626159.7,1984766.126,92753837.59,3468019.724
293,Packaging machinery manufacturing,2453.093262,852764831.5,208349838.3,2139327.765,141314621,8966787.338
294,Industrial process furnace and oven manufacturing,707.8101196,180892730.7,56717742.92,226251.7512,20428731.92,1860656.023
295,Fluid power cylinder and actuator manufacturing,991.5012817,320142578.1,98921485.9,602333.6649,48407226.56,3358075.142
296,Fluid power pump and motor manufacturing,2853.832764,1332891357,337700378.4,950631.7377,224761016.8,13679371.83
297,"Scales, balances, and miscellaneous general purpose machinery manufacturing",1705.729126,502075897.2,126851348.9,3172133.446,48867568.97,5464651.108
298,Electronic computer manufacturing,163.1218719,180730026.2,18567943.57,-64447.15708,29065723.42,4241503.716
299,Computer storage device manufacturing,4.92800808,8462389.946,990801.4536,-6799.516268,2202188.492,135140.3892
300,Computer terminals and other computer peripheral equipment manufacturing,694.1928711,459014465.3,87752067.57,-297554.4631,85246849.06,7496501.446
301,Telephone apparatus manufacturing,767.2678223,545481018.1,81221260.07,-64132.48181,91109848.02,11836631.77
302,Broadcast and wireless communications equipment manufacturing,1605.519043,752651184.1,248709732.1,-325583.6368,139918746.9,9956468.582
303,Other communications equipment manufacturing,861.7626343,344810699.5,81901679.99,-293875.7837,60808425.9,5403200.626
304,Audio and video equipment manufacturing,1766.6521,1188757935,287150238,-197939.2469,262581115.7,17454427.72
305,Printed circuit assembly (electronic assembly) manufacturing,2251.973145,796888244.6,143003768.9,-162986.204,105510635.4,13021267.89
306,Bare printed circuit board manufacturing,1745.492554,406392028.8,104919387.8,-287633.0614,40417911.53,7212235.451
307,Semiconductor and related device manufacturing,315.8679199,195286987.3,30625761.03,-233531.4602,29263673.78,3972670.078
308,"Capacitor, resistor, coil, transformer, and other inductor manufacturing",502.8208618,112474243.2,24867692.95,-66135.57041,10622693.06,1832018.852
309,Electronic connector manufacturing,737.6807861,333657440.2,111133033.8,-25086.36564,64873344.42,3935276.985
310,Other electronic component manufacturing,3086.618164,752460815.4,199839523.3,-433595.7468,28119413.38,12541809.08
311,Electromedical and electrotherapeutic apparatus manufacturing,1323.530151,719886047.4,144789474.5,-767148.7331,207929977.4,12792610.17
312,"Search, detection, and navigation instruments manufacturing",2660.574951,1321225342,364582824.7,-110479.6082,357654663.1,16804784.77
313,Automatic environmental control manufacturing,3313.885498,912274414.1,364347351.1,-131332.4869,122045875.5,13237509.73
314,Industrial process variable instruments manufacturing,1433.96106,443254577.6,126779274,-364239.5139,68606521.61,7653384.686
315,Totalizing fluid meter and counting device manufacturing,314.723877,150788879.4,30855592.73,-84959.55169,42906707.76,2518965.721
316,Electricity and signal testing instruments manufacturing,1155.044189,532207458.5,124796936,-281289.5179,67394393.92,9002828.598
317,Analytical laboratory instrument manufacturing,489.9807434,213248718.3,46582794.19,-105590.6415,44059230.8,3620324.373
318,Irradiation apparatus manufacturing,343.8526611,202637649.5,34689067.84,-119306.8475,43451820.37,3569589.615
319,"Watch, clock, and other measuring and controlling device manufacturing",818.9108276,300107513.4,75408393.86,-262998.3425,73660652.16,4706527.71
320,Blank magnetic and optical recording media manufacturing,8.769324303,10221288.68,693068.0871,-19119.48994,1756484.866,182780.0572
321,Software and other prerecorded and record reproducing,614.9902344,236657638.5,91399047.85,-529645.2045,49487400.05,3120562.792
322,Electric lamp bulb and part manufacturing,130.6884766,55449962.62,7066955.566,12336220.74,3487434.864,532836.4372
323,Lighting fixture manufacturing,2628.444824,945986328.1,238811035.2,60736656.19,91608985.9,7668546.677
324,Small electrical appliance manufacturing,1264.339844,682014831.5,140366210.9,7133728.981,110188728.3,7116313.457
325,Household cooking appliance manufacturing,440.3023376,248866272,40330642.7,11343072.89,40131629.94,2597884.417
326,Household refrigerator and home freezer manufacturing,542.0639038,367807769.8,52549335.48,10924248.7,72476257.32,3672802.925
327,Household laundry equipment manufacturing,528.8859863,355804992.7,49500068.66,11242369.65,40804115.3,3481245.518
328,Other major household appliance manufacturing,252.2277832,141621978.8,24437442.78,4442307.949,29369400.02,1386512.399
329,"Power, distribution, and specialty transformer manufacturing",999.1221924,377633087.2,92221733.09,20134794.24,30198314.67,3315539.837
330,Motor and generator manufacturing,1370.159424,551819519,144371521,9674759.865,57058486.94,4886883.259
331,Switchgear and switchboard apparatus manufacturing,3586.811523,1502002441,384829589.8,18309570.31,169179077.1,13330031.39
332,Relay and industrial control manufacturing,2944.344971,1005730164,293791564.9,29913169.86,71388648.99,9313398.361
333,Storage battery manufacturing,829.2791138,344266876.2,84584945.68,13598557.47,34331726.07,2582583.427
334,Primary battery manufacturing,6.837033749,4134770.393,339828.968,1855751.395,588019.1326,-717730.8202
335,Fiber optic cable manufacturing,133.1844025,88447685.24,18282785.42,1692783.594,6744774.818,646080.3151
336,Other communication and energy wire manufacturing,532.9813232,315459259,56507499.69,7433649.063,28141481.4,2183100.939
337,Wiring device manufacturing,4198.943848,1855669189,458506530.8,20940595.63,336580596.9,13348733.9
338,Carbon and graphite product manufacturing,30.73680115,14629060.75,1293149.59,5766156.673,401388.0789,100412.3688
339,All other miscellaneous electrical equipment and component manufacturing,2003.780762,630621643.1,192374069.2,40329284.67,20538946.15,4910498.619
340,Automobile manufacturing,11130.36914,16734726563,1045190674,1221058.488,1240003540,111660621.6
341,Light truck and utility vehicle manufacturing,46.03937531,94288139.34,4773650.646,0,4718612.671,632755.9352
342,Heavy duty truck manufacturing,484.533783,473776275.6,43634304.05,393106.848,15559230.8,2290031.672
343,Motor vehicle body manufacturing,2161.214111,756964904.8,173297805.8,1833901.644,18278829.57,3797751.904
344,Truck trailer manufacturing,839.6589355,255831085.2,43555694.58,4792445.183,4654238.701,1371576.786
345,Motor home manufacturing,0,0,0,0,0,0
346,Travel trailer and camper manufacturing,175.5292969,56775325.78,12401237.49,657282.114,284941.7031,284590.8701
347,Motor vehicle gasoline engine and engine parts manufacturing,2234.702637,1229406738,173523529.1,5863256.931,23992780.69,6441621.304
348,Motor vehicle electrical and electronic equipment manufacturing,5776.972168,2733805420,390703491.2,5119510.651,56853931.43,16330116.27
349,Motor vehicle transmission and power train parts manufacturing,2519.025879,1459164429,197289169.3,4723995.686,33135753.63,7775316.238
350,Motor vehicle seating and interior trim manufacturing,1579.466187,843882080.1,99697097.78,1304618.12,16321889.88,4935155.869
351,Motor vehicle metal stamping,3471.144287,1480245728,378549926.8,816763.2818,42092254.64,7140986.919
352,Other motor vehicle parts manufacturing,7981.725586,4220831543,536100280.8,7036331.654,118574470.5,23838535.31
353,"Motor vehicle steering, suspension component (except spring), and brake systems manufacturing",657.9403687,361120971.7,74882476.81,1614739.18,15381807.33,1843445.301
354,Aircraft manufacturing,83.13441467,54364048,4544338.703,1511473.298,2758876.801,535144.3291
355,Aircraft engine and engine parts manufacturing,2315.959229,1331812988,208056915.3,539710.5217,144836380,8861830.711
356,Other aircraft parts and auxiliary equipment manufacturing,1014.267883,340937622.1,110589798,862217.6647,31888805.39,2193472.624
357,Guided missile and space vehicle manufacturing,0,0,0,0,0,0
358,Propulsion units and parts for space vehicles and guided missiles manufacturing,0,0,0,0,0,0
359,Railroad rolling stock manufacturing,1309.512085,819418212.9,117815757.8,1763162.494,42128757.48,6335761.07
360,Ship building and repairing,240.7665558,55643135.07,15204298.97,1207941.413,2230137.11,261112.6602
361,Boat building,225.8311768,57822105.41,10385401.73,465252.4292,1579813.004,418823.0634
362,"Motorcycle, bicycle, and parts manufacturing",295.5791626,217161666.9,35138648.99,382455.7662,58017536.16,1375564.456
363,"Military armored vehicle, tank, and tank component manufacturing",3.109973431,1764791.608,219801.3216,35593.89338,185811.9816,14740.70176
364,All other transportation equipment manufacturing,245.0329285,125858314.5,13226507.19,970744.1926,4909088.135,1142757.416
365,Wood kitchen cabinet and countertop manufacturing,3201.767822,548115539.6,152468215.9,8897910.118,132303802.5,2720102.31
366,Upholstered household furniture manufacturing,717.111145,164999008.2,40081233.98,670061.7075,24563278.2,1209264.636
367,Nonupholstered wood household furniture manufacturing,1528.770752,232590194.7,76694381.71,3380003.452,25563787.46,1215684.056
368,Other household nonupholstered furniture manufacturing,89.03971863,25691312.79,4202291.965,380402.2074,3762013.435,162231.4602
369,Institutional furniture manufacturing,1272.04248,257799774.2,74521278.38,1385515.571,11805430.41,1676013.947
370,Wood office furniture manufacturing,272.6873474,75127891.54,17748683.93,590016.4247,15884640.69,420526.8323
371,Custom architectural woodwork and millwork,1254.904297,252992050.2,116368972.8,2305631.399,-334656.179,1145267.248
372,"Office furniture, except wood, manufacturing",346.4264832,131562225.3,22498458.86,706015.5869,32890571.59,795190.2151
373,"Showcase, partition, shelving, and locker manufacturing",3691.081055,881812683.1,219645843.5,2942428.589,182417236.3,4615508.08
374,Mattress manufacturing,576.9470215,257306976.3,31461473.46,726936.5191,71668899.54,1299547.553
375,Blind and shade manufacturing,478.7171326,91775177,24284841.54,596102.5953,1786322.951,505575.6569
376,Surgical and medical instrument manufacturing,6218.516113,3440932617,1169208618,40266464.23,494383697.5,47299926.76
377,Surgical appliance and supplies manufacturing,2586.414795,1190014404,342344482.4,28323167.8,148888366.7,18408109.66
378,Dental equipment and supplies manufacturing,1287.820557,427368835.4,129409744.3,7538806.915,44172584.53,6656584.74
379,Ophthalmic goods manufacturing,377.7324524,111207016,24730117.8,5907475.471,12425593.38,1988326.43
380,Dental laboratories,1492.771851,164633346.6,72419868.47,38325740.81,-6293771.267,1998509.645
381,Jewelry and silverware manufacturing,2344.047363,441312622.1,94745460.51,50072322.85,33427562.71,19754295.35
382,Sporting and athletic goods manufacturing,2252.1875,733928405.8,256837554.9,48775146.48,44564579.01,10844305.04
383,"Doll, toy, and game manufacturing",414.6282654,153169174.2,30436838.15,28817136.76,12237668.99,1978602.052
384,Office supplies (except paper) manufacturing,891.9102783,237069915.8,71545837.4,20468017.58,10773534.77,2782690.763
385,Sign manufacturing,4199.691895,661054626.5,288926666.3,166235153.2,-85744041.44,6852351.665
386,"Gasket, packing, and sealing device manufacturing",3482.781738,857506530.8,298267852.8,31424245.83,38961769.1,12194170.95
387,Musical instrument manufacturing,397.2700806,66838912.96,19353302,19996109.01,-166483.3724,708088.8748
388,"Fasteners, buttons, needles, and pins manufacturing",603.59729,131009491,46855216.98,10545310.97,5567479.134,1569937.11
389,"Broom, brush, and mop manufacturing",1035.870605,304424041.7,77385665.89,6261821.747,29001937.87,4073890.209
390,Burial casket manufacturing,135.2089081,25797893.52,8474445.343,4512340.069,577562.1533,379573.4942
391,All other miscellaneous manufacturing,3969.89209,884812316.9,273141113.3,189249527,18008352.28,9633208.275
392,Wholesale - Motor vehicle and motor vehicle parts and supplies,13217.28516,5587740723,1003809021,71472526.55,1607442261,204839340.2
393,Wholesale - Professional and commercial equipment and supplies,31023.66406,11753818359,3786522461,195912353.5,2998154053,463224639.9
394,Wholesale - Household appliances and electrical and electronic goods,17459.83398,9167521484,1729580078,129489700.3,2736887207,357215515.1
395,"Wholesale - Machinery, equipment, and supplies",36787.36719,11524018555,3529625488,230822647.1,3124907715,509662506.1
396,Wholesale - Other durable goods merchant wholesalers,56276.18359,14981210938,4558250488,399636352.5,2895820557,691509887.7
397,Wholesale - Drugs and druggists’ sundries,14421.72168,15343732422,2686274414,56887302.4,6239549316,230442489.6
398,Wholesale - Grocery and related product wholesalers,44521.42188,9618852539,3554989014,154550842.3,1598125244,162567031.9
399,Wholesale - Petroleum and petroleum products,3841.256592,7104031250,516133422.9,24669359.21,1277566772,4609986328
400,Wholesale - Other nondurable goods merchant wholesalers,59238.96484,20252687500,5105490234,386630920.4,4262415527,2388770752
401,Wholesale - Wholesale electronic markets and agents and brokers,28661.50195,2197590332,2861943115,526892639.2,-1442448364,16806406.02
402,Retail - Motor vehicle and parts dealers,31924.19336,4394804688,1754167969,129692810.1,490326904.3,766667053.2
403,Retail - Furniture and home furnishings stores,24703.83398,2408817383,1024036621,138475570.7,66360862.73,317966369.6
404,Retail - Electronics and appliance stores,28764.95313,3099466064,1892017822,79553153.99,-294903289.8,372691131.6
405,Retail - Building material and garden equipment and supplies stores,45361.27344,5251421387,1697113770,80966644.29,902483215.3,979176452.6
406,Retail - Food and beverage stores,103340.6641,7818583984,3095425781,121594093.3,794083496.1,843950378.4
407,Retail - Health and personal care stores,60747.11328,5224848145,2676092285,121748573.3,326920776.4,392093292.2
408,Retail - Gasoline stores,24634.36719,2818330322,687153625.5,107337524.4,241246429.4,539304199.2
409,Retail - Clothing and clothing accessories stores,55820.80078,4946030762,1353573730,24003635.41,382447082.5,699194091.8
410,"Retail - Sporting goods, hobby, musical instrument and book stores",30790.91992,1817376221,778508483.9,72935096.74,59616909.03,237059570.3
411,Retail - General merchandise stores,120133.6719,8877460938,3601457031,19883729.93,423416198.7,1565824463
412,Retail - Miscellaneous store retailers,58636.67578,2915528320,1112102539,333559936.5,-30329971.31,415902496.3
413,Retail - Nonstore retailers,61896.32813,10041084961,1138767334,296724365.2,3414675049,745963684.1
414,Air transportation,40818.26953,14988726563,4794001953,128997299.2,3152008301,1665198975
415,Rail transportation,13540.4375,5966898438,1780135376,-1145191.55,983900146.5,-30847637.18
416,Water transportation,2270.29834,1539612793,201491272,19538389.21,122631980.9,31170562.74
417,Truck transportation,112392.7891,19057988281,5347832520,2438983643,995584472.7,296815094
418,Transit and ground passenger transportation,114687.8125,3935145752,933247619.6,949673278.8,332183349.6,50772705.08
419,Pipeline transportation,1155.636353,1129217773,168569702.1,1214640.856,669844299.3,138099807.7
420,Scenic and sightseeing transportation and support activities for transportation,42178.20313,6853661621,2813956787,95165283.2,359599395.8,115926330.6
421,Couriers and messengers,38489.60156,3900406250,1329136719,57637699.13,629168457,50769378.66
422,Warehousing and storage,71918.25781,8699110352,3856738525,39928108.22,512530212.4,69644027.71
423,Newspaper publishers,6064.242676,747066589.4,340541961.7,9467137.337,216508606,6887432.575
424,Periodical publishers,6388.163574,1496858521,670767639.2,11949997.9,315618072.5,11906415.94
425,Book publishers,3709.039307,1704049072,302905792.2,6323987.484,662263916,16458442.69
426,"Directory, mailing list, and other publishers",2847.568604,957569641.1,208192321.8,2660193.443,443881927.5,8861185.074
427,Greeting card publishing,283.7652893,78756492.61,12890469.55,261198.5505,32344112.4,1156743.407
428,Software publishers,9457.121094,3284815186,990820922.9,38203189.85,1563376221,53568126.68
429,Motion picture and video industries,11380.74316,2499711670,481300750.7,116844001.8,240859359.7,255601135.3
430,Sound recording industries,1401.401123,620931335.4,56660408.02,38753356.93,201774810.8,146046508.8
431,Radio and television broadcasting,8451.370117,2663130859,687111877.4,401292541.5,-414058654.8,51976234.44
432,Cable and other subscription programming,1541.101685,2668251465,115938224.8,79557853.7,589285217.3,78085189.82
433,Wired telecommunications carriers,20079.02148,9853959961,2024518799,-63003864.29,2165446289,740963623
434,Wireless telecommunications carriers (except satellite),7054.463867,12129454102,667980651.9,-59778362.27,3954800293,597978759.8
435,"Satellite, telecommunications resellers, and all other telecommunications",5041.134277,1604038208,398015838.6,-72571937.56,131299285.9,89733169.56
436,"Data processing, hosting, and related services",15906.98828,8617256836,1890013306,99499290.47,2905340332,78133155.82
437,"News syndicates, libraries, archives and all other information services",2148.961182,564497009.3,159651657.1,101996513.4,155051971.4,3597540.14
438,Internet publishing and broadcasting and web search portals,9868.291016,11267436523,1444394287,169217620.8,3893497559,81260925.29
439,Nondepository credit intermediation and related activities,46040.42188,9573523438,4236093750,38882858.28,1267670166,315688354.5
440,Securities and commodity contracts intermediation and brokerage,55963.80469,15403022461,8403547852,-272074646,-46660259.25,68870300.29
441,Monetary authorities and depository credit intermediation,88663.24219,37149300781,9530081055,7262425.423,13622103516,768622375.5
442,Other financial investment activities,141920.1406,19160222656,6978250000,-1598356689,2294324707,117505470.3
443,Direct life insurance carriers,9792.828125,3368020752,1069752319,1089817.762,1078254639,80696388.24
444,"Insurance carriers, except direct life",53652.75781,46144886719,7135707520,7609498.024,17734507813,737377990.7
445,"Insurance agencies, brokerages, and related activities",81158.72656,21564261719,5897485840,506478881.8,4307546875,52034423.83
446,"Funds, trusts, and other financial vehicles",29203.00781,9578208008,733351806.6,728993957.5,276294860.8,69243270.87
447,Other real estate,240129.4844,53569410156,4492687012,5644328125,13498790039,2275991211
448,Tenant-occupied housing,42405.71094,19911982422,604001281.7,909571533.2,13052095703,3648094482
449,Owner-occupied dwellings,0,64308617188,0,0,43585933594,7311744629
450,Automotive equipment rental and leasing,11180.05664,4007357666,601461425.8,191920028.7,1785228882,470369384.8
451,General and consumer goods rental except video tapes and discs,11963.10254,1704593872,571104126,261344940.2,96614303.59,230990860
452,Video tape and disc rental,4924.15332,665574829.1,215464553.8,37351661.68,102115882.9,84509407.04
453,Commercial and industrial machinery and equipment rental and leasing,12455.33398,5410276855,934113647.5,425035186.8,2205673828,404262664.8
454,Lessors of nonfinancial intangible assets,1488.599121,4380355469,120939003,4140231.133,3576355225,89958152.77
