IndustryCode,Description,Employment,Output,EmployeeCompensation,ProprietorIncome,OtherPropertyTypeIncome,TaxOnProductionAndImports
0,Total,1114378.083,1.86699E+11,50624288614,5324771271,41967487592,7418268153
1,Oilseed farming,0.461321831,202221.7959,0,211645.1263,0,-19458.00893
2,Grain farming,261.1577148,48699573.52,3898030.758,21796682.36,11405657.77,-4532139.778
3,Vegetable and melon farming,963.133728,92613739.01,19895280.84,18642507.55,12691387.18,-5106.83842
4,Fruit farming,118.0890579,7998666.286,1650336.146,1892516.494,1536354.303,-310.6608638
5,Tree nut farming,5267.706055,177554397.6,124378639.2,33687877.66,4969564.438,7825.357839
6,"Greenhouse, nursery, and floriculture production",398.2263184,37549053.19,12995616.91,6963133.335,4085624.695,-3248.890629
7,Tobacco farming,0,0,0,0,0,0
8,Cotton farming,443.0829773,45858001.71,17088792.8,9664018.631,6615370.274,-887089.7889
9,Sugarcane and sugar beet farming,0,0,0,0,0,0
10,All other crop farming,8610.544922,155014801,53940471.65,32722610.47,17528947.83,-15971591
11,"Beef cattle ranching and farming, including feedlots and dual-purpose ranching and farming",10557.8125,921358947.8,15553240.78,306240936.3,157133377.1,-12283368.11
12,Dairy cattle and milk production,3275.067627,1217895020,60993827.82,147162841.8,70722305.3,-5351024.628
13,Poultry and egg production,105.2524414,46726558.69,3033204.079,1402169.347,1094177.723,-97829.17798
14,"Animal production, except cattle and poultry and eggs",380.0197754,29665431.98,3580591.44,26167957.31,-1207112.312,-294267.0584
15,"Forestry, forest products, and timber tract production",113.4604416,9618873.596,6270905.972,309175.7596,781247.1986,44210.62022
16,Commercial logging,472.0730591,30782306.67,7475451.946,5775096.416,1008547.544,706353.1876
17,Commercial fishing,0,0,0,0,0,0
18,Commercial hunting and trapping,306.8323364,16356672.29,629068.6727,5154231.071,3840482.473,1868824.84
19,Support activities for agriculture and forestry,4897.864746,205141052.2,143468612.7,23750490.19,-2765408.039,3783089.876
20,Oil and gas extraction,10518.25293,6933793457,438903015.1,378196411.1,3044910400,680497009.3
21,Coal mining,1331.92395,580624450.7,143048477.2,-293616.7717,166124115,27766551.97
22,"Copper, nickel, lead, and zinc mining",1102.820068,1436325439,106870826.7,-1020639.181,667726867.7,101097076.4
23,Iron ore mining,0,0,0,0,0,0
24,Gold ore mining,7.994036198,2517827.749,369685.322,-9695.568122,283339.7388,185711.2795
25,Silver ore mining,0,0,0,0,0,0
26,Uranium-radium-vanadium ore mining,0,0,0,0,0,0
27,Other metal ore mining,47.78125,18706766.13,4766239.643,-42966.36954,4085463.524,754467.4873
28,Stone mining and quarrying,116.8786087,26070911.41,4275858.402,-551182.8065,7117879.391,1295456.886
29,Sand and gravel mining,528.3989868,72857620.24,18194364.55,-2813111.544,8624207.497,4941440.582
30,"Other clay, ceramic, refractory minerals mining",0,0,0,0,0,0
31,"Potash, soda, and borate mineral mining",628.5970459,191649368.3,66316925.05,-174532.2198,14225440.98,8562280.655
32,Phosphate rock mining,0,0,0,0,0,0
33,Other chemical and fertilizer mineral mining,43.27763367,9052257.538,2443722.963,-184324.041,1687871.337,571625.7095
34,Other nonmetallic minerals,203.2228241,31479522.71,8743398.666,-601046.2642,4444265.366,2013233.662
35,Drilling oil and gas wells,3707.685791,1476732788,294794097.9,27698946,233746337.9,72727432.25
36,Support activities for oil and gas operations,15586.99316,4385723633,1216476929,33738819.12,363208953.9,163058120.7
37,Metal mining services,1182.507568,756547424.3,50280342.1,40572372.44,328965148.9,73148551.94
38,Other nonmetallic minerals services,1251.904541,772373230,53612339.02,40594577.79,328310882.6,73949790.95
39,Electric power generation - Hydroelectric,0,0,0,0,0,0
40,Electric power generation - Fossil fuel,407.2381287,526928222.7,52360893.25,-71334.60045,98739517.21,37666168.21
41,Electric power generation - Nuclear,0,0,0,0,0,0
42,Electric power generation - Solar,97.12714386,32677246.09,7953896.523,0,10383970.26,1524315.119
43,Electric power generation - Wind,47.40805817,66051322.94,5808206.081,0,30578725.81,3422062.635
44,Electric power generation - Geothermal,0,0,0,0,0,0
45,Electric power generation - Biomass,0,0,0,0,0,0
46,Electric power generation - All other,0,0,0,0,0,0
47,Electric power transmission and distribution,2667.802979,3180623779,311171600.3,-153029.9932,558397583,219795181.3
48,Natural gas distribution,829.0775146,590364257.8,94674583.44,-927.1324379,126134429.9,27357250.21
49,"Water, sewage and other systems",1027.69397,185120193.5,31456125.26,-446554.3926,25791873.93,10715950.97
50,Construction of new health care structures,1863.58667,246420669.6,72498901.37,21145708.08,35703025.82,2342879.772
51,Construction of new manufacturing structures,2930.311279,385930084.2,112205528.3,31281921.39,32754943.85,3240114.45
52,Construction of new power and communication structures,5218.731445,876584167.5,253539444,47209743.5,176902969.4,21276704.79
53,Construction of new educational and vocational structures,4819.676758,566328552.2,202832122.8,44484619.14,72770622.25,4693455.696
54,Construction of new highways and streets,3984.641846,723279357.9,167703109.7,41071994.78,125665367.1,6171871.662
55,"Construction of new commercial structures, including farm structures",7341.23584,833226623.5,275827240,81726974.49,52412586.21,10699005.13
56,Construction of other new nonresidential structures,9509.423828,665719543.5,369991516.1,106492881.8,-252123016.4,6905450.821
57,Construction of new single-family residential structures,11482.31445,1476011475,433323272.7,135238723.8,214046646.1,13107944.49
58,Construction of new multifamily residential structures,3559.770752,329931182.9,135197311.4,42005268.1,65269653.32,2832332.134
59,Construction of other new residential structures,8042.697266,1452019043,310072723.4,92934059.14,160866363.5,20703462.6
60,Maintenance and repair construction of nonresidential structures,5454.062988,998424377.4,208689056.4,64095893.86,87249107.36,13397467.61
61,Maintenance and repair construction of residential structures,2602.401855,497316497.8,95467247.01,27690219.88,52754882.81,10228958.13
62,"Maintenance and repair construction of highways, streets, bridges, and tunnels",1968.487061,165257766.7,75768966.67,22916774.75,-44454822.54,2568125.725
63,Dog and cat food manufacturing,5.025733471,6478498.459,277556.3002,57560.01174,755015.6713,67820.91409
64,Other animal food manufacturing,211.1826019,210449386.6,11710204.12,998253.9415,6969497.681,2473078.728
65,Flour milling,16.87840652,18883102.42,1136078.835,30069.90626,1170763.135,59439.4654
66,Rice milling,0,0,0,0,0,0
67,Malt manufacturing,0,0,0,0,0,0
68,Wet corn milling,0,0,0,0,0,0
69,Soybean and other oilseed processing,0,0,0,0,0,0
70,Fats and oils refining and blending,0,0,0,0,0,0
71,Breakfast cereal manufacturing,334.3494873,282596618.7,26513629.91,0,37960445.4,1011620.164
72,Beet sugar manufacturing,0,0,0,0,0,0
73,Sugar cane mills and refining,0,0,0,0,0,0
74,Nonchocolate confectionery manufacturing,31.19958115,12460483.55,1330557.227,348171.5322,617856.3237,40858.80518
75,Chocolate and confectionery manufacturing from cacao beans,37.58974457,22698276.52,1059208.512,220796.3169,1165384.173,98319.6944
76,Confectionery manufacturing from purchased chocolate,68.46704102,20814394,1142067.075,415387.6603,500034.2131,77820.1893
77,"Frozen fruits, juices and vegetables manufacturing",319.4592896,128865417.5,10710891.72,162519.1122,9157451.63,484989.4047
78,Frozen specialties manufacturing,164.8783417,57611679.08,6187612.057,290741.0562,3232793.57,162772.5512
79,Canned fruits and vegetables manufacturing,536.5479736,246469467.2,20180541.99,851192.9512,16453311.92,742612.6599
80,Canned specialties,242.6103668,189111572.3,10812363.62,104793.4145,15555527.69,530627.3103
81,Dehydrated food products manufacturing,181.6160583,74363731.38,6407438.755,1063342.69,5494826.794,246763.3337
82,Cheese manufacturing,1260.279175,1140155762,84166519.17,273831.8741,34019107.82,3630760.67
83,"Dry, condensed, and evaporated dairy product manufacturing",0,0,0,0,0,0
84,Fluid milk manufacturing,166.6389771,121351631.2,11183903.69,276705.8611,7343497.276,455699.3246
85,Creamery butter manufacturing,0,0,0,0,0,0
86,Ice cream and frozen dessert manufacturing,57.07015991,23987932.21,2963854.313,134843.6922,1697761.536,97089.02985
87,Frozen cakes and other pastries manufacturing,858.2650146,72445884.7,25692213.06,483912.4382,5716567.993,6195971.012
88,Poultry processing,2.194950581,625816.8221,41209.67165,40063.15768,13597.49306,1996.435458
89,"Animal, except poultry, slaughtering",108.2149506,70235710.14,3175834.656,529370.1887,927980.3634,339168.9658
90,Meat processed from carcasses,154.9334106,75768508.91,4556543.35,634902.1792,517631.5904,323509.3951
91,Rendering and meat byproduct processing,30.79872131,11401100.16,1779749.751,38671.49726,264220.5656,91447.8898
92,Seafood product preparation and packaging,0,0,0,0,0,0
93,"Bread and bakery product, except frozen, manufacturing",1465.041626,190757812.5,43963275.91,5202517.986,12922987.94,6474845.409
94,Cookie and cracker manufacturing,34.26452255,10265512.47,335509.3598,755564.2128,153928.9355,43147.76883
95,"Dry pasta, mixes, and dough manufacturing",0,0,0,0,0,0
96,Tortilla manufacturing,414.7548523,86770317.08,15224246.98,2030819.654,3226154.566,343822.211
97,Roasted nuts and peanut butter manufacturing,229.9748077,99849075.32,10794181.82,305037.9753,10876910.21,290784.7762
98,Other snack food manufacturing,122.9118271,57187011.72,7459671.497,109057.866,2168598.652,70053.34646
99,Coffee and tea manufacturing,48.75587082,28572214.13,142625.1978,2328680.754,140729.6062,112025.5962
100,Flavoring syrup and concentrate manufacturing,0,0,0,0,0,0
101,"Mayonnaise, dressing, and sauce manufacturing",0,0,0,0,0,0
102,Spice and extract manufacturing,328.5770874,171828018.2,16397008.9,640424.3112,9056097.984,637299.4184
103,All other food manufacturing,838.1587524,272950378.4,24814067.84,5819439.888,8979427.338,885773.8972
104,Bottled and canned soft drinks & water,185.1146393,130317886.4,9655705.452,337989.4197,10210086.82,708540.7376
105,Manufactured ice,14.92358303,1916299.462,469245.2848,45030.0537,-270523.4885,10792.49568
106,Breweries,800.9146118,328847839.4,27115282.06,825890.2431,38195934.3,16924547.2
107,Wineries,257.6209412,81971496.58,10610803.6,230965.6888,7142424.107,1463767.409
108,Distilleries,24.43473434,21411762.24,827632.7252,74511.83349,2221949.339,3566852.093
109,Tobacco product manufacturing,3.288157225,7569424.152,130092.8444,6963.647436,1382341.623,1566519.618
110,"Fiber, yarn, and thread mills",0,0,0,0,0,0
111,Broadwoven fabric mills,20.91296768,3885566.95,150806.3525,58052.09279,139588.8627,15680.16596
112,Narrow fabric mills and schiffli machine embroidery,26.73010063,3660098.076,398667.4845,70434.55541,89505.71716,11944.33402
113,Nonwoven fabric mills,0,0,0,0,0,0
114,Knit fabric mills,0,0,0,0,0,0
115,Textile and fabric finishing mills,25.56556892,5190525.055,108969.1073,91515.19835,66342.31657,18352.11925
116,Fabric coating mills,0,0,0,0,0,0
117,Carpet and rug mills,22.35083199,6158459.663,156679.377,2828.927943,245182.7228,30783.26769
118,Curtain and linen mills,19.283741,3129007.578,153065.1301,13436.24946,141319.3494,12321.40791
119,Textile bag and canvas mills,69.87443542,11536609.65,2517851.83,40951.45687,1406365.871,33906.29217
120,"Rope, cordage, twine, tire cord and tire fabric mills",0,0,0,0,0,0
121,Other textile product mills,88.20666504,9745095.253,964364.1114,79181.95426,457005.6498,38494.61675
122,Hosiery and sock mills,14.01597786,1393288.97,307208.3592,66794.52211,134557.0832,135234.9818
123,Other apparel knitting mills,66.73947906,5473768.711,1227944.851,255441.5166,-186654.9402,159932.1067
124,Cut and sew apparel contractors,103.7863159,5183107.376,1590014.458,264302.4623,-20482.55876,156917.7359
125,Mens and boys cut and sew apparel manufacturing,52.99263763,5838204.384,443657.6366,383883.8637,62390.96075,162735.4175
126,Womens and girls cut and sew apparel manufacturing,54.57920074,9256957.054,799966.0969,274017.6022,-178595.6323,168423.444
127,Other cut and sew apparel manufacturing,53.98425293,4932891.846,364769.28,363675.7433,87442.08515,156713.2324
128,Apparel accessories and other apparel manufacturing,116.31884,9777145.386,1649872.899,602593.6007,-357896.775,187496.1108
129,Leather and hide tanning and finishing,0,0,0,0,0,0
130,Footwear manufacturing,24.07725716,2947995.424,52780.33391,25746.07544,-11118.14938,21459.14547
131,Other leather and allied product manufacturing,143.7167511,11406254.77,1013107.181,133038.7741,-173211.8428,81415.35521
132,Sawmills,237.4303741,54520294.19,4308512.211,648474.6933,1516235.828,298874.1994
133,Wood preservation,23.61103058,11409422.87,512348.5327,109705.1278,824099.1235,62981.15849
134,Veneer and plywood manufacturing,0,0,0,0,0,0
135,Engineered wood member and truss manufacturing,121.8579025,22516408.92,3081972.837,310174.2864,892395.1387,112655.5279
136,Reconstituted wood product manufacturing,0,0,0,0,0,0
137,Wood windows and door manufacturing,186.197525,36568481.45,6212869.644,561374.9623,1852257.371,192250.0879
138,"Cut stock, resawing lumber, and planing",63.46105957,13240899.09,2183794.498,97662.58299,1399721.503,68131.08921
139,"Other millwork, including flooring",137.6615906,23386009.22,3647030.354,354486.4655,1403295.04,129174.456
140,Wood container and pallet manufacturing,53.07049561,6941014.29,1413218.26,95407.61262,235315.2037,35895.09428
141,Manufactured home (mobile home) manufacturing,381.2293091,87482101.44,15959493.64,156354.0101,9281041.145,480814.0397
142,Prefabricated wood building manufacturing,108.2217178,15442520.14,3107657.909,252026.0811,344005.1377,81933.59524
143,All other miscellaneous wood product manufacturing,123.0765457,17425115.59,2544773.102,403889.4773,635766.2678,96556.15687
144,Pulp mills,0,0,0,0,0,0
145,Paper mills,193.3516998,143860397.3,10087866.78,24072.81101,22989522.93,601826.9062
146,Paperboard mills,0,0,0,0,0,0
147,Paperboard container manufacturing,154.3427277,74577224.73,9561979.294,81470.38519,7078345.299,303829.4017
148,Paper bag and coated and treated paper manufacturing,0,0,0,0,0,0
149,Stationery product manufacturing,20.76436424,7951371.193,988637.9838,22719.83586,617676.6157,35478.90857
150,Sanitary paper product manufacturing,213.205246,180807891.8,14128488.54,4833.268467,48662536.62,710469.0671
151,All other converted paper product manufacturing,23.58837509,7210108.757,1019593.12,40411.44624,737328.4698,32833.46817
152,Printing,1435.129517,191495132.4,44153179.17,3278172.255,18194997.79,1430319.309
153,Support activities for printing,13.8171854,1149070.263,288025.0514,39081.92739,128802.225,7397.438865
154,Petroleum refineries,716.9164429,5676905762,112094352.7,-4013514.996,860208557.1,6240566.73
155,Asphalt paving mixture and block manufacturing,54.78980637,37627178.19,3263955.355,-2368675.709,2019499.302,18225.53389
156,Asphalt shingle and coating materials manufacturing,0,0,0,0,0,0
157,Petroleum lubricating oil and grease manufacturing,20.74043083,23111064.91,1999498.963,-370657.444,5672097.206,14914.93266
158,All other petroleum and coal products manufacturing,63.7098732,54003139.5,6239221.573,-1033402.085,12378426.55,54453.46236
159,Petrochemical manufacturing,0,0,0,0,0,0
160,Industrial gas manufacturing,60.93688965,54343727.11,5727576.256,1208.560076,4915432.453,510096.9076
161,Synthetic dye and pigment manufacturing,12.3688879,9377042.77,1709016.442,1050.405088,1132761.24,60638.75556
162,Other basic inorganic chemical manufacturing,221.3210754,184534759.5,38155429.84,7879.648358,22944831.85,1268660.784
163,Other basic organic chemical manufacturing,26.51308823,38444442.75,3240922.689,5008.210428,1574965.119,258890.301
164,Plastics material and resin manufacturing,13.36539936,15667526.25,639561.832,1728.522475,202496.8415,118706.5244
165,Synthetic rubber manufacturing,15.81265545,12970194.82,1121528.029,1523.54734,340669.632,91872.72936
166,Artificial and synthetic fibers and filaments manufacturing,50.20845413,34377239.23,3232945.919,1262.843027,769340.5151,218353.4652
167,Nitrogenous fertilizer manufacturing,49.06634521,42339950.56,2839256.763,17943.8889,2126550.913,349308.6696
168,Phosphatic fertilizer manufacturing,33.21206665,29846975.33,1694056.034,4559.746478,1261889.577,275959.8792
169,Fertilizer mixing,10.54807091,4631801.605,157860.2791,4299.663007,98240.04024,41353.39707
170,Pesticide and other agricultural chemical manufacturing,2.687266827,3309870.243,38141.1761,2186.212223,41617.54996,29456.38262
171,Medicinal and botanical manufacturing,285.8673706,127939735.4,15270751,11870.91693,7749835.491,1049435.854
172,Pharmaceutical preparation manufacturing,339.0041199,365495605.5,27845752.72,9621.041827,42857929.23,7373533.726
173,In-vitro diagnostic substance manufacturing,0.102991067,42547.79965,11036.77694,0,3424.674273,1296.855742
174,Biological product (except diagnostic) manufacturing,4.213745117,2266483.307,446723.9082,0,348169.148,19645.58475
175,Paint and coating manufacturing,34.41690826,22295280.46,1565942.645,25038.55713,948744.0586,176409.483
176,Adhesive manufacturing,0,0,0,0,0,0
177,Soap and other detergent manufacturing,44.34246063,38279899.6,315302.4018,52360.02058,453061.8191,373466.7003
178,Polish and other sanitation good manufacturing,21.27830887,10732950.21,715650.7373,26331.36697,459186.0175,96247.10679
179,Surface active agent manufacturing,0,0,0,0,0,0
180,Toilet preparation manufacturing,150.0709991,94954612.73,5824385.643,34387.74869,9425930.977,1024440.408
181,Printing ink manufacturing,0,0,0,0,0,0
182,Explosives manufacturing,0,0,0,0,0,0
183,Custom compounding of purchased resins,2.844981432,1280267.239,70701.86734,1500.334358,30565.76289,10181.69988
184,Photographic film and chemical manufacturing,11.62168694,6962019.92,447069.3469,4613.256548,287985.8613,53658.83186
185,Other miscellaneous chemical product manufacturing,65.29475403,33175521.85,3194598.675,43316.41644,944532.9905,274646.9378
186,Plastics packaging materials and unlaminated film and sheet manufacturing,211.7688293,100978225.7,12674060.82,-292164.3257,19412174.22,415457.5169
187,Unlaminated plastics profile shape manufacturing,0,0,0,0,0,0
188,Plastics pipe and pipe fitting manufacturing,72.69095612,40663436.89,3983133.793,-402569.7708,13372640.61,166450.2919
189,"Laminated plastics plate, sheet (except packaging), and shape manufacturing",18.05288887,4881240.845,641434.9079,-848390.1024,1302399.635,26703.4024
190,Polystyrene foam product manufacturing,56.58185959,18161886.22,2311745.644,-1621261.835,3498572.588,96769.72777
191,Urethane and other foam product (except polystyrene) manufacturing,165.9901123,65627365.11,8941783.905,-750554.9788,13007567.41,281769.1565
192,Plastics bottle manufacturing,0,0,0,0,0,0
193,Other plastics product manufacturing,392.2763672,102021057.1,15952825.55,-6854905.128,18241294.86,485873.8482
194,Tire manufacturing,21.8100071,7254270.077,894418.1204,-660965.9195,707165.0028,50196.11865
195,Rubber and plastics hoses and belting manufacturing,63.98295593,21603044.51,3883991.718,-271505.475,5475791.931,86029.29115
196,Other rubber product manufacturing,166.2398529,57411926.27,9577521.324,-660385.4895,10797228.81,255431.4733
197,"Pottery, ceramics, and plumbing fixture manufacturing",160.5315399,7831130.028,709526.5388,-35445877.08,556697.9647,113838.5162
198,"Brick, tile, and other structural clay product manufacturing",225.5830231,18398769.38,2813516.855,-33309566.5,6357093.334,293366.0746
199,Flat glass manufacturing,0,0,0,0,0,0
200,Other pressed and blown glass and glassware manufacturing,33.71284103,2494212.866,356577.4858,-9489460.945,443167.4182,30509.21671
201,Glass container manufacturing,0,0,0,0,0,0
202,Glass product manufacturing made of purchased glass,175.1315765,13597656.25,2803216.219,-26972106.93,5078672.409,178728.3719
203,Cement manufacturing,106.9809723,91751617.43,9079523.087,-1230997.92,37637706.76,319836.9741
204,Ready-mix concrete manufacturing,713.197998,303759887.7,40759799.96,-19553514.48,80957786.56,1191256.523
205,Concrete block and brick manufacturing,204.7856293,74452232.36,10288626.67,-3536306.143,26140779.5,328318.4469
206,Concrete pipe manufacturing,26.45792961,8955247.879,1733087.301,-1138602.614,3319377.184,41966.25203
207,Other concrete product manufacturing,123.0428314,25009458.54,5906721.592,-6412956.238,7987287.521,121628.3515
208,Lime manufacturing,0,0,0,0,0,0
209,Gypsum product manufacturing,149.297821,135581420.9,13833147.05,-1174492.121,65361114.5,394652.9627
210,Abrasive product manufacturing,0,0,0,0,0,0
211,Cut stone and stone product manufacturing,194.7959595,8057887.077,5640932.56,-19109697.34,2604826.212,105416.961
212,Ground or treated mineral and earth manufacturing,128.4328461,92336448.67,7511280.537,-3919823.885,41068229.68,336715.5194
213,Mineral wool manufacturing,0,0,0,0,0,0
214,Miscellaneous nonmetallic mineral products manufacturing,249.4604492,91084266.66,9960164.07,-22333309.17,44337947.85,441234.2012
215,Iron and steel mills and ferroalloy manufacturing,55.81520081,47377819.06,2954700.47,-20307.85941,488281.4586,198689.8482
216,"Iron, steel pipe and tube manufacturing from purchased steel",0,0,0,0,0,0
217,Rolled steel shape manufacturing,0,0,0,0,0,0
218,Steel wire drawing,12.2819767,3391205.549,234024.2416,-10329.30426,40281.21382,16238.99117
219,Alumina refining and primary aluminum production,21.37450981,13340691.57,995662.7488,-7872.670889,180574.5065,52940.83804
220,Secondary smelting and alloying of aluminum,0,0,0,0,0,0
221,"Aluminum sheet, plate, and foil manufacturing",0,0,0,0,0,0
222,"Other aluminum rolling, drawing and extruding",0,0,0,0,0,0
223,Nonferrous metal (exc aluminum) smelting and refining,118.6519928,99414550.78,8011012.077,-6016.014144,8749280.93,511795.8188
224,"Copper rolling, drawing, extruding and alloying",125.7840958,101961914.1,6709901.333,-11623.11621,720145.2851,338190.3768
225,"Nonferrous metal, except copper and aluminum, shaping",0,0,0,0,0,0
226,Secondary processing of other nonferrous metals,137.1406555,139634353.6,6290136.814,-84273.1148,4717628.479,589009.881
227,Ferrous metal foundries,19.13119125,3492489.338,335311.5022,-25053.66504,81227.05668,19648.67488
228,Nonferrous metal foundries,11.52931786,2007084.608,330823.9579,-6992.828101,40132.43318,8282.599971
229,Custom roll forming,0,0,0,0,0,0
230,Crown and closure manufacturing and metal stamping,0,0,0,0,0,0
231,Iron and steel forging,97.00401306,25029577.26,2970907.927,386763.9005,382757.9021,182963.4905
232,Nonferrous forging,0,0,0,0,0,0
233,"Cutlery, utensil, pot, and pan manufacturing",10.09485722,3929871.082,371229.4996,55382.18468,325542.8672,34914.62022
234,Handtool manufacturing,30.79327583,5210511.684,1012162.566,153047.6511,224028.9152,45383.92648
235,Prefabricated metal buildings and components manufacturing,30.59524345,7117557.049,770983.5172,190198.7642,111278.3998,57222.49672
236,Fabricated structural metal manufacturing,246.5141907,68485847.47,12982656.48,454552.4418,2239728.451,476776.0634
237,Plate work manufacturing,87.56424713,17935508.73,5506317.616,363831.2221,28257.86918,111619.6811
238,Metal window and door manufacturing,216.3258514,44230682.37,9102849.96,424489.7068,1699784.994,325097.3523
239,Sheet metal work manufacturing,159.1407471,27762918.47,5978230,547355.8903,608634.3527,191421.3002
240,Ornamental and architectural metal work manufacturing,237.7855835,43447956.09,9854731.56,640079.7367,1188440.442,286391.8841
241,Power boiler and heat exchanger manufacturing,40.64682388,9911533.356,2196366.787,33647.69369,325123.8763,73199.63723
242,Metal tank (heavy gauge) manufacturing,247.743454,57674430.85,15283688.55,418547.3621,1138656.378,383978.0986
243,Metal cans manufacturing,0,0,0,0,0,0
244,"Metal barrels, drums and pails manufacturing",0,0,0,0,0,0
245,Hardware manufacturing,15.96837139,4027184.01,259613.4543,119537.9719,58262.68718,35539.47806
246,Spring and wire product manufacturing,77.98558807,18083068.85,4420451.641,98131.40333,563737.452,110653.9518
247,Machine shops,735.7409058,86816612.24,28246660.23,2762093.306,1494329.81,597744.8225
248,"Turned product and screw, nut, and bolt manufacturing",169.3537903,35200332.64,8559173.584,71345.06851,1183387.876,232694.2235
249,Metal heat treating,45.93626404,10550740.24,2837510.586,55669.06556,558373.2128,70663.71292
250,Metal coating and nonprecious engraving,48.74071503,8930832.863,1437293.53,251344.7404,396177.6197,67605.48055
251,"Electroplating, anodizing, and coloring metal",114.9794235,15689453.13,5966585.636,279303.4911,226195.0821,90174.54833
252,"Valve and fittings, other than plumbing, manufacturing",23.64647293,6271022.797,1059491.992,164291.3818,230029.8065,48425.1827
253,Plumbing fixture fitting and trim manufacturing,3.905352831,1746156.931,86020.23125,33253.38289,58174.67719,19334.81917
254,Ball and roller bearing manufacturing,0,0,0,0,0,0
255,Small arms ammunition manufacturing,0,0,0,0,0,0
256,"Ammunition, except for small arms, manufacturing",32.90721512,6583878.04,2078750.134,72400.63697,151799.6788,99839.46383
257,"Small arms, ordnance, and accessories manufacturing",19.51853371,4415551.186,14851.68375,250807.2555,8302.127011,66073.51452
258,Fabricated pipe and pipe fitting manufacturing,95.10220337,16727235.79,3671594.381,443810.1649,203230.4257,124454.4536
259,Other fabricated metal manufacturing,446.8061523,84652542.11,19702585.22,1467617.512,2359997.749,636112.5708
260,Farm machinery and equipment manufacturing,124.1993637,47134567.26,4504028.797,348277.9264,1549180.865,281433.9697
261,Lawn and garden equipment manufacturing,0,0,0,0,0,0
262,Construction machinery manufacturing,109.7555695,61411228.18,7233666.42,97138.85188,5982751.369,395983.4576
263,Mining machinery and equipment manufacturing,74.79998779,21457498.55,5745748.52,49296.84103,1363275.886,119292.0208
