IndustryCode,Description,Employment,Output,EmployeeCompensation,ProprietorIncome,OtherPropertyTypeIncome,TaxOnProductionAndImports
0,Total,4463428.72,9.41441E+11,2.89744E+11,37015790440,2.02372E+11,43814999168
1,Oilseed farming,27.32475662,29505762.1,93670.18193,19175046.92,9120583.534,-347677.4991
2,Grain farming,3571.207764,1065145752,98691040.04,299965698.2,220468353.3,-444247772.2
3,Vegetable and melon farming,10346.08691,1188062378,295435363.8,150475402.8,143884811.4,204825.7291
4,Fruit farming,38324.46094,3324331055,793976501.5,494907104.5,564313049.3,708891.4514
5,Tree nut farming,76.30153656,2705084.324,2181704.044,321197.6886,66552.10257,1150.160562
6,"Greenhouse, nursery, and floriculture production",3946.246094,362493713.4,145226867.7,42296413.42,34857959.75,34589.78608
7,Tobacco farming,0,0,0,0,0,0
8,Cotton farming,0,0,0,0,0,0
9,Sugarcane and sugar beet farming,25.64050484,3834000.111,1289208.889,910818.2788,538212.8358,-58460.73851
10,All other crop farming,24824.26172,901726501.5,363216003.4,119769691.5,90115509.03,-14178953.17
11,"Beef cattle ranching and farming, including feedlots and dual-purpose ranching and farming",3569.715576,760861938.5,14867792.13,159124694.8,114679954.5,36002571.11
12,Dairy cattle and milk production,2370.747559,1131647949,65604858.4,86039337.16,58076438.9,4247114.182
13,Poultry and egg production,613.9911499,372318695.1,27977008.82,7029895.306,7705147.743,11635275.84
14,"Animal production, except cattle and poultry and eggs",1720.639282,248550857.5,34447544.1,136842849.7,49666412.35,15711192.13
15,"Forestry, forest products, and timber tract production",722.0459595,81547515.87,45345954.9,20646381.38,-164785.9365,1634627.581
16,Commercial logging,5908.324707,720712646.5,265440094,257145782.5,-17487636.57,17655382.16
17,Commercial fishing,5749.962402,482497833.3,202607635.5,119530777,81021965.03,71276153.56
18,Commercial hunting and trapping,119.0900345,16880331.04,24162.18817,14052949.91,39846.45009,1204828.858
19,Support activities for agriculture and forestry,31525.70898,1377778809,1242130371,123364219.7,-265775482.2,40520862.58
20,Oil and gas extraction,3982.133545,908555114.7,1954256.296,747690.618,-221284.8514,750937.5215
21,Coal mining,79.0836792,23101909.64,1470717.072,6004423.141,-38545.20619,1178937.912
22,"Copper, nickel, lead, and zinc mining",197.9914856,129245880.1,7877014.637,8036763.191,-435736.7456,12933457.37
23,Iron ore mining,0,0,0,0,0,0
24,Gold ore mining,373.4379883,144114608.8,37035541.53,22699304.58,-619866.2519,6108661.175
25,Silver ore mining,0,0,0,0,0,0
26,Uranium-radium-vanadium ore mining,0,0,0,0,0,0
27,Other metal ore mining,87.28109741,27903993.61,5125397.205,5183359.623,-86774.30451,979639.8282
28,Stone mining and quarrying,1306.49939,257330688.5,43801891.33,48648944.85,-1132289.648,10266580.58
29,Sand and gravel mining,1855.645508,320702453.6,89611808.78,65546791.08,-936493.6948,12273525.24
30,"Other clay, ceramic, refractory minerals mining",0,0,0,0,0,0
31,"Potash, soda, and borate mineral mining",0,0,0,0,0,0
32,Phosphate rock mining,0,0,0,0,0,0
33,Other chemical and fertilizer mineral mining,0,0,0,0,0,0
34,Other nonmetallic minerals,77.17197418,13550796.51,1159138.68,5448614.12,-12147.07736,545292.8543
35,Drilling oil and gas wells,405.6112671,100508560.2,4349020.958,1587576.389,-31990.28969,1860543.609
36,Support activities for oil and gas operations,566.2672119,108106185.9,9956310.272,1419690.251,-53588.81876,1991426.587
37,Metal mining services,611.394165,153694732.7,14654572.49,226671.9788,-44208.69797,2577929.735
38,Other nonmetallic minerals services,448.2817993,100574478.1,1317126.751,122379.6606,-25813.25173,364547.5209
39,Electric power generation - Hydroelectric,484.0996399,322168975.8,37122562.41,-45501.32528,110720367.4,61609561.92
40,Electric power generation - Fossil fuel,260.7299805,519426269.5,39482673.65,0,161434814.5,101958633.4
41,Electric power generation - Nuclear,0,0,0,0,0,0
42,Electric power generation - Solar,9.399400711,5278393.745,891086.3996,0,2522377.253,624762.5351
43,Electric power generation - Wind,167.5701294,244230285.6,8040325.165,-10340.05638,91782043.46,51661239.62
44,Electric power generation - Geothermal,0,0,0,0,0,0
45,Electric power generation - Biomass,94.21427917,34155834.2,142608.4787,-13650.07367,502909.7199,9359615.326
46,Electric power generation - All other,4.998858452,1034395.933,281002.3427,0,-41484.83276,200384.3337
47,Electric power transmission and distribution,3228.793701,5959301758,472186462.4,-17935.21456,1830969482,1124965088
48,Natural gas distribution,1084.703369,998245361.3,102433059.7,-41613.27705,295938079.8,152208145.1
49,"Water, sewage and other systems",1267.100342,370723663.3,61447616.58,-48044.43941,108484008.8,55841136.93
50,Construction of new health care structures,7473.742188,1283725830,397150390.6,163353988.6,246055694.6,17051082.61
51,Construction of new manufacturing structures,12451.87109,2087902344,681151977.5,260809021,242868866,25807804.11
52,Construction of new power and communication structures,16594.49219,3315194580,871031921.4,381485839.8,811168396,50642498.02
53,Construction of new educational and vocational structures,19078.27734,2896040771,1072324951,343350280.8,489556762.7,34662742.61
54,Construction of new highways and streets,15298.13086,3514988770,860460083,319113372.8,821201416,45050678.25
55,"Construction of new commercial structures, including farm structures",29324.53906,4234319336,1518945313,631384033.2,353418701.2,82598770.14
56,Construction of other new nonresidential structures,37908.49219,3526429199,2012863525,835725830.1,-1107604492,53536605.83
57,Construction of new single-family residential structures,46743.12891,7737327148,2406341797,1056527344,1386800293,118258476.3
58,Construction of new multifamily residential structures,14382.40527,1880313965,749369384.8,326060730,438882354.7,24087802.89
59,Construction of other new residential structures,32309.40039,7181805664,1709656128,718350036.6,1114437012,154642822.3
60,Maintenance and repair construction of nonresidential structures,21958.46289,4881677246,1158187622,495563201.9,610551696.8,101107086.2
61,Maintenance and repair construction of residential structures,10814.45605,2608762939,605902343.8,219436157.2,395191528.3,95123481.75
62,"Maintenance and repair construction of highways, streets, bridges, and tunnels",7944.540039,870357910.2,422324768.1,177235290.5,-187137939.5,20211465.84
63,Dog and cat food manufacturing,322.1156616,408365509,17236303.33,431771.04,42603157.04,7083134.174
64,Other animal food manufacturing,860.4421387,883640625,57093666.08,1826100.826,35190544.13,22327688.22
65,Flour milling,133.3795624,149475082.4,9475635.529,74286.67694,8872819.901,767776.4297
66,Rice milling,0,0,0,0,0,0
67,Malt manufacturing,127.9310455,194973556.5,10415654.18,63954.79292,16390741.35,1226692.438
68,Wet corn milling,60.56951141,110908821.1,5227730.274,30706.94953,5933688.164,735384.4047
69,Soybean and other oilseed processing,304.0982056,1388366577,18925439.83,255158.9906,66749038.7,7080840.111
70,Fats and oils refining and blending,54.62915802,84720504.76,3262718.916,30086.96623,2782215.357,443295.1808
71,Breakfast cereal manufacturing,298.7021179,251400528,24294820.79,58786.46672,31605930.33,1477807.76
72,Beet sugar manufacturing,0,0,0,0,0,0
73,Sugar cane mills and refining,0,0,0,0,0,0
74,Nonchocolate confectionery manufacturing,310.0431519,116664917,10212439.54,883649.5876,4308997.154,662993.0139
75,Chocolate and confectionery manufacturing from cacao beans,147.4357605,95526664.73,7785325.527,277063.9956,7783181.667,630159.6165
76,Confectionery manufacturing from purchased chocolate,965.4403687,319768402.1,38109569.55,1315011.144,15161246.3,1792452.455
77,"Frozen fruits, juices and vegetables manufacturing",6139.175781,2746637207,364805114.7,996603.0717,283401825,15237207.41
78,Frozen specialties manufacturing,1917.175171,746821960.4,127605308.5,459425.3004,60578197.48,3093076.468
79,Canned fruits and vegetables manufacturing,2237.898682,1086538208,121565826.4,1290304.78,90058509.83,5063622.952
80,Canned specialties,60.56242371,44936538.7,1729440.57,262294.9779,2260801.792,217181.2654
81,Dehydrated food products manufacturing,1274.175049,577120544.4,81340003.97,549748.4803,63382080.08,2825341.94
82,Cheese manufacturing,295.4776917,255213195.8,10666572.57,545399.3082,3917429.447,1394114.971
83,"Dry, condensed, and evaporated dairy product manufacturing",277.4139099,373424652.1,23877216.34,36871.96597,34286411.29,1938399.911
84,Fluid milk manufacturing,759.2074585,554671325.7,53832870.48,196932.6735,32118095.4,3392941.713
85,Creamery butter manufacturing,191.4426117,349023254.4,13378906.25,36104.95105,36303611.76,3136024.952
86,Ice cream and frozen dessert manufacturing,154.4888611,70223953.25,11772429.47,205848.9919,6127434.731,429765.1052
87,Frozen cakes and other pastries manufacturing,3750.815918,379087829.6,145776733.4,3266914.606,16910821.91,62984386.44
88,Poultry processing,1146.612793,353727478,58164001.46,116901.8969,17438404.08,1691747.308
89,"Animal, except poultry, slaughtering",2960.233643,2028166748,172544937.1,1083000.779,55469295.5,13782311.44
90,Meat processed from carcasses,1539.479248,815805175.8,107385292.1,892847.7168,9496298.79,5107161.522
91,Rendering and meat byproduct processing,255.8274384,99723144.53,19163457.87,413957.8342,2268595.695,1233606.458
92,Seafood product preparation and packaging,5892.591797,2577524902,504538818.4,3553146.601,116964515.7,15967484.47
93,"Bread and bakery product, except frozen, manufacturing",8977.807617,1250644531,341905487.1,14294324.87,78470832.82,67165153.5
94,Cookie and cracker manufacturing,388.6078186,129756759.6,18813535.69,488375.5147,7842938.423,796001.8516
95,"Dry pasta, mixes, and dough manufacturing",436.8144836,263552490.2,33812278.75,175894.7372,41789028.17,1527274.37
96,Tortilla manufacturing,85.35076904,17217556,2703392.029,307156.2946,520536.4227,115777.8054
97,Roasted nuts and peanut butter manufacturing,689.973938,334364929.2,47603843.69,564890.6827,51874156.95,1558838.844
98,Other snack food manufacturing,1019.957703,553371032.7,81870170.59,913977.1461,74130485.53,3286577.94
99,Coffee and tea manufacturing,2069.768555,1312524048,106748115.5,5079391.003,95706665.04,7692424.774
100,Flavoring syrup and concentrate manufacturing,156.6451874,364141693.1,6425563.335,361484.1402,47587253.57,2199284.792
101,"Mayonnaise, dressing, and sauce manufacturing",100.9546661,53788093.57,4791804.314,527603.9839,4057984.352,311990.7081
102,Spice and extract manufacturing,397.3207703,213523696.9,23991859.44,776773.9296,12040184.02,1261007.19
103,All other food manufacturing,1564.10083,536885376,72716072.08,3776623.249,23909683.23,2701388.597
104,Bottled and canned soft drinks & water,2489.999756,1926521973,223274795.5,1531126.499,214524978.6,15563362.12
105,Manufactured ice,60.63048553,8122936.249,2763528.824,273772.7761,-1737282.515,71655.39265
106,Breweries,3195.478271,1356529175,111538429.3,11090634.35,142764526.4,110501258.9
107,Wineries,5012.986328,1606922363,204079055.8,14782920.84,124821266.2,46608112.34
108,Distilleries,374.8539734,367588043.2,14514318.47,2337810.516,35406734.47,89496681.21
109,Tobacco product manufacturing,34.84565735,87689041.14,1223838.329,56486.94187,11816226.96,27079332.35
110,"Fiber, yarn, and thread mills",56.4091568,16605009.08,1371718.884,46555.54891,238200.7092,244859.9935
111,Broadwoven fabric mills,316.2018433,72315132.14,15315377.24,142743.5428,2746500.254,866720.1996
112,Narrow fabric mills and schiffli machine embroidery,31.8217392,5058912.277,1233423.114,41518.30077,53650.39036,52267.2981
113,Nonwoven fabric mills,104.3281174,44742336.27,7186758.041,56605.08946,2665721.893,521028.5783
114,Knit fabric mills,0,0,0,0,0,0
115,Textile and fabric finishing mills,22.46886253,5020497.322,527835.3095,59938.31158,62259.62564,59292.83798
116,Fabric coating mills,22.99669838,7829411.507,1236754.06,17811.07113,178412.9441,78263.06671
117,Carpet and rug mills,19.6948719,5262049.198,90403.43761,906.3851321,27408.408,100410.9383
118,Curtain and linen mills,158.8761444,30240306.85,5698410.511,7874.24203,1019294.977,372861.4151
119,Textile bag and canvas mills,1075.526123,181016418.5,56892536.16,28422.83994,6156646.729,1919075.131
120,"Rope, cordage, twine, tire cord and tire fabric mills",406.2430115,113587410,28206790.92,4031.777848,8306982.04,1353595.018
121,Other textile product mills,538.835022,73776199.34,20848274.23,22544.85339,1914130.211,862304.2107
122,Hosiery and sock mills,126.3333359,12110609.05,3334125.042,276108.7418,298951.2086,1445842.266
123,Other apparel knitting mills,81.87044525,8082108.498,1550219.059,90635.67966,131760.9102,1381642.699
124,Cut and sew apparel contractors,776.9138184,45785205.84,19564472.2,519606.4115,157537.4603,1646556.616
125,Mens and boys cut and sew apparel manufacturing,720.4995728,104172988.9,33088466.64,929972.4698,3033832.55,2055513.62
126,Womens and girls cut and sew apparel manufacturing,668.4749756,132815124.5,25600881.58,701735.6157,3974852.8,2189679.861
127,Other cut and sew apparel manufacturing,294.4082947,29401872.63,5156841.278,623667.717,448102.1464,1575430.632
128,Apparel accessories and other apparel manufacturing,355.6080933,34329025.27,7970936.775,570816.1592,654163.599,1607835.889
129,Leather and hide tanning and finishing,42.96460724,10866170.88,185516.417,-114147.2086,39165.34409,96675.45557
130,Footwear manufacturing,183.2145844,29942909.24,7817021.847,-111426.3013,254642.7548,226290.7475
131,Other leather and allied product manufacturing,314.6455078,26008628.85,4427748.68,-1380396.724,47976.31502,249410.9273
132,Sawmills,6013.780762,1874863037,444255767.8,24431665.42,181731674.2,15048580.17
133,Wood preservation,438.9059448,278626556.4,31316968.92,2398743.629,58553359.99,2320801.973
134,Veneer and plywood manufacturing,1201.579834,348717742.9,80809402.47,5434707.642,33145107.27,2769024.849
135,Engineered wood member and truss manufacturing,1270.912354,289897522,70236518.86,4708857.536,23640111.92,2338410.616
136,Reconstituted wood product manufacturing,117.7974777,59786914.83,6052204.132,1005142.808,7459002.018,591349.8402
137,Wood windows and door manufacturing,1549.42981,361376739.5,87832778.93,9002939.224,30438541.41,3185045.719
138,"Cut stock, resawing lumber, and planing",674.8452148,166358520.5,33336181.64,5805038.452,24837270.74,1446422.219
139,"Other millwork, including flooring",787.1539307,165367431.6,37675609.59,7290310.383,16851091.38,1471911.788
140,Wood container and pallet manufacturing,1134.472046,182667114.3,52544872.28,8092689.514,10170193.67,1530404.806
141,Manufactured home (mobile home) manufacturing,222.8799744,49759868.62,6797810.555,1788348.675,4595203.876,562419.0569
142,Prefabricated wood building manufacturing,242.0421295,41195194.24,9910919.189,3572066.069,1275274.873,365825.4743
143,All other miscellaneous wood product manufacturing,608.8130493,111370704.7,26069967.27,8791338.921,7570891.857,951500.237
144,Pulp mills,64.04602051,45035022.74,7552800.655,0,2988353.491,450029.0155
145,Paper mills,3034.531738,2449626953,363560424.8,3559191.942,330085723.9,23575908.66
146,Paperboard mills,829.8782349,713672729.5,95817443.85,103343.6283,76798576.35,7633562.088
147,Paperboard container manufacturing,2722.89502,1342742676,241707153.3,1059478.76,71284141.54,13373763.08
148,Paper bag and coated and treated paper manufacturing,440.0894775,200543594.4,33274101.26,534391.1052,15878348.35,2026360.989
149,Stationery product manufacturing,205.9611053,82979125.98,15394184.11,516117.2152,3831775.188,877902.0905
150,Sanitary paper product manufacturing,73.75200653,51303989.41,4064192.772,472330.898,5576899.529,613581.5978
151,All other converted paper product manufacturing,269.8658752,88763900.76,20087883,402155.2205,5787456.989,936476.7075
152,Printing,7307.796875,1126427246,343741210.9,36674934.39,99621330.26,12738879.2
153,Support activities for printing,236.6068268,25533077.24,9845030.785,941329.5984,2735966.921,267669.0817
154,Petroleum refineries,2398.577148,21000029297,571004211.4,801444.2325,4618691895,76861213.68
155,Asphalt paving mixture and block manufacturing,291.1012878,242184005.7,34547729.49,418053.925,22530908.58,355245.6796
156,Asphalt shingle and coating materials manufacturing,284.6661682,272787628.2,29603546.14,493717.5512,73904548.65,695251.4648
157,Petroleum lubricating oil and grease manufacturing,63.80129242,70962333.68,5510565.758,217033.416,16477006.91,168816.03
158,All other petroleum and coal products manufacturing,0,0,0,0,0,0
159,Petrochemical manufacturing,51.70969009,331269256.6,10937286.38,1608.851016,76666931.15,5849618.435
160,Industrial gas manufacturing,140.678833,151580917.4,17455991.74,14253.24846,31862178.8,2541464.329
161,Synthetic dye and pigment manufacturing,164.90448,140651504.5,21827411.65,3866.908606,30770492.55,1742727.518
162,Other basic inorganic chemical manufacturing,812.4650269,701795715.3,106756416.3,13586.14769,136540847.8,10045540.81
163,Other basic organic chemical manufacturing,452.1481323,669670043.9,44817962.65,38882.73239,46322761.54,9497221.947
164,Plastics material and resin manufacturing,737.9363403,952885864.3,75792800.9,32358.41542,51039180.76,14120725.63
165,Synthetic rubber manufacturing,0,0,0,0,0,0
166,Artificial and synthetic fibers and filaments manufacturing,0,0,0,0,0,0
167,Nitrogenous fertilizer manufacturing,190.8526459,189872955.3,16527774.81,140644.5354,26328464.51,2930901.766
168,Phosphatic fertilizer manufacturing,0,0,0,0,0,0
169,Fertilizer mixing,261.2627869,147105072,16142896.65,138913.3781,21366685.87,2206587.076
170,Pesticide and other agricultural chemical manufacturing,131.0380554,198207931.5,11790640.83,16937.51104,27362758.64,3072003.603
171,Medicinal and botanical manufacturing,407.1239319,206591796.9,26645338.06,49534.67473,28760297.78,3225327.253
172,Pharmaceutical preparation manufacturing,939.5999146,1184056641,80290931.7,202144.8165,262832336.4,44135433.2
173,In-vitro diagnostic substance manufacturing,376.8954468,167456390.4,40565601.35,14822.30145,26771638.87,2068274.021
174,Biological product (except diagnostic) manufacturing,973.9866333,645917846.7,113416404.7,8438.36274,188003967.3,8879076.004
175,Paint and coating manufacturing,197.9930878,139041107.2,10501204.49,189315.1999,13531701.09,2184258.699
176,Adhesive manufacturing,133.325943,86064735.41,11739065.17,42784.80262,10082070.35,1134961.963
177,Soap and other detergent manufacturing,323.9636841,313767120.4,8976468.086,547053.5755,27433153.15,5864190.578
178,Polish and other sanitation good manufacturing,194.4552307,106186874.4,7512114.525,305348.1281,10251556.4,1889708.757
179,Surface active agent manufacturing,0,0,0,0,0,0
180,Toilet preparation manufacturing,621.7494507,507304321.3,38661407.47,563386.6787,133073577.9,9175004.959
181,Printing ink manufacturing,28.55298805,11919952.39,1979813.933,14876.85647,54924.94628,166080.3109
182,Explosives manufacturing,0,0,0,0,0,0
183,Custom compounding of purchased resins,0,0,0,0,0,0
184,Photographic film and chemical manufacturing,48.07953262,32961765.29,2922606.23,36171.60767,4004116.058,478666.0969
185,Other miscellaneous chemical product manufacturing,359.7084961,205397155.8,26781454.09,308646.7683,16841276.17,3256102.8
186,Plastics packaging materials and unlaminated film and sheet manufacturing,1355.926758,592112121.6,104177772.5,-435564.3094,43961311.34,4092097.282
187,Unlaminated plastics profile shape manufacturing,1046.843994,435219787.6,72956039.43,-359487.325,57036849.98,2836751.938
188,Plastics pipe and pipe fitting manufacturing,564.8161621,245225631.7,31626190.19,-581329.3457,29253398.9,1989761.591
189,"Laminated plastics plate, sheet (except packaging), and shape manufacturing",195.4380646,58672077.18,11411619.19,-262112.3791,6383753.3,443397.9988
190,Polystyrene foam product manufacturing,304.4695129,104556633,20610569,-114486.7167,8593656.54,799203.5747
191,Urethane and other foam product (except polystyrene) manufacturing,702.6531372,264955200.2,54974102.02,-764688.4918,22032674.79,1835213.78
192,Plastics bottle manufacturing,401.8174438,168856369,27637121.2,-123894.6542,11404149.06,1137651.682
193,Other plastics product manufacturing,4173.398926,1113572632,242839233.4,-3076774.359,76502220.15,7942580.7
194,Tire manufacturing,115.8509903,42437316.89,7231347.561,-48582.72895,1575203.18,408948.9579
195,Rubber and plastics hoses and belting manufacturing,21.49004173,5552747.25,1024945.498,-89303.41154,398113.1613,44534.87694
196,Other rubber product manufacturing,145.7466888,44169605.26,8496076.584,-136335.8647,2638850.451,344549.7453
197,"Pottery, ceramics, and plumbing fixture manufacturing",381.7081909,58021541.6,15933809.28,3900448.084,4325314.045,650636.7326
198,"Brick, tile, and other structural clay product manufacturing",263.5682373,59408943.18,9460988.045,1522152.185,7395926.952,823363.6022
199,Flat glass manufacturing,322.9736023,128245727.5,23330913.54,537263.0358,25126331.33,1254036.069
200,Other pressed and blown glass and glassware manufacturing,516.9946899,98487030.03,13540464.4,3640659.571,5822299.004,1121894.598
201,Glass container manufacturing,326.7098694,130674697.9,30643909.45,330169.8864,21946731.57,1229629.04
202,Glass product manufacturing made of purchased glass,1832.101196,475036285.4,113712516.8,4913912.773,71276924.13,4489925.861
203,Cement manufacturing,216.380127,149432144.2,22537574.77,80396.36165,32323200.23,1561324.239
204,Ready-mix concrete manufacturing,2751.29834,1177150146,232224578.9,1163320.78,159581222.5,11081986.43
205,Concrete block and brick manufacturing,152.7361908,50795043.95,10294235.23,109659.0236,9049034.119,590749.681
206,Concrete pipe manufacturing,111.36866,32618988.04,6692893.505,20982.82427,4435035.706,426150.0537
207,Other concrete product manufacturing,1489.432007,354309051.5,94562881.47,1247284.055,44240554.81,3549493.551
208,Lime manufacturing,31.66861725,19467117.31,3111160.755,19375.63904,4423143.387,220927.2981
209,Gypsum product manufacturing,475.4824829,301687866.2,43973068.24,729616.5824,71884002.69,3036221.266
210,Abrasive product manufacturing,176.9085236,85149513.24,17125495.91,38141.25061,33515205.38,704555.8095
211,Cut stone and stone product manufacturing,937.9533691,136093429.6,54096851.35,1878854.275,8642648.697,1221265.316
212,Ground or treated mineral and earth manufacturing,358.9067688,273820617.7,48081569.67,230066.4335,90953140.26,2263661.861
213,Mineral wool manufacturing,58.7421875,24548341.75,3492596.388,100955.4565,5047947.407,278747.797
214,Miscellaneous nonmetallic mineral products manufacturing,58.5194664,22784524.92,3341341.972,282561.6002,5146086.216,249552.9503
215,Iron and steel mills and ferroalloy manufacturing,133.2647552,114058067.3,7176408.291,-3330035.686,4016172.409,1722307.324
216,"Iron, steel pipe and tube manufacturing from purchased steel",37.34992599,13955906.87,2025020.599,-362093.1208,811197.5789,205264.315
217,Rolled steel shape manufacturing,452.4571533,338352905.3,60514652.25,-220604.8667,62158226.01,3775225.878
218,Steel wire drawing,345.5630798,142280700.7,33727573.39,-149878.2635,19659624.1,1644763.708
219,Alumina refining and primary aluminum production,937.4135742,703392456.1,101675972,-646524.0717,62446903.23,8400911.331
220,Secondary smelting and alloying of aluminum,0,0,0,0,0,0
221,"Aluminum sheet, plate, and foil manufacturing",963.307373,831304626.5,104639808.7,-235669.8662,80082733.15,10649039.27
222,"Other aluminum rolling, drawing and extruding",157.0606079,65410308.84,10263205.53,-492951.9892,3452660.561,811209.7383
223,Nonferrous metal (exc aluminum) smelting and refining,254.1322937,290026184.1,23544536.59,-524273.9916,87081031.8,3976891.279
224,"Copper rolling, drawing, extruding and alloying",0,0,0,0,0,0
225,"Nonferrous metal, except copper and aluminum, shaping",257.0889587,111345611.6,21584270.48,-709837.0194,5241242.409,1257797.599
226,Secondary processing of other nonferrous metals,5.203901291,6226602.077,378107.3391,-54449.7259,960344.6722,80923.45297
227,Ferrous metal foundries,1156.750854,329084350.6,78101676.94,-3679046.392,64070938.11,4279256.344
228,Nonferrous metal foundries,713.935791,157143066.4,40392829.9,-2878291.845,16594007.49,1853924.632
229,Custom roll forming,68.42897797,37870723.72,5955819.13,53443.21206,3693727.732,316829.7112
230,Crown and closure manufacturing and metal stamping,181.47789,51620735.17,12982588.77,165549.4571,7089554.31,397298.9917
231,Iron and steel forging,50.18788528,16318078.99,3568559.885,120696.2392,1558026.791,150889.6798
232,Nonferrous forging,61.60952759,19087177.28,5156370.64,214854.1659,1545539.618,162468.3589
233,"Cutlery, utensil, pot, and pan manufacturing",82.03672028,40598690.03,3598694.563,313581.4667,10694430.35,451734.4534
234,Handtool manufacturing,152.2823181,36902900.7,9872750.282,594371.2592,7405236.244,357598.3942
235,Prefabricated metal buildings and components manufacturing,342.3673096,106127662.7,25041172.03,813795.9838,12248062.13,1019041.896
236,Fabricated structural metal manufacturing,1650.94812,544980896,117736404.4,2833160.4,68831863.4,5102160.454
237,Plate work manufacturing,532.9130859,109810203.6,34682792.66,863617.003,603169.2624,1082533.121
238,Metal window and door manufacturing,657.723999,169868499.8,41759967.8,747566.5808,26425531.39,1578792.453
239,Sheet metal work manufacturing,4261.582031,967285827.6,303272857.7,3926582.813,104631958,8170758.247
240,Ornamental and architectural metal work manufacturing,1124.414429,245854278.6,64395141.6,4127232.552,26316774.37,2163923.979
241,Power boiler and heat exchanger manufacturing,153.2059631,45226646.42,11446785.93,144765.541,5742149.83,441134.5422
242,Metal tank (heavy gauge) manufacturing,766.1126099,200431457.5,58112762.45,665105.2237,14671786.31,1897091.985
243,Metal cans manufacturing,286.2833862,249769363.4,27970598.22,147453.8445,42734889.98,2134824.753
