Industry Detail ,,,,,,,
IndustryCode,Description,Employment,Output,EmployeeCompensation,ProprietorIncome,OtherPropertyTypeIncome,TaxOnProductionAndImports
0,Total,28187.805364735425,4880669584.1662588,1228407103.0528286,289490227.70551163,554929034.15261388,732181796.75704563
1,Oilseed farming,15.129453659057617,8786654.4723510742,34839.741885662079,1293010.7116699219,7056912.4221801758,-115742.92927980423
2,Grain farming,160.57086181640625,33421543.121337891,3840558.0520629883,1508674.2639541626,14885192.87109375,-452608.49595069885
3,Vegetable and melon farming,47.566665649414062,4670233.2496643066,1260567.307472229,100164.86048698425,1139514.684677124,1742.1317752450705
4,Fruit farming,1.9322613477706909,140616.84906482697,40236.935019493103,2362.0931897312403,43702.725321054459,68.255940277595073
5,Tree nut farming,0.12166213244199753,4017.4666792154312,3608.667990192771,57.185858167940751,139.11332644056529,3.2725508845032891
6,"Greenhouse, nursery, and floriculture production",53.656204223632812,4747369.7662353516,2165026.6647338867,44793.739914894104,888242.18511581421,850.04081483930349
7,Tobacco farming,0,0,0,0,0,0
8,Cotton farming,0,0,0,0,0,0
9,Sugarcane and sugar beet farming,0,0,0,0,0,0
10,All other crop farming,308.38699340820312,7520214.5576477051,4121521.9497680664,132367.22350120544,792420.08924484253,-107442.98249483109
11,"Beef cattle ranching and farming, including feedlots and dual-purpose ranching and farming",111.38614654541016,13684640.884399414,355996.01268768311,378622.6212978363,4635437.9653930664,474733.29305648804
12,Dairy cattle and milk production,302.2919921875,110074012.75634766,8285756.1111450195,1107402.0862579346,11687662.124633789,2739098.072052002
13,Poultry and egg production,0.33311095833778381,161846.36950492859,15406.91964328289,410.54585017263889,4298.4923347830772,868.83129552006722
14,"Animal production, except cattle and poultry and eggs",30.97661018371582,3536385.5361938477,527984.44032669067,253956.34770393372,2429237.3657226562,188733.22010040283
15,"Forestry, forest products, and timber tract production",4.0744571685791016,477937.66856193542,366162.86635398865,0,31209.716573357582,1082.4698256328702
16,Commercial logging,54.774566650390625,6397317.4095153809,1234336.1377716065,3185592.4129486084,62256.891280412674,79904.481768608093
17,Commercial fishing,0,0,0,0,0,0
18,Commercial hunting and trapping,0.3125704824924469,57473.421096801758,0,51254.678517580032,0,1786.0607476904988
19,Support activities for agriculture and forestry,50.136180877685547,2024879.9324035645,1369454.1454315186,475371.33097648621,-279560.17851829529,83932.742476463318
20,Oil and gas extraction,2.8242056369781494,101378234.86328125,0,96297012.329101562,15309.984795749188,12312.402948737145
21,Coal mining,0,0,0,0,0,0
22,"Copper, nickel, lead, and zinc mining",0,0,0,0,0,0
23,Iron ore mining,0,0,0,0,0,0
24,Gold ore mining,0,0,0,0,0,0
25,Silver ore mining,0,0,0,0,0,0
26,Uranium-radium-vanadium ore mining,0,0,0,0,0,0
27,Other metal ore mining,134.69850158691406,33063220.977783203,419247.65706062317,4091660.4995727539,165447.16060161591,2610562.0861053467
28,Stone mining and quarrying,22.970586776733398,7300751.6860961914,1194381.2370300293,2143746.3760375977,915363.31176757812,308976.47142410278
29,Sand and gravel mining,7.6942911148071289,4614707.9467773438,78724.652528762817,3791561.6035461426,17179.727554321289,87835.155427455902
30,"Other clay, ceramic, refractory minerals mining",0,0,0,0,0,0
31,"Potash, soda, and borate mineral mining",0,0,0,0,0,0
32,Phosphate rock mining,0,0,0,0,0,0
33,Other chemical and fertilizer mineral mining,369.8182373046875,83148429.870605469,28101938.247680664,1463276.2670516968,8936076.1642456055,5914773.9410400391
34,Other nonmetallic minerals,0,0,0,0,0,0
35,Drilling oil and gas wells,0.8872382640838623,8593398.0941772461,0,8156163.215637207,0,7565.2287341654301
36,Support activities for oil and gas operations,0.30363991856575012,10879631.042480469,0,10333256.721496582,756.05837628245354,2392.6091380417347
37,Metal mining services,0.30364927649497986,10984791.75567627,0,10434166.90826416,1471.0640534758568,1385.5666620656848
38,Other nonmetallic minerals services,0.30364948511123657,11216496.467590332,0,10654222.48840332,1209.2659017071128,1448.7191801890731
39,Electric power generation - Hydroelectric,0,0,0,0,0,0
40,Electric power generation - Fossil fuel,0,0,0,0,0,0
41,Electric power generation - Nuclear,0,0,0,0,0,0
42,Electric power generation - Solar,0,0,0,0,0,0
43,Electric power generation - Wind,0,0,0,0,0,0
44,Electric power generation - Geothermal,0,0,0,0,0,0
45,Electric power generation - Biomass,0,0,0,0,0,0
46,Electric power generation - All other,0,0,0,0,0,0
47,Electric power transmission and distribution,25.287984848022461,30673868.179321289,2491616.0106658936,437018.69249343872,3794222.8317260742,4126605.9875488281
48,Natural gas distribution,15.26096248626709,9265310.2874755859,824268.1622505188,275168.86591911316,925327.1222114563,941635.3702545166
49,"Water, sewage and other systems",4.0398297309875488,1220586.2998962402,79106.077551841736,512644.52934265137,60080.505907535553,106462.54569292069
50,Construction of new health care structures,52.372364044189453,7001735.6872558594,1928501.1291503906,735671.34141921997,1034511.5661621094,78790.627419948578
51,Construction of new manufacturing structures,87.638557434082031,11785316.467285156,3341868.6389923096,1171262.6218795776,976270.79486846924,121564.73845243454
52,Construction of new power and communication structures,163.83921813964844,29007276.53503418,7381610.8703613281,2981839.8952484131,6370911.1213684082,416633.21852684021
53,Construction of new educational and vocational structures,143.57443237304688,18104166.030883789,6804255.0086975098,1543336.6298675537,2399101.734161377,161952.54027843475
54,Construction of new highways and streets,120.55330657958984,23338554.382324219,5689280.0331115723,1433087.5873565674,4449503.4217834473,189289.27183151245
55,"Construction of new commercial structures, including farm structures",202.04995727539063,23472303.39050293,7302340.9843444824,2886927.1278381348,1553094.1486358643,375190.04940986633
56,Construction of other new nonresidential structures,273.60006713867188,20925489.42565918,10899624.824523926,3819749.116897583,-6557819.8432922363,264094.79975700378
57,Construction of new single-family residential structures,327.02017211914062,44412498.474121094,11689697.265625,4735550.8804321289,7392788.8870239258,1219432.8308105469
58,Construction of new multifamily residential structures,100.60631561279297,9826755.5236816406,3647657.3944091797,1466286.8976593018,2111900.5680084229,209191.57564640045
59,Construction of other new residential structures,227.63420104980469,41975593.566894531,8598462.1047973633,3237137.7944946289,4929564.4760131836,659017.98009872437
60,Maintenance and repair construction of nonresidential structures,152.94770812988281,28444427.490234375,5608367.4430847168,2237450.5996704102,2638254.1656494141,433748.36444854736
61,Maintenance and repair construction of residential structures,72.839378356933594,14192661.285400391,2565959.2151641846,958333.84990692139,1557565.2122497559,401230.69286346436
62,"Maintenance and repair construction of highways, streets, bridges, and tunnels",54.928230285644531,4904123.3062744141,2021862.268447876,802883.86344909668,-1039939.9995803833,92908.777296543121
63,Dog and cat food manufacturing,0,0,0,0,0,0
64,Other animal food manufacturing,18.225336074829102,18105037.689208984,578140.61641693115,15462.055802345276,218968.88315677643,1042069.1967010498
65,Flour milling,0,0,0,0,0,0
66,Rice milling,0,0,0,0,0,0
67,Malt manufacturing,0,0,0,0,0,0
68,Wet corn milling,0,0,0,0,0,0
69,Soybean and other oilseed processing,0,0,0,0,0,0
70,Fats and oils refining and blending,0,0,0,0,0,0
71,Breakfast cereal manufacturing,0,0,0,0,0,0
72,Beet sugar manufacturing,0,0,0,0,0,0
73,Sugar cane mills and refining,0,0,0,0,0,0
74,Nonchocolate confectionery manufacturing,0,0,0,0,0,0
75,Chocolate and confectionery manufacturing from cacao beans,0,0,0,0,0,0
76,Confectionery manufacturing from purchased chocolate,0,0,0,0,0,0
77,"Frozen fruits, juices and vegetables manufacturing",0,0,0,0,0,0
78,Frozen specialties manufacturing,299.611572265625,110744445.80078125,20127607.345581055,5367.8997792303562,1638043.6420440674,2225916.1472320557
79,Canned fruits and vegetables manufacturing,127.26596832275391,62399112.701416016,10345716.47644043,18231.9525629282,1313891.5300369263,1327565.5508041382
80,Canned specialties,0,0,0,0,0,0
81,Dehydrated food products manufacturing,0,0,0,0,0,0
82,Cheese manufacturing,17.811883926391602,16319864.273071289,1446198.1058120728,6843.47003698349,91052.062809467316,387161.0164642334
83,"Dry, condensed, and evaporated dairy product manufacturing",0,0,0,0,0,0
84,Fluid milk manufacturing,0,0,0,0,0,0
85,Creamery butter manufacturing,0,0,0,0,0,0
86,Ice cream and frozen dessert manufacturing,0,0,0,0,0,0
87,Frozen cakes and other pastries manufacturing,36.003307342529297,2942491.0545349121,908006.90650939941,28075.568377971649,137887.71629333496,427271.78335189819
88,Poultry processing,0,0,0,0,0,0
89,"Animal, except poultry, slaughtering",4.843165397644043,3242005.1097869873,207369.77458000183,3342.9437316954136,40364.168584346771,70063.702762126923
90,Meat processed from carcasses,8.5511398315429688,4463905.8113098145,473861.99235916138,10243.215598165989,26318.449527025223,104592.18174219132
91,Rendering and meat byproduct processing,1.6078424453735352,724438.90571594238,183644.95038986206,0,48211.392015218735,10887.879878282547
92,Seafood product preparation and packaging,0,0,0,0,0,0
93,"Bread and bakery product, except frozen, manufacturing",68.593589782714844,8752726.5548706055,2311224.2221832275,29302.669689059258,207472.99492359161,483566.73121452332
94,Cookie and cracker manufacturing,0,0,0,0,0,0
95,"Dry pasta, mixes, and dough manufacturing",0,0,0,0,0,0
96,Tortilla manufacturing,0,0,0,0,0,0
97,Roasted nuts and peanut butter manufacturing,119.26564788818359,48537857.055664062,6201264.3814086914,74207.909405231476,1099661.9462966919,928371.25062942505
98,Other snack food manufacturing,4.2900762557983398,2154548.4066009521,395625.32305717468,0,55711.82444691658,49487.300217151642
99,Coffee and tea manufacturing,0,0,0,0,0,0
100,Flavoring syrup and concentrate manufacturing,0,0,0,0,0,0
101,"Mayonnaise, dressing, and sauce manufacturing",0,0,0,0,0,0
102,Spice and extract manufacturing,0,0,0,0,0,0
103,All other food manufacturing,0,0,0,0,0,0
104,Bottled and canned soft drinks & water,0,0,0,0,0,0
105,Manufactured ice,0,0,0,0,0,0
106,Breweries,17.445127487182617,8749618.5302734375,197611.57035827637,375395.83444595337,43360.456824302673,2779657.3638916016
107,Wineries,17.810371398925781,6143579.4830322266,794818.6993598938,196962.19265460968,83338.163793087006,762138.7243270874
108,Distilleries,0,0,0,0,0,0
109,Tobacco product manufacturing,135.42144775390625,689098571.77734375,7465501.3084411621,890681.44559860229,12356613.159179688,483734375
110,"Fiber, yarn, and thread mills",0,0,0,0,0,0
111,Broadwoven fabric mills,0,0,0,0,0,0
112,Narrow fabric mills and schiffli machine embroidery,0,0,0,0,0,0
113,Nonwoven fabric mills,0,0,0,0,0,0
114,Knit fabric mills,0,0,0,0,0,0
115,Textile and fabric finishing mills,0,0,0,0,0,0
116,Fabric coating mills,0,0,0,0,0,0
117,Carpet and rug mills,0,0,0,0,0,0
118,Curtain and linen mills,0,0,0,0,0,0
119,Textile bag and canvas mills,0,0,0,0,0,0
120,"Rope, cordage, twine, tire cord and tire fabric mills",0,0,0,0,0,0
121,Other textile product mills,0,0,0,0,0,0
122,Hosiery and sock mills,0.14909286797046661,17357.431352138519,3925.6764575839043,0,1085.7178131118417,4373.4065257012844
123,Other apparel knitting mills,0.1488378643989563,15720.59839963913,3921.1451075971127,0,840.61973029747605,2000.157255679369
124,Cut and sew apparel contractors,7.1277995109558105,199464.69366550446,3919.8175072669983,-17717.588692903519,92.476235295180231,13769.36212182045
125,Mens and boys cut and sew apparel manufacturing,0.14873754978179932,19794.594496488571,3919.9599996209145,0,1149.3273777887225,1293.4604892507196
126,Womens and girls cut and sew apparel manufacturing,0.14869607985019684,29510.373249650002,3919.5669814944267,0,2000.3281533718109,1268.9990689978004
127,Other cut and sew apparel manufacturing,0.14874570071697235,17212.018370628357,3920.2137850224972,0,1044.5871157571673,1335.2135429158807
128,Apparel accessories and other apparel manufacturing,0.14876276254653931,16167.983412742615,3920.7274094223976,0,985.7547702267766,1420.0919540598989
129,Leather and hide tanning and finishing,0,0,0,0,0,0
130,Footwear manufacturing,0,0,0,0,0,0
131,Other leather and allied product manufacturing,0,0,0,0,0,0
132,Sawmills,33.569190979003906,8338668.8232421875,1085566.520690918,195461.77983283997,184243.5747385025,122498.12483787537
133,Wood preservation,0,0,0,0,0,0
134,Veneer and plywood manufacturing,0,0,0,0,0,0
135,Engineered wood member and truss manufacturing,0,0,0,0,0,0
136,Reconstituted wood product manufacturing,0,0,0,0,0,0
137,Wood windows and door manufacturing,0,0,0,0,0,0
138,"Cut stock, resawing lumber, and planing",0,0,0,0,0,0
139,"Other millwork, including flooring",4.8725266456604004,806267.32110977173,124023.05006980896,14081.002213060856,23014.869540929794,13276.736252009869
140,Wood container and pallet manufacturing,1.545876145362854,194814.63730335236,15274.45949614048,24916.689842939377,1226.600375957787,3058.3220068365335
141,Manufactured home (mobile home) manufacturing,0,0,0,0,0,0
142,Prefabricated wood building manufacturing,2.6413180828094482,385261.77406311035,58704.249560832977,33099.99406337738,3133.9910347014666,5818.9835399389267
143,All other miscellaneous wood product manufacturing,0,0,0,0,0,0
144,Pulp mills,0,0,0,0,0,0
145,Paper mills,0,0,0,0,0,0
146,Paperboard mills,0,0,0,0,0,0
147,Paperboard container manufacturing,0,0,0,0,0,0
148,Paper bag and coated and treated paper manufacturing,0,0,0,0,0,0
149,Stationery product manufacturing,0,0,0,0,0,0
150,Sanitary paper product manufacturing,0,0,0,0,0,0
151,All other converted paper product manufacturing,78.223976135253906,21868688.583374023,3413776.159286499,0,389754.92119789124,421578.37748527527
152,Printing,148.26744079589844,21560720.443725586,5793056.0111999512,-74817.7170753479,2536506.175994873,449873.08979034424
153,Support activities for printing,0,0,0,0,0,0
154,Petroleum refineries,0,0,0,0,0,0
155,Asphalt paving mixture and block manufacturing,0.82969188690185547,610641.41988754272,0,75877.659022808075,0,9383.6206942796707
156,Asphalt shingle and coating materials manufacturing,0,0,0,0,0,0
157,Petroleum lubricating oil and grease manufacturing,0,0,0,0,0,0
158,All other petroleum and coal products manufacturing,0,0,0,0,0,0
159,Petrochemical manufacturing,0,0,0,0,0,0
160,Industrial gas manufacturing,0,0,0,0,0,0
161,Synthetic dye and pigment manufacturing,0,0,0,0,0,0
162,Other basic inorganic chemical manufacturing,17.176729202270508,11892984.390258789,1046700.4776000977,2164.4083317369223,1136604.3090820313,226834.95283126831
163,Other basic organic chemical manufacturing,80.892959594726562,116046478.27148438,6625880.7182312012,248.10872855596244,5814391.1361694336,1808465.6000137329
164,Plastics material and resin manufacturing,0,0,0,0,0,0
165,Synthetic rubber manufacturing,0,0,0,0,0,0
166,Artificial and synthetic fibers and filaments manufacturing,0,0,0,0,0,0
167,Nitrogenous fertilizer manufacturing,0,0,0,0,0,0
168,Phosphatic fertilizer manufacturing,0,0,0,0,0,0
169,Fertilizer mixing,0,0,0,0,0,0
170,Pesticide and other agricultural chemical manufacturing,0,0,0,0,0,0
171,Medicinal and botanical manufacturing,0,0,0,0,0,0
172,Pharmaceutical preparation manufacturing,0,0,0,0,0,0
173,In-vitro diagnostic substance manufacturing,0,0,0,0,0,0
174,Biological product (except diagnostic) manufacturing,0,0,0,0,0,0
175,Paint and coating manufacturing,0,0,0,0,0,0
176,Adhesive manufacturing,0,0,0,0,0,0
177,Soap and other detergent manufacturing,0,0,0,0,0,0
178,Polish and other sanitation good manufacturing,0,0,0,0,0,0
179,Surface active agent manufacturing,0,0,0,0,0,0
180,Toilet preparation manufacturing,0,0,0,0,0,0
181,Printing ink manufacturing,0,0,0,0,0,0
182,Explosives manufacturing,0,0,0,0,0,0
183,Custom compounding of purchased resins,0,0,0,0,0,0
184,Photographic film and chemical manufacturing,0,0,0,0,0,0
185,Other miscellaneous chemical product manufacturing,0,0,0,0,0,0
186,Plastics packaging materials and unlaminated film and sheet manufacturing,0,0,0,0,0,0
187,Unlaminated plastics profile shape manufacturing,0,0,0,0,0,0
188,Plastics pipe and pipe fitting manufacturing,0,0,0,0,0,0
189,"Laminated plastics plate, sheet (except packaging), and shape manufacturing",0,0,0,0,0,0
190,Polystyrene foam product manufacturing,0,0,0,0,0,0
191,Urethane and other foam product (except polystyrene) manufacturing,17.611026763916016,6946366.7869567871,893677.4730682373,1231.9065863266587,1267880.2013397217,99741.59300327301
192,Plastics bottle manufacturing,0,0,0,0,0,0
193,Other plastics product manufacturing,39.432567596435547,11366875.648498535,1770177.960395813,1084.3654163181782,1974060.5354309082,163194.99909877777
194,Tire manufacturing,4.0966744422912598,1391405.8208465576,102308.57133865356,2035.3412255644798,78889.220952987671,31678.605824708939
195,Rubber and plastics hoses and belting manufacturing,0,0,0,0,0,0
196,Other rubber product manufacturing,0,0,0,0,0,0
197,"Pottery, ceramics, and plumbing fixture manufacturing",0,0,0,0,0,0
198,"Brick, tile, and other structural clay product manufacturing",0,0,0,0,0,0
199,Flat glass manufacturing,0,0,0,0,0,0
200,Other pressed and blown glass and glassware manufacturing,0,0,0,0,0,0
201,Glass container manufacturing,0,0,0,0,0,0
202,Glass product manufacturing made of purchased glass,0,0,0,0,0,0
203,Cement manufacturing,0,0,0,0,0,0
204,Ready-mix concrete manufacturing,0,0,0,0,0,0
205,Concrete block and brick manufacturing,0,0,0,0,0,0
206,Concrete pipe manufacturing,0,0,0,0,0,0
207,Other concrete product manufacturing,103.35453796386719,23948146.820068359,5038980.9608459473,33877.182751893997,3794352.7698516846,459445.17850875854
208,Lime manufacturing,0,0,0,0,0,0
209,Gypsum product manufacturing,0,0,0,0,0,0
210,Abrasive product manufacturing,0,0,0,0,0,0
211,Cut stone and stone product manufacturing,0,0,0,0,0,0
212,Ground or treated mineral and earth manufacturing,0,0,0,0,0,0
213,Mineral wool manufacturing,0,0,0,0,0,0
214,Miscellaneous nonmetallic mineral products manufacturing,0,0,0,0,0,0
215,Iron and steel mills and ferroalloy manufacturing,0,0,0,0,0,0
216,"Iron, steel pipe and tube manufacturing from purchased steel",0,0,0,0,0,0
217,Rolled steel shape manufacturing,0,0,0,0,0,0
218,Steel wire drawing,0,0,0,0,0,0
219,Alumina refining and primary aluminum production,0,0,0,0,0,0
220,Secondary smelting and alloying of aluminum,0,0,0,0,0,0
221,"Aluminum sheet, plate, and foil manufacturing",0,0,0,0,0,0
222,"Other aluminum rolling, drawing and extruding",0,0,0,0,0,0
223,Nonferrous metal (exc aluminum) smelting and refining,0,0,0,0,0,0
224,"Copper rolling, drawing, extruding and alloying",0,0,0,0,0,0
225,"Nonferrous metal, except copper and aluminum, shaping",0,0,0,0,0,0
226,Secondary processing of other nonferrous metals,0,0,0,0,0,0
227,Ferrous metal foundries,0,0,0,0,0,0
228,Nonferrous metal foundries,1.0490461587905884,139682.75487422943,0,-11966.563761234283,0,3846.4583922177553
229,Custom roll forming,0,0,0,0,0,0
230,Crown and closure manufacturing and metal stamping,0,0,0,0,0,0
231,Iron and steel forging,0,0,0,0,0,0
232,Nonferrous forging,0,0,0,0,0,0
233,"Cutlery, utensil, pot, and pan manufacturing",0,0,0,0,0,0
234,Handtool manufacturing,0,0,0,0,0,0
235,Prefabricated metal buildings and components manufacturing,0,0,0,0,0,0
236,Fabricated structural metal manufacturing,0,0,0,0,0,0
237,Plate work manufacturing,0,0,0,0,0,0
238,Metal window and door manufacturing,0,0,0,0,0,0
239,Sheet metal work manufacturing,166.35177612304688,32440299.987792969,8468692.7795410156,132940.39666652679,1903613.4481430054,571716.48740768433
240,Ornamental and architectural metal work manufacturing,0,0,0,0,0,0
241,Power boiler and heat exchanger manufacturing,0,0,0,0,0,0
242,Metal tank (heavy gauge) manufacturing,0,0,0,0,0,0
243,Metal cans manufacturing,0,0,0,0,0,0
244,"Metal barrels, drums and pails manufacturing",0,0,0,0,0,0
245,Hardware manufacturing,0,0,0,0,0,0
246,Spring and wire product manufacturing,0,0,0,0,0,0
247,Machine shops,64.627639770507812,9199875.8316040039,3442317.008972168,486914.0088558197,402076.48277282715,150162.50312328339
248,"Turned product and screw, nut, and bolt manufacturing",43.443004608154297,10008377.075195313,2518583.2977294922,97284.093499183655,768829.46491241455,171189.44227695465
249,Metal heat treating,0,0,0,0,0,0
250,Metal coating and nonprecious engraving,17.512973785400391,3877151.7276763916,813665.27080535889,63424.408435821533,495186.448097229,69331.951439380646
251,"Electroplating, anodizing, and coloring metal",0,0,0,0,0,0
252,"Valve and fittings, other than plumbing, manufacturing",0,0,0,0,0,0
253,Plumbing fixture fitting and trim manufacturing,0,0,0,0,0,0
254,Ball and roller bearing manufacturing,0,0,0,0,0,0
255,Small arms ammunition manufacturing,0,0,0,0,0,0
256,"Ammunition, except for small arms, manufacturing",0,0,0,0,0,0
257,"Small arms, ordnance, and accessories manufacturing",0,0,0,0,0,0
258,Fabricated pipe and pipe fitting manufacturing,0,0,0,0,0,0
259,Other fabricated metal manufacturing,0,0,0,0,0,0
260,Farm machinery and equipment manufacturing,0,0,0,0,0,0
261,Lawn and garden equipment manufacturing,0,0,0,0,0,0
262,Construction machinery manufacturing,0,0,0,0,0,0
263,Mining machinery and equipment manufacturing,0,0,0,0,0,0
264,Oil and gas field machinery and equipment manufacturing,0,0,0,0,0,0
265,Semiconductor machinery manufacturing,0,0,0,0,0,0
266,Food product machinery manufacturing,0,0,0,0,0,0
267,"Sawmill, woodworking, and paper machinery",0,0,0,0,0,0
268,Printing machinery and equipment manufacturing,0,0,0,0,0,0
269,All other industrial machinery manufacturing,3.0208358764648438,616943.65739822388,64118.49707365036,7063.1341077387333,24650.733917951584,13271.703384816647
270,Optical instrument and lens manufacturing,0,0,0,0,0,0
271,Photographic and photocopying equipment manufacturing,14.337679862976074,5934067.2492980957,916181.56433105469,21263.109520077705,563291.72849655151,83083.711564540863
272,Other commercial service industry machinery manufacturing,0,0,0,0,0,0
273,Air purification and ventilation equipment manufacturing,0,0,0,0,0,0
274,Heating equipment (except warm air furnaces) manufacturing,0,0,0,0,0,0
275,"Air conditioning, refrigeration, and warm air heating equipment manufacturing",0,0,0,0,0,0
276,Industrial mold manufacturing,0,0,0,0,0,0
277,"Special tool, die, jig, and fixture manufacturing",44.822574615478516,7171168.8041687012,2409654.3788909912,9127.405472099781,937672.07860946655,128383.14473628998
278,Cutting tool and machine tool accessory manufacturing,0,0,0,0,0,0
279,Machine tool manufacturing,0,0,0,0,0,0
280,Rolling mill and other metalworking machinery manufacturing,0,0,0,0,0,0
281,Turbine and turbine generator set units manufacturing,76.375289916992188,35495525.360107422,7163441.1811828613,22163.230925798416,2883235.4545593262,566625.17786026001
282,"Speed changer, industrial high-speed drive, and gear manufacturing",0,0,0,0,0,0
283,Mechanical power transmission equipment manufacturing,0,0,0,0,0,0
284,Other engine equipment manufacturing,0,0,0,0,0,0
285,Pump and pumping equipment manufacturing,0,0,0,0,0,0
286,Air and gas compressor manufacturing,0,0,0,0,0,0
287,Elevator and moving stairway manufacturing,0,0,0,0,0,0
288,Conveyor and conveying equipment manufacturing,29.219881057739258,6591175.5561828613,1878380.0601959229,4887.834656983614,55916.033685207367,129385.17332077026
289,"Overhead cranes, hoists, and monorail systems manufacturing",0,0,0,0,0,0
290,"Industrial truck, trailer, and stacker manufacturing",0,0,0,0,0,0
291,Power-driven handtool manufacturing,0,0,0,0,0,0
292,Welding and soldering equipment manufacturing,0,0,0,0,0,0
293,Packaging machinery manufacturing,0,0,0,0,0,0
294,Industrial process furnace and oven manufacturing,0,0,0,0,0,0
295,Fluid power cylinder and actuator manufacturing,0,0,0,0,0,0
296,Fluid power pump and motor manufacturing,0,0,0,0,0,0
297,"Scales, balances, and miscellaneous general purpose machinery manufacturing",73.785438537597656,21475263.595581055,5366193.7713623047,4598.7260527908802,2000755.5484771729,359959.84077453613
298,Electronic computer manufacturing,0,0,0,0,0,0
299,Computer storage device manufacturing,0,0,0,0,0,0
300,Computer terminals and other computer peripheral equipment manufacturing,0,0,0,0,0,0
301,Telephone apparatus manufacturing,0,0,0,0,0,0
302,Broadcast and wireless communications equipment manufacturing,0,0,0,0,0,0
303,Other communications equipment manufacturing,0,0,0,0,0,0
304,Audio and video equipment manufacturing,0,0,0,0,0,0
305,Printed circuit assembly (electronic assembly) manufacturing,0,0,0,0,0,0
306,Bare printed circuit board manufacturing,0,0,0,0,0,0
307,Semiconductor and related device manufacturing,0,0,0,0,0,0
308,"Capacitor, resistor, coil, transformer, and other inductor manufacturing",40.173393249511719,9736631.3934326172,3184993.0286407471,-148298.78509044647,535874.84359741211,154444.45610046387
309,Electronic connector manufacturing,0,0,0,0,0,0
310,Other electronic component manufacturing,0,0,0,0,0,0
311,Electromedical and electrotherapeutic apparatus manufacturing,0,0,0,0,0,0
312,"Search, detection, and navigation instruments manufacturing",0,0,0,0,0,0
313,Automatic environmental control manufacturing,0,0,0,0,0,0
314,Industrial process variable instruments manufacturing,0,0,0,0,0,0
315,Totalizing fluid meter and counting device manufacturing,0,0,0,0,0,0
316,Electricity and signal testing instruments manufacturing,0,0,0,0,0,0
