Industry Detail ,,,,,,,
IndustryCode,Description,Employment,Output,EmployeeCompensation,ProprietorIncome,OtherPropertyTypeIncome,TaxOnProductionAndImports
0,Total,23386.073470693082,3406586817.7800436,1044411910.8696468,120079723.71725191,503006711.6237824,184448349.2143828
1,Oilseed farming,1.9560631513595581,767754.13751602173,1981.3498947769404,371243.83449554443,353799.10469055176,-10113.304480910301
2,Grain farming,25.192575454711914,4126139.6408081055,308602.45227813721,612028.18155288696,1576781.5113067627,-55877.905339002609
3,Vegetable and melon farming,12.906107902526856,1105186.7008209229,194155.9910774231,77888.086438179016,319718.1224822998,412.26655594073236
4,Fruit farming,15.168459892272949,963018.77498626709,179353.55007648468,53156.081587076187,358590.06643295288,467.45289000682533
5,Tree nut farming,0.055838841944932938,1726.680900901556,1009.4721801578999,80.761979916132987,551.25751532614231,1.4065209370528464
6,"Greenhouse, nursery, and floriculture production",7.6146283149719238,635066.6880607605,188502.52032279968,19689.835608005524,206657.5437784195,113.71192522346973
7,Tobacco farming,0,0,0,0,0,0
8,Cotton farming,0,0,0,0,0,0
9,Sugarcane and sugar beet farming,0,0,0,0,0,0
10,All other crop farming,372.29989624023438,6608756.0653686523,2357407.808303833,382233.26206207275,1695689.7974014282,-94420.768320560455
11,"Beef cattle ranching and farming, including feedlots and dual-purpose ranching and farming",80.372711181640625,6715815.544128418,113709.85954999924,610562.92057037354,1911111.7124557495,232978.06084156036
12,Dairy cattle and milk production,157.52609252929688,49043674.468994141,2402801.9905090332,1621295.2136993408,5368500.2326965332,1220410.1085662842
13,Poultry and egg production,0.60202997922897339,243337.86964416504,15076.836571097374,2028.2755140215159,13139.599002897739,1306.2978396192193
14,"Animal production, except cattle and poultry and eggs",5.4165244102478027,460149.46699142456,44714.469462633133,108581.77393674851,262432.00898170471,24557.698518037796
15,"Forestry, forest products, and timber tract production",2.31357741355896,270467.04292297363,207070.60396671295,0,17649.564892053604,614.65310864150524
16,Commercial logging,14.380839347839356,1354850.172996521,437903.70225906372,392043.76935958862,22086.791694164276,20984.334871172905
17,Commercial fishing,0,0,0,0,0,0
18,Commercial hunting and trapping,0.95696079730987549,47320.153564214706,0,27632.957324385643,0,5468.1752808392048
19,Support activities for agriculture and forestry,67.063125610351562,2528810.5010986328,2274295.3300476074,103688.66473436356,-464274.31702613831,112396.64256572723
20,Oil and gas extraction,4.4001803398132324,2261356.8305969238,0,2129105.806350708,341.50664578191936,19183.021038770676
21,Coal mining,0,0,0,0,0,0
22,"Copper, nickel, lead, and zinc mining",0,0,0,0,0,0
23,Iron ore mining,0,0,0,0,0,0
24,Gold ore mining,0,0,0,0,0,0
25,Silver ore mining,0,0,0,0,0,0
26,Uranium-radium-vanadium ore mining,0,0,0,0,0,0
27,Other metal ore mining,0,0,0,0,0,0
28,Stone mining and quarrying,0,0,0,0,0,0
29,Sand and gravel mining,8.1150131225585938,1231769.323348999,117670.63289880753,321736.96160316467,25678.733363747597,92313.647270202637
30,"Other clay, ceramic, refractory minerals mining",0,0,0,0,0,0
31,"Potash, soda, and borate mineral mining",0,0,0,0,0,0
32,Phosphate rock mining,0,0,0,0,0,0
33,Other chemical and fertilizer mineral mining,0,0,0,0,0,0
34,Other nonmetallic minerals,0,0,0,0,0,0
35,Drilling oil and gas wells,6.1611175537109375,161979.86900806427,385123.04425239563,155425.17602443695,-3507222.8908538818,51984.496414661407
36,Support activities for oil and gas operations,0.47307834029197693,224176.34725570679,0,209239.78090286255,15.578691090922803,3727.7429364621639
37,Metal mining services,0.4730929434299469,243624.40407276154,0,229284.43551063538,32.625754101900384,2158.7463561445475
38,Other nonmetallic minerals services,0.47309324145317078,247987.2852563858,0,233330.77132701874,26.735850042314269,2257.1394219994545
39,Electric power generation - Hydroelectric,0,0,0,0,0,0
40,Electric power generation - Fossil fuel,0,0,0,0,0,0
41,Electric power generation - Nuclear,0,0,0,0,0,0
42,Electric power generation - Solar,0,0,0,0,0,0
43,Electric power generation - Wind,0,0,0,0,0,0
44,Electric power generation - Geothermal,0,0,0,0,0,0
45,Electric power generation - Biomass,0,0,0,0,0,0
46,Electric power generation - All other,0,0,0,0,0,0
47,Electric power transmission and distribution,29.415254592895508,32425273.895263672,1565867.54322052,579490.42320251465,2384496.9272613525,4835459.2323303223
48,Natural gas distribution,0,0,0,0,0,0
49,"Water, sewage and other systems",0,0,0,0,0,0
50,Construction of new health care structures,29.638921737670898,3798107.8624725342,877627.61116027832,580352.36597061157,470788.3894443512,44644.02049779892
51,Construction of new manufacturing structures,50.000225067138672,6640121.4599609375,1636000.394821167,934120.17822265625,477930.06896972656,69433.346390724182
52,Construction of new power and communication structures,62.737331390380859,9284523.9639282227,1744486.2127304077,1334504.7235488892,1505628.8242340088,159895.83730697632
53,Construction of new educational and vocational structures,92.005851745605469,11584932.327270508,4187770.3666687012,1205665.5883789063,1476559.5197677612,103879.97329235077
54,Construction of new highways and streets,66.016998291015625,12294898.03314209,2655336.1415863037,1119210.1240158081,2076699.97215271,103678.01785469055
55,"Construction of new commercial structures, including farm structures",115.58516693115234,12913203.239440918,3271028.0418395996,2235978.8417816162,695696.65193557739,214874.77421760559
56,Construction of other new nonresidential structures,150.70269775390625,11823366.165161133,4787450.7904052734,2885622.0245361328,-2880396.1277008057,145604.55083847046
57,Construction of new single-family residential structures,180.26824951171875,23071046.829223633,4909074.3064880371,3703838.1099700928,3104593.03855896,673154.41370010376
58,Construction of new multifamily residential structures,55.037445068359375,4963433.7425231934,1515479.0878295898,1147515.1777267456,877423.70367050171,114607.59490728378
59,Construction of other new residential structures,126.15474700927734,22455801.010131836,3781390.905380249,2534352.7793884277,2167900.562286377,365777.67133712769
60,Maintenance and repair construction of nonresidential structures,84.066879272460938,15105697.631835938,2368211.9846343994,1751290.5597686768,1114039.8979187012,238750.23424625397
61,Maintenance and repair construction of residential structures,43.854217529296875,8188077.9266357422,1210633.9931488037,757070.18375396729,734867.99001693726,241755.72395324707
62,"Maintenance and repair construction of highways, streets, bridges, and tunnels",30.712244033813477,2803799.1523742676,888381.06393814087,628169.41738128662,-456936.65742874146,52017.398178577423
63,Dog and cat food manufacturing,0,0,0,0,0,0
64,Other animal food manufacturing,5.7770509719848633,5910671.7109680176,311307.81769752502,2231.1275824904442,117906.8386554718,328190.08827209473
65,Flour milling,0,0,0,0,0,0
66,Rice milling,0,0,0,0,0,0
67,Malt manufacturing,0,0,0,0,0,0
68,Wet corn milling,0,0,0,0,0,0
69,Soybean and other oilseed processing,0,0,0,0,0,0
70,Fats and oils refining and blending,0,0,0,0,0,0
71,Breakfast cereal manufacturing,0,0,0,0,0,0
72,Beet sugar manufacturing,0,0,0,0,0,0
73,Sugar cane mills and refining,0,0,0,0,0,0
74,Nonchocolate confectionery manufacturing,0,0,0,0,0,0
75,Chocolate and confectionery manufacturing from cacao beans,0,0,0,0,0,0
76,Confectionery manufacturing from purchased chocolate,0,0,0,0,0,0
77,"Frozen fruits, juices and vegetables manufacturing",0,0,0,0,0,0
78,Frozen specialties manufacturing,0,0,0,0,0,0
79,Canned fruits and vegetables manufacturing,39.557010650634766,17901695.251464844,1894767.165184021,1745.7033973187208,240632.78734683991,411919.38519477844
80,Canned specialties,0,0,0,0,0,0
81,Dehydrated food products manufacturing,0,0,0,0,0,0
82,Cheese manufacturing,0,0,0,0,0,0
83,"Dry, condensed, and evaporated dairy product manufacturing",0,0,0,0,0,0
84,Fluid milk manufacturing,55.032875061035156,38632736.206054688,3426424.503326416,0,350452.45289802551,1139817.1186447144
85,Creamery butter manufacturing,0,0,0,0,0,0
86,Ice cream and frozen dessert manufacturing,0,0,0,0,0,0
87,Frozen cakes and other pastries manufacturing,24.819633483886719,2070930.2425384522,652162.19425201416,31659.379601478577,99035.762250423431,294517.78531074524
88,Poultry processing,0,0,0,0,0,0
89,"Animal, except poultry, slaughtering",0.18811923265457153,131204.70941066742,12364.89973962307,0,2406.806219369173,2980.1779892295599
90,Meat processed from carcasses,0.18804316222667694,100182.44385719299,12359.199114143848,0,686.43392296507955,2498.1026072055101
91,Rendering and meat byproduct processing,0.18834008276462555,73408.104479312897,12374.549172818661,0,3248.6286945641041,1359.9862577393651
92,Seafood product preparation and packaging,0,0,0,0,0,0
93,"Bread and bakery product, except frozen, manufacturing",35.699687957763672,4227491.8556213379,886656.70156478882,32095.950096845627,79593.025147914886,251555.53221702576
94,Cookie and cracker manufacturing,0,0,0,0,0,0
95,"Dry pasta, mixes, and dough manufacturing",0,0,0,0,0,0
96,Tortilla manufacturing,0,0,0,0,0,0
97,Roasted nuts and peanut butter manufacturing,2.3945069313049316,1081428.8854598999,216555.61029911041,0,38401.518017053604,18683.213740587234
98,Other snack food manufacturing,2.4360113143920898,1222363.3527755737,223732.08403587341,0,31505.875289440155,28100.112453103065
99,Coffee and tea manufacturing,0,0,0,0,0,0
100,Flavoring syrup and concentrate manufacturing,0,0,0,0,0,0
101,"Mayonnaise, dressing, and sauce manufacturing",1.4690802097320557,751012.86172866821,69829.255342483521,0,10137.583129107952,29326.900839805603
102,Spice and extract manufacturing,0,0,0,0,0,0
103,All other food manufacturing,0,0,0,0,0,0
104,Bottled and canned soft drinks & water,16.399026870727539,11391307.830810547,1000248.6705780029,62284.927815198898,164752.43866443634,471947.55077362061
105,Manufactured ice,0,0,0,0,0,0
106,Breweries,6.1795058250427246,3301598.3104705811,215553.01547050476,156114.83156681061,47297.216951847076,986254.93049621582
107,Wineries,0,0,0,0,0,0
108,Distilleries,0,0,0,0,0,0
109,Tobacco product manufacturing,0,0,0,0,0,0
110,"Fiber, yarn, and thread mills",0,0,0,0,0,0
111,Broadwoven fabric mills,0,0,0,0,0,0
112,Narrow fabric mills and schiffli machine embroidery,0,0,0,0,0,0
113,Nonwoven fabric mills,0,0,0,0,0,0
114,Knit fabric mills,0,0,0,0,0,0
115,Textile and fabric finishing mills,11.163901329040527,3176581.3827514648,786055.56488037109,4586.072638630867,192240.62561988831,51646.359264850616
116,Fabric coating mills,0,0,0,0,0,0
117,Carpet and rug mills,0,0,0,0,0,0
118,Curtain and linen mills,13.163725852966309,3350518.4650421143,1005798.2206344605,0,373027.56309509277,54267.160594463348
119,Textile bag and canvas mills,0,0,0,0,0,0
120,"Rope, cordage, twine, tire cord and tire fabric mills",128.34727478027344,38370304.107666016,8503337.8601074219,0,5192337.0361328125,753126.32322311401
121,Other textile product mills,0,0,0,0,0,0
122,Hosiery and sock mills,0.13019376993179321,14208.101667463779,3080.6239228695631,0,852.00305329635739,3313.4592231363058
123,Other apparel knitting mills,0.12997108697891235,13075.197115540505,3077.0681332796812,0,659.66544207185507,1515.3952408581972
124,Cut and sew apparel contractors,1.2278444766998291,35587.15432882309,3076.0259833186865,-4157.7867232263088,72.569535404909402,2369.3935945630074
125,Mens and boys cut and sew apparel manufacturing,0.12988349795341492,16687.249764800072,3076.137974858284,0,901.91984781995416,979.97486591339111
126,Womens and girls cut and sew apparel manufacturing,0.12984727323055267,25098.999962210655,3075.8294742554426,0,1569.7316266596317,961.44195413216949
127,Other cut and sew apparel manufacturing,0.12989062070846558,14436.464756727219,3076.3372778892517,0,819.72626503556967,1011.6085177287459
128,Apparel accessories and other apparel manufacturing,0.12990552186965942,13520.120643079281,3076.7403077334166,0,773.55827670544386,1075.9156430140138
129,Leather and hide tanning and finishing,0,0,0,0,0,0
130,Footwear manufacturing,0,0,0,0,0,0
131,Other leather and allied product manufacturing,0,0,0,0,0,0
132,Sawmills,32.502456665039062,9164624.2141723633,1438900.2323150635,826350.74853897095,244211.77804470062,118786.93103790283
133,Wood preservation,0,0,0,0,0,0
134,Veneer and plywood manufacturing,0,0,0,0,0,0
135,Engineered wood member and truss manufacturing,0,0,0,0,0,0
136,Reconstituted wood product manufacturing,0,0,0,0,0,0
137,Wood windows and door manufacturing,0,0,0,0,0,0
138,"Cut stock, resawing lumber, and planing",0,0,0,0,0,0
139,"Other millwork, including flooring",0,0,0,0,0,0
140,Wood container and pallet manufacturing,12.537662506103516,1985825.777053833,199027.13596820831,526699.54299926758,15982.676297426224,24811.68694794178
141,Manufactured home (mobile home) manufacturing,0,0,0,0,0,0
142,Prefabricated wood building manufacturing,100.60807037353516,17204668.045043945,5171177.3872375488,699681.69927597046,276068.98546218872,220931.85782432556
143,All other miscellaneous wood product manufacturing,0,0,0,0,0,0
144,Pulp mills,0,0,0,0,0,0
145,Paper mills,0,0,0,0,0,0
146,Paperboard mills,0,0,0,0,0,0
147,Paperboard container manufacturing,1.131176233291626,1879495.1438903809,0,1448974.0133285523,0,8726.1656299233437
148,Paper bag and coated and treated paper manufacturing,0,0,0,0,0,0
149,Stationery product manufacturing,0,0,0,0,0,0
150,Sanitary paper product manufacturing,0,0,0,0,0,0
151,All other converted paper product manufacturing,0,0,0,0,0,0
152,Printing,30.511466979980469,4738819.5991516113,1394536.9720458984,-4452.1787203848362,610601.96161270142,92517.808079719543
153,Support activities for printing,0,0,0,0,0,0
154,Petroleum refineries,0,0,0,0,0,0
155,Asphalt paving mixture and block manufacturing,23.399839401245117,20528440.475463867,2383465.7669067383,66933.952271938324,2999310.7318878174,261410.50457954407
156,Asphalt shingle and coating materials manufacturing,0,0,0,0,0,0
157,Petroleum lubricating oil and grease manufacturing,0,0,0,0,0,0
158,All other petroleum and coal products manufacturing,0,0,0,0,0,0
159,Petrochemical manufacturing,0,0,0,0,0,0
160,Industrial gas manufacturing,0,0,0,0,0,0
161,Synthetic dye and pigment manufacturing,0,0,0,0,0,0
162,Other basic inorganic chemical manufacturing,8.3165521621704102,6533945.5604553223,878792.46473312378,0,954274.23715591431,110565.72198867798
163,Other basic organic chemical manufacturing,0,0,0,0,0,0
164,Plastics material and resin manufacturing,40.442070007324219,57098247.528076172,7493180.2749633789,0,4284106.2545776367,825322.32999801636
165,Synthetic rubber manufacturing,0,0,0,0,0,0
166,Artificial and synthetic fibers and filaments manufacturing,0,0,0,0,0,0
167,Nitrogenous fertilizer manufacturing,0,0,0,0,0,0
168,Phosphatic fertilizer manufacturing,0,0,0,0,0,0
169,Fertilizer mixing,0,0,0,0,0,0
170,Pesticide and other agricultural chemical manufacturing,0,0,0,0,0,0
171,Medicinal and botanical manufacturing,0,0,0,0,0,0
172,Pharmaceutical preparation manufacturing,0,0,0,0,0,0
173,In-vitro diagnostic substance manufacturing,0,0,0,0,0,0
174,Biological product (except diagnostic) manufacturing,0,0,0,0,0,0
175,Paint and coating manufacturing,0,0,0,0,0,0
176,Adhesive manufacturing,0,0,0,0,0,0
177,Soap and other detergent manufacturing,0,0,0,0,0,0
178,Polish and other sanitation good manufacturing,310.11727905273438,191416900.63476563,23472816.467285156,36307.614296674728,27196378.707885742,3194713.830947876
179,Surface active agent manufacturing,0,0,0,0,0,0
180,Toilet preparation manufacturing,0,0,0,0,0,0
181,Printing ink manufacturing,0,0,0,0,0,0
182,Explosives manufacturing,0,0,0,0,0,0
183,Custom compounding of purchased resins,0,0,0,0,0,0
184,Photographic film and chemical manufacturing,0,0,0,0,0,0
185,Other miscellaneous chemical product manufacturing,0,0,0,0,0,0
186,Plastics packaging materials and unlaminated film and sheet manufacturing,0,0,0,0,0,0
187,Unlaminated plastics profile shape manufacturing,0,0,0,0,0,0
188,Plastics pipe and pipe fitting manufacturing,0,0,0,0,0,0
189,"Laminated plastics plate, sheet (except packaging), and shape manufacturing",0,0,0,0,0,0
190,Polystyrene foam product manufacturing,0,0,0,0,0,0
191,Urethane and other foam product (except polystyrene) manufacturing,0,0,0,0,0,0
192,Plastics bottle manufacturing,127.74421691894531,62289951.324462891,8278663.6352539062,184096.5747833252,12092572.212219238,786602.73551940918
193,Other plastics product manufacturing,10.026581764221191,3526098.0129241943,746720.31402587891,8705.0003930926323,832724.80964660645,41499.409824609756
194,Tire manufacturing,0,0,0,0,0,0
195,Rubber and plastics hoses and belting manufacturing,0,0,0,0,0,0
196,Other rubber product manufacturing,0,0,0,0,0,0
197,"Pottery, ceramics, and plumbing fixture manufacturing",0,0,0,0,0,0
198,"Brick, tile, and other structural clay product manufacturing",103.15831756591797,37195308.685302734,9201030.7312011719,96447.445452213287,11576778.411865234,599192.85774230957
199,Flat glass manufacturing,0,0,0,0,0,0
200,Other pressed and blown glass and glassware manufacturing,0,0,0,0,0,0
201,Glass container manufacturing,0,0,0,0,0,0
202,Glass product manufacturing made of purchased glass,0,0,0,0,0,0
203,Cement manufacturing,0,0,0,0,0,0
204,Ready-mix concrete manufacturing,0,0,0,0,0,0
205,Concrete block and brick manufacturing,0,0,0,0,0,0
206,Concrete pipe manufacturing,0,0,0,0,0,0
207,Other concrete product manufacturing,10.479907989501953,2813481.5692901611,727760.01691818237,8552.011102437973,548003.31592559814,46581.335365772247
208,Lime manufacturing,0,0,0,0,0,0
209,Gypsum product manufacturing,0,0,0,0,0,0
210,Abrasive product manufacturing,0,0,0,0,0,0
211,Cut stone and stone product manufacturing,0,0,0,0,0,0
212,Ground or treated mineral and earth manufacturing,0,0,0,0,0,0
213,Mineral wool manufacturing,0,0,0,0,0,0
214,Miscellaneous nonmetallic mineral products manufacturing,0,0,0,0,0,0
215,Iron and steel mills and ferroalloy manufacturing,0,0,0,0,0,0
216,"Iron, steel pipe and tube manufacturing from purchased steel",0,0,0,0,0,0
217,Rolled steel shape manufacturing,0,0,0,0,0,0
218,Steel wire drawing,0,0,0,0,0,0
219,Alumina refining and primary aluminum production,0,0,0,0,0,0
220,Secondary smelting and alloying of aluminum,0,0,0,0,0,0
221,"Aluminum sheet, plate, and foil manufacturing",0,0,0,0,0,0
222,"Other aluminum rolling, drawing and extruding",0,0,0,0,0,0
223,Nonferrous metal (exc aluminum) smelting and refining,0,0,0,0,0,0
224,"Copper rolling, drawing, extruding and alloying",0,0,0,0,0,0
225,"Nonferrous metal, except copper and aluminum, shaping",0,0,0,0,0,0
226,Secondary processing of other nonferrous metals,0,0,0,0,0,0
227,Ferrous metal foundries,0,0,0,0,0,0
228,Nonferrous metal foundries,0,0,0,0,0,0
229,Custom roll forming,0,0,0,0,0,0
230,Crown and closure manufacturing and metal stamping,0,0,0,0,0,0
231,Iron and steel forging,0,0,0,0,0,0
232,Nonferrous forging,0,0,0,0,0,0
233,"Cutlery, utensil, pot, and pan manufacturing",0,0,0,0,0,0
234,Handtool manufacturing,24.08818244934082,6336275.1007080078,2197358.8466644287,10207.897983491421,1073824.405670166,101177.78182029724
235,Prefabricated metal buildings and components manufacturing,0,0,0,0,0,0
236,Fabricated structural metal manufacturing,0,0,0,0,0,0
237,Plate work manufacturing,0,0,0,0,0,0
238,Metal window and door manufacturing,0,0,0,0,0,0
239,Sheet metal work manufacturing,0,0,0,0,0,0
240,Ornamental and architectural metal work manufacturing,0,0,0,0,0,0
241,Power boiler and heat exchanger manufacturing,0,0,0,0,0,0
242,Metal tank (heavy gauge) manufacturing,0,0,0,0,0,0
243,Metal cans manufacturing,0,0,0,0,0,0
244,"Metal barrels, drums and pails manufacturing",0,0,0,0,0,0
245,Hardware manufacturing,0,0,0,0,0,0
246,Spring and wire product manufacturing,0,0,0,0,0,0
247,Machine shops,224.98332214355469,30265426.635742188,11889024.73449707,39914.820343255997,1388685.941696167,521972.4178314209
248,"Turned product and screw, nut, and bolt manufacturing",97.594688415527344,21592348.098754883,5139180.6602478027,4430.4849579930305,1568800.0917434692,384420.245885849
249,Metal heat treating,0,0,0,0,0,0
250,Metal coating and nonprecious engraving,4.103543758392334,1183081.0308456421,368814.1405582428,2888.4566854685545,224455.63971996307,16239.59094285965
251,"Electroplating, anodizing, and coloring metal",9.5105733871459961,1800213.4561538696,942588.86575698853,2436.5768767893314,78896.559774875641,21331.489086151123
252,"Valve and fittings, other than plumbing, manufacturing",0,0,0,0,0,0
253,Plumbing fixture fitting and trim manufacturing,0,0,0,0,0,0
254,Ball and roller bearing manufacturing,0,0,0,0,0,0
255,Small arms ammunition manufacturing,0,0,0,0,0,0
256,"Ammunition, except for small arms, manufacturing",0,0,0,0,0,0
257,"Small arms, ordnance, and accessories manufacturing",0,0,0,0,0,0
258,Fabricated pipe and pipe fitting manufacturing,0,0,0,0,0,0
259,Other fabricated metal manufacturing,22.612913131713867,6151113.5101318359,2368418.2167053223,3122.5236598402262,626361.78731918335,91995.887458324432
260,Farm machinery and equipment manufacturing,0,0,0,0,0,0
261,Lawn and garden equipment manufacturing,0,0,0,0,0,0
262,Construction machinery manufacturing,0,0,0,0,0,0
263,Mining machinery and equipment manufacturing,0,0,0,0,0,0
264,Oil and gas field machinery and equipment manufacturing,0,0,0,0,0,0
265,Semiconductor machinery manufacturing,0,0,0,0,0,0
266,Food product machinery manufacturing,0,0,0,0,0,0
267,"Sawmill, woodworking, and paper machinery",6.4792594909667969,1742022.6335525513,512717.604637146,5983.4988787770271,49958.869814872742,36939.885467290878
268,Printing machinery and equipment manufacturing,0,0,0,0,0,0
269,All other industrial machinery manufacturing,0,0,0,0,0,0
270,Optical instrument and lens manufacturing,0,0,0,0,0,0
271,Photographic and photocopying equipment manufacturing,0,0,0,0,0,0
272,Other commercial service industry machinery manufacturing,0,0,0,0,0,0
273,Air purification and ventilation equipment manufacturing,0,0,0,0,0,0
274,Heating equipment (except warm air furnaces) manufacturing,0,0,0,0,0,0
275,"Air conditioning, refrigeration, and warm air heating equipment manufacturing",0,0,0,0,0,0
276,Industrial mold manufacturing,0,0,0,0,0,0
277,"Special tool, die, jig, and fixture manufacturing",4.1446256637573242,662292.2420501709,219602.91266441345,4476.4112681150436,85454.382002353668,11891.55038446188
278,Cutting tool and machine tool accessory manufacturing,0,0,0,0,0,0
279,Machine tool manufacturing,9.2021770477294922,2157315.9694671631,636520.92218399048,7385.2571658790112,96942.797303199768,34498.106688261032
280,Rolling mill and other metalworking machinery manufacturing,0,0,0,0,0,0
281,Turbine and turbine generator set units manufacturing,0,0,0,0,0,0
282,"Speed changer, industrial high-speed drive, and gear manufacturing",0,0,0,0,0,0
283,Mechanical power transmission equipment manufacturing,0,0,0,0,0,0
284,Other engine equipment manufacturing,0,0,0,0,0,0
285,Pump and pumping equipment manufacturing,0,0,0,0,0,0
286,Air and gas compressor manufacturing,0,0,0,0,0,0
287,Elevator and moving stairway manufacturing,0,0,0,0,0,0
288,Conveyor and conveying equipment manufacturing,0,0,0,0,0,0
289,"Overhead cranes, hoists, and monorail systems manufacturing",0,0,0,0,0,0
290,"Industrial truck, trailer, and stacker manufacturing",0,0,0,0,0,0
291,Power-driven handtool manufacturing,0,0,0,0,0,0
292,Welding and soldering equipment manufacturing,0,0,0,0,0,0
293,Packaging machinery manufacturing,0,0,0,0,0,0
294,Industrial process furnace and oven manufacturing,0,0,0,0,0,0
295,Fluid power cylinder and actuator manufacturing,0,0,0,0,0,0
296,Fluid power pump and motor manufacturing,0,0,0,0,0,0
297,"Scales, balances, and miscellaneous general purpose machinery manufacturing",271.33029174804688,87228897.094726562,25757514.953613281,4510.7644982635975,9603546.142578125,1323581.6955566406
298,Electronic computer manufacturing,0,0,0,0,0,0
299,Computer storage device manufacturing,63.829971313476562,91136116.027832031,12183200.836181641,-141280.78520298004,10665593.147277832,1839093.804359436
300,Computer terminals and other computer peripheral equipment manufacturing,0,0,0,0,0,0
301,Telephone apparatus manufacturing,0,0,0,0,0,0
302,Broadcast and wireless communications equipment manufacturing,29.854942321777344,10356896.40045166,3236084.4612121582,-381605.62515258789,717065.33432006836,195366.35279655457
303,Other communications equipment manufacturing,0,0,0,0,0,0
304,Audio and video equipment manufacturing,0,0,0,0,0,0
305,Printed circuit assembly (electronic assembly) manufacturing,0,0,0,0,0,0
306,Bare printed circuit board manufacturing,0,0,0,0,0,0
307,Semiconductor and related device manufacturing,0,0,0,0,0,0
308,"Capacitor, resistor, coil, transformer, and other inductor manufacturing",0,0,0,0,0,0
309,Electronic connector manufacturing,0,0,0,0,0,0
310,Other electronic component manufacturing,0,0,0,0,0,0
311,Electromedical and electrotherapeutic apparatus manufacturing,0,0,0,0,0,0
312,"Search, detection, and navigation instruments manufacturing",0,0,0,0,0,0
313,Automatic environmental control manufacturing,0,0,0,0,0,0
314,Industrial process variable instruments manufacturing,0,0,0,0,0,0
315,Totalizing fluid meter and counting device manufacturing,0,0,0,0,0,0
316,Electricity and signal testing instruments manufacturing,0,0,0,0,0,0
317,Analytical laboratory instrument manufacturing,0,0,0,0,0,0
318,Irradiation apparatus manufacturing,0,0,0,0,0,0
319,"Watch, clock, and other measuring and controlling device manufacturing",0,0,0,0,0,0
320,Blank magnetic and optical recording media manufacturing,0,0,0,0,0,0
321,Software and other prerecorded and record reproducing,0,0,0,0,0,0
