Industry Detail ,,,,,,,
IndustryCode,Description,Employment,Output,EmployeeCompensation,ProprietorIncome,OtherPropertyTypeIncome,TaxOnProductionAndImports
0,Total,9799.2911107614636,1868183964.8738966,395710370.92793268,83265248.427880585,201108109.41407767,88720158.769295558
1,Oilseed farming,0.78282111883163452,459194.71979141235,1077.5743285194039,774532.19890594482,-337759.1073513031,-6048.7804003059864
2,Grain farming,32.383106231689453,7305443.286895752,496836.36426925659,3779893.6367034912,138101.84597969055,-98933.36147069931
3,Vegetable and melon farming,2.5080139636993408,279027.37259864807,44573.146849870682,68594.23965215683,36153.744906187057,104.08526577521116
4,Fruit farming,3.3412480354309082,275556.35571479797,46665.612608194351,53055.953234434128,69381.244480609894,133.75608250498772
5,Tree nut farming,0.025366663932800293,977.2994089871645,519.54272203147411,159.45127233862877,249.30480867624283,0.79608918213125435
6,"Greenhouse, nursery, and floriculture production",10.522560119628906,1089105.1292419434,293953.71675491333,117787.1897816658,299444.67544555664,195.00982307363302
7,Tobacco farming,0,0,0,0,0,0
8,Cotton farming,0,0,0,0,0,0
9,Sugarcane and sugar beet farming,0,0,0,0,0,0
10,All other crop farming,434.84420776367188,11093495.36895752,3598278.284072876,2238116.2643432617,1607983.7083816528,-158495.24736404419
11,"Beef cattle ranching and farming, including feedlots and dual-purpose ranching and farming",116.80424499511719,14538491.249084473,223836.04943752289,4610589.5042419434,870680.45139312744,504354.17890548706
12,Dairy cattle and milk production,273.7044677734375,111989875.79345703,4989132.8811645508,12914075.85144043,3544527.530670166,2786772.7279663086
13,Poultry and egg production,0.14671534299850464,79166.345298290253,4460.1806439459324,2301.7774801701307,3077.6830390095711,424.98452239669859
14,"Animal production, except cattle and poultry and eggs",3.0269982814788818,365215.15250205994,32270.766794681549,300616.11533164978,-10648.917406797409,19491.152837872505
15,"Forestry, forest products, and timber tract production",1.0247758626937866,93219.645321369171,67226.514220237732,0,5730.0198823213577,272.25443045608699
16,Commercial logging,163.58787536621094,12418823.2421875,2489161.7298126221,4084592.342376709,125547.23024368286,238492.54846572876
17,Commercial fishing,0,0,0,0,0,0
18,Commercial hunting and trapping,0.25074708461761475,471127.74848937988,0,446138.56077194214,0,1432.7954268082976
19,Support activities for agriculture and forestry,4.0884056091308594,2117462.158203125,84021.35968208313,1937860.1312637329,-17152.106389403343,6859.7118370234966
20,Oil and gas extraction,2.2656052112579346,953550.81558227539,0,895996.15335464478,144.00378859136254,9877.130389213562
21,Coal mining,0,0,0,0,0,0
22,"Copper, nickel, lead, and zinc mining",0,0,0,0,0,0
23,Iron ore mining,0,0,0,0,0,0
24,Gold ore mining,0,0,0,0,0,0
25,Silver ore mining,0,0,0,0,0,0
26,Uranium-radium-vanadium ore mining,0,0,0,0,0,0
27,Other metal ore mining,0,0,0,0,0,0
28,Stone mining and quarrying,0.62154531478881836,1023332.1189880371,24670.934304594994,897287.36877441406,18907.586112618446,8372.824639081955
29,Sand and gravel mining,0,0,0,0,0,0
30,"Other clay, ceramic, refractory minerals mining",0,0,0,0,0,0
31,"Potash, soda, and borate mineral mining",0,0,0,0,0,0
32,Phosphate rock mining,0,0,0,0,0,0
33,Other chemical and fertilizer mineral mining,0,0,0,0,0,0
34,Other nonmetallic minerals,0,0,0,0,0,0
35,Drilling oil and gas wells,1.2280181646347046,33416.777849197388,50982.050597667694,60989.059507846832,-464281.26096725464,10391.002520918846
36,Support activities for oil and gas operations,0.24358291923999786,95647.461712360382,0,88945.716619491577,6.6468305703892838,1919.3744519725442
37,Metal mining services,0.24359042942523956,102311.67823076248,0,96084.579825401306,13.701400348509196,1111.515099182725
38,Other nonmetallic minerals services,0.2435905933380127,102195.06919384003,0,95923.140645027161,11.01779162127059,1162.1766025200486
39,Electric power generation - Hydroelectric,22.79286003112793,9535510.0631713867,1376643.5384750366,0,1592490.0770187378,1257205.0094604492
40,Electric power generation - Fossil fuel,16.424894332885742,23918403.625488281,2889978.4088134766,0,4583011.1503601074,2803663.4922027588
41,Electric power generation - Nuclear,0,0,0,0,0,0
42,Electric power generation - Solar,0,0,0,0,0,0
43,Electric power generation - Wind,8.0487442016601562,11702385.902404785,1137374.1626739502,0,5035621.6430664062,1074075.5796432495
44,Electric power generation - Geothermal,0,0,0,0,0,0
45,Electric power generation - Biomass,34.963020324707031,18733261.108398438,3492271.6617584229,0,4776594.1619873047,1496977.686882019
46,Electric power generation - All other,1.4798016548156738,217021.22688293457,219564.73588943481,0,-204423.60639572144,25893.259793519974
47,Electric power transmission and distribution,13.286746025085449,17023790.35949707,1761615.8723831177,0,2682581.6631317139,2163507.2231292725
48,Natural gas distribution,0,0,0,0,0,0
49,"Water, sewage and other systems",0,0,0,0,0,0
50,Construction of new health care structures,19.419095993041992,2145115.3755187988,281484.454870224,487779.55770492554,150997.54929542542,29333.308339118958
51,Construction of new manufacturing structures,33.388252258300781,3972012.996673584,621138.57269287109,770656.46648406982,181455.20985126495,46478.919684886932
52,Construction of new power and communication structures,43.191539764404297,5605679.988861084,628812.67070770264,1198234.4388961792,542714.77460861206,110347.75525331497
53,Construction of new educational and vocational structures,54.1751708984375,6120346.5461730957,1716999.888420105,1021355.0329208374,605394.30379867554,61500.534415245056
54,Construction of new highways and streets,42.938690185546875,6768658.6380004883,914081.51388168335,948587.47720718384,714889.94359970093,67462.250590324402
55,"Construction of new commercial structures, including farm structures",76.54547119140625,7679882.0495605469,1124734.4017028809,1871573.805809021,239213.46664428711,142677.78396606445
56,Construction of other new nonresidential structures,108.84324645996094,8437551.4984130859,1809803.1282424927,2638596.2963104248,-1088878.1547546387,105359.09235477448
57,Construction of new single-family residential structures,124.08563232421875,13782191.276550293,1752154.2310714722,3105756.0443878174,1108096.0035324097,464459.00201797485
58,Construction of new multifamily residential structures,38.290931701660156,2818356.0371398926,544464.46895599365,968439.63861465454,315231.02521896362,79928.42048406601
59,Construction of other new residential structures,86.701210021972656,13953194.618225098,1399764.7762298584,2147710.0849151611,802495.89681625366,252092.21243858337
60,Maintenance and repair construction of nonresidential structures,58.204280853271484,9547993.6599731445,838122.60627746582,1480136.7521286011,394264.54901695251,165715.88814258575
61,Maintenance and repair construction of residential structures,28.586654663085938,4960413.932800293,469006.2403678894,630557.11984634399,284691.90001487732,157986.55152320862
62,"Maintenance and repair construction of highways, streets, bridges, and tunnels",20.823873519897461,1858806.7293167114,304213.07682991028,528359.65156555176,-156471.26734256744,35361.915826797485
63,Dog and cat food manufacturing,0,0,0,0,0,0
64,Other animal food manufacturing,0.45560139417648315,468348.23489189148,23614.190518856049,0,8943.7989518046379,29558.900743722916
65,Flour milling,0,0,0,0,0,0
66,Rice milling,0,0,0,0,0,0
67,Malt manufacturing,0,0,0,0,0,0
68,Wet corn milling,0,0,0,0,0,0
69,Soybean and other oilseed processing,0,0,0,0,0,0
70,Fats and oils refining and blending,0,0,0,0,0,0
71,Breakfast cereal manufacturing,0,0,0,0,0,0
72,Beet sugar manufacturing,0,0,0,0,0,0
73,Sugar cane mills and refining,0,0,0,0,0,0
74,Nonchocolate confectionery manufacturing,0,0,0,0,0,0
75,Chocolate and confectionery manufacturing from cacao beans,0,0,0,0,0,0
76,Confectionery manufacturing from purchased chocolate,0,0,0,0,0,0
77,"Frozen fruits, juices and vegetables manufacturing",0,0,0,0,0,0
78,Frozen specialties manufacturing,0,0,0,0,0,0
79,Canned fruits and vegetables manufacturing,0,0,0,0,0,0
80,Canned specialties,0,0,0,0,0,0
81,Dehydrated food products manufacturing,0,0,0,0,0,0
82,Cheese manufacturing,435.84231567382812,393232727.05078125,29813507.080078125,12289.147824048996,1877046.7042922974,9452306.7474365234
83,"Dry, condensed, and evaporated dairy product manufacturing",0,0,0,0,0,0
84,Fluid milk manufacturing,0,0,0,0,0,0
85,Creamery butter manufacturing,0,0,0,0,0,0
86,Ice cream and frozen dessert manufacturing,0,0,0,0,0,0
87,Frozen cakes and other pastries manufacturing,7.1005191802978516,564222.69344329834,160986.2893819809,10191.555134952068,24446.984753012657,84356.814622879028
88,Poultry processing,0,0,0,0,0,0
89,"Animal, except poultry, slaughtering",0.1061454638838768,70470.228791236877,4013.4033188223839,0,781.20204852893949,1660.3551339358091
90,Meat processed from carcasses,0.10610254108905792,53383.156657218933,4011.5532465279102,0,222.80297707766295,1391.7750911787152
91,Rendering and meat byproduct processing,0.10627007484436035,37666.197866201401,4016.5353566408157,0,1054.4409742578864,757.69308023154736
92,Seafood product preparation and packaging,0,0,0,0,0,0
93,"Bread and bakery product, except frozen, manufacturing",7.1005191802978516,827943.26543807983,160986.2893819809,10175.269097089768,14451.350085437298,50099.980086088181
94,Cookie and cracker manufacturing,0,0,0,0,0,0
95,"Dry pasta, mixes, and dough manufacturing",0,0,0,0,0,0
96,Tortilla manufacturing,0,0,0,0,0,0
97,Roasted nuts and peanut butter manufacturing,1.0606228113174439,448850.48270225525,70305.861532688141,0,12467.246502637863,8275.5424082279205
98,Other snack food manufacturing,1.0790067911148071,511242.74730682373,72635.740041732788,0,10228.540748357773,12446.662411093712
99,Coffee and tea manufacturing,64.909774780273438,36715183.258056641,1015506.2675476074,12248.823419213295,156081.09533786774,1119124.5317459106
100,Flavoring syrup and concentrate manufacturing,0,0,0,0,0,0
101,"Mayonnaise, dressing, and sauce manufacturing",0,0,0,0,0,0
102,Spice and extract manufacturing,0,0,0,0,0,0
103,All other food manufacturing,0,0,0,0,0,0
104,Bottled and canned soft drinks & water,0,0,0,0,0,0
105,Manufactured ice,0,0,0,0,0,0
106,Breweries,0,0,0,0,0,0
107,Wineries,16.769735336303711,5512121.6773986816,663820.26672363281,4560.194443911314,69602.742791175842,718711.67421340942
108,Distilleries,0,0,0,0,0,0
109,Tobacco product manufacturing,0,0,0,0,0,0
110,"Fiber, yarn, and thread mills",0,0,0,0,0,0
111,Broadwoven fabric mills,0,0,0,0,0,0
112,Narrow fabric mills and schiffli machine embroidery,0,0,0,0,0,0
113,Nonwoven fabric mills,0,0,0,0,0,0
114,Knit fabric mills,0,0,0,0,0,0
115,Textile and fabric finishing mills,0,0,0,0,0,0
116,Fabric coating mills,0,0,0,0,0,0
117,Carpet and rug mills,0,0,0,0,0,0
118,Curtain and linen mills,0,0,0,0,0,0
119,Textile bag and canvas mills,0,0,0,0,0,0
120,"Rope, cordage, twine, tire cord and tire fabric mills",0,0,0,0,0,0
121,Other textile product mills,0,0,0,0,0,0
122,Hosiery and sock mills,0,0,0,0,0,0
123,Other apparel knitting mills,0,0,0,0,0,0
124,Cut and sew apparel contractors,0,0,0,0,0,0
125,Mens and boys cut and sew apparel manufacturing,0,0,0,0,0,0
126,Womens and girls cut and sew apparel manufacturing,0,0,0,0,0,0
127,Other cut and sew apparel manufacturing,0,0,0,0,0,0
128,Apparel accessories and other apparel manufacturing,0,0,0,0,0,0
129,Leather and hide tanning and finishing,0,0,0,0,0,0
130,Footwear manufacturing,0,0,0,0,0,0
131,Other leather and allied product manufacturing,0,0,0,0,0,0
132,Sawmills,31.183713912963867,8082529.0679931641,1397518.7540054321,62946.878373622894,237188.45844268799,113705.50841093063
133,Wood preservation,0,0,0,0,0,0
134,Veneer and plywood manufacturing,0,0,0,0,0,0
135,Engineered wood member and truss manufacturing,0,0,0,0,0,0
136,Reconstituted wood product manufacturing,0,0,0,0,0,0
137,Wood windows and door manufacturing,0,0,0,0,0,0
138,"Cut stock, resawing lumber, and planing",0,0,0,0,0,0
139,"Other millwork, including flooring",0,0,0,0,0,0
140,Wood container and pallet manufacturing,0,0,0,0,0,0
141,Manufactured home (mobile home) manufacturing,0,0,0,0,0,0
142,Prefabricated wood building manufacturing,0,0,0,0,0,0
143,All other miscellaneous wood product manufacturing,14.166986465454102,2128646.1353302002,440589.57695960999,20699.968561530113,53085.893392562866,32223.526388406754
144,Pulp mills,0,0,0,0,0,0
145,Paper mills,227.51812744140625,156301239.01367188,16657075.881958008,1283116.5790557861,5993103.9810180664,2745416.4028167725
146,Paperboard mills,0,0,0,0,0,0
147,Paperboard container manufacturing,0,0,0,0,0,0
148,Paper bag and coated and treated paper manufacturing,0,0,0,0,0,0
149,Stationery product manufacturing,0,0,0,0,0,0
150,Sanitary paper product manufacturing,0,0,0,0,0,0
151,All other converted paper product manufacturing,0,0,0,0,0,0
152,Printing,5.2915005683898926,486289.29257392883,12435.744516551495,-6641.9658251106739,5445.0258612632751,16230.398789048195
153,Support activities for printing,0,0,0,0,0,0
154,Petroleum refineries,0,0,0,0,0,0
155,Asphalt paving mixture and block manufacturing,0.82969188690185547,602313.3397102356,0,67549.623548984528,0,9383.6206942796707
156,Asphalt shingle and coating materials manufacturing,0,0,0,0,0,0
157,Petroleum lubricating oil and grease manufacturing,0,0,0,0,0,0
158,All other petroleum and coal products manufacturing,0,0,0,0,0,0
159,Petrochemical manufacturing,0,0,0,0,0,0
160,Industrial gas manufacturing,0,0,0,0,0,0
161,Synthetic dye and pigment manufacturing,0,0,0,0,0,0
162,Other basic inorganic chemical manufacturing,0,0,0,0,0,0
163,Other basic organic chemical manufacturing,0,0,0,0,0,0
164,Plastics material and resin manufacturing,0,0,0,0,0,0
165,Synthetic rubber manufacturing,0,0,0,0,0,0
166,Artificial and synthetic fibers and filaments manufacturing,0,0,0,0,0,0
167,Nitrogenous fertilizer manufacturing,0,0,0,0,0,0
168,Phosphatic fertilizer manufacturing,0,0,0,0,0,0
169,Fertilizer mixing,0,0,0,0,0,0
170,Pesticide and other agricultural chemical manufacturing,0,0,0,0,0,0
171,Medicinal and botanical manufacturing,0,0,0,0,0,0
172,Pharmaceutical preparation manufacturing,0,0,0,0,0,0
173,In-vitro diagnostic substance manufacturing,0,0,0,0,0,0
174,Biological product (except diagnostic) manufacturing,0,0,0,0,0,0
175,Paint and coating manufacturing,0,0,0,0,0,0
176,Adhesive manufacturing,0,0,0,0,0,0
177,Soap and other detergent manufacturing,0,0,0,0,0,0
178,Polish and other sanitation good manufacturing,50.445018768310547,29661642.074584961,3137045.6218719482,36.714554880745709,3634684.5626831055,520816.74337387085
179,Surface active agent manufacturing,0,0,0,0,0,0
180,Toilet preparation manufacturing,0,0,0,0,0,0
181,Printing ink manufacturing,0,0,0,0,0,0
182,Explosives manufacturing,0,0,0,0,0,0
183,Custom compounding of purchased resins,0,0,0,0,0,0
184,Photographic film and chemical manufacturing,0,0,0,0,0,0
185,Other miscellaneous chemical product manufacturing,0,0,0,0,0,0
186,Plastics packaging materials and unlaminated film and sheet manufacturing,0,0,0,0,0,0
187,Unlaminated plastics profile shape manufacturing,0,0,0,0,0,0
188,Plastics pipe and pipe fitting manufacturing,0,0,0,0,0,0
189,"Laminated plastics plate, sheet (except packaging), and shape manufacturing",0,0,0,0,0,0
190,Polystyrene foam product manufacturing,0,0,0,0,0,0
191,Urethane and other foam product (except polystyrene) manufacturing,0,0,0,0,0,0
192,Plastics bottle manufacturing,0,0,0,0,0,0
193,Other plastics product manufacturing,1.1653866767883301,234310.06073951721,0,9014.3019333481789,0,4872.1032217144966
194,Tire manufacturing,0,0,0,0,0,0
195,Rubber and plastics hoses and belting manufacturing,0,0,0,0,0,0
196,Other rubber product manufacturing,0,0,0,0,0,0
197,"Pottery, ceramics, and plumbing fixture manufacturing",0,0,0,0,0,0
198,"Brick, tile, and other structural clay product manufacturing",0,0,0,0,0,0
199,Flat glass manufacturing,0,0,0,0,0,0
200,Other pressed and blown glass and glassware manufacturing,0,0,0,0,0,0
201,Glass container manufacturing,0,0,0,0,0,0
202,Glass product manufacturing made of purchased glass,0,0,0,0,0,0
203,Cement manufacturing,0,0,0,0,0,0
204,Ready-mix concrete manufacturing,12.028849601745606,4933616.6381835938,693664.90840911865,2276.8976632505655,767217.33808517456,90419.754385948181
205,Concrete block and brick manufacturing,0,0,0,0,0,0
206,Concrete pipe manufacturing,0,0,0,0,0,0
207,Other concrete product manufacturing,0,0,0,0,0,0
208,Lime manufacturing,0,0,0,0,0,0
209,Gypsum product manufacturing,0,0,0,0,0,0
210,Abrasive product manufacturing,0,0,0,0,0,0
211,Cut stone and stone product manufacturing,0,0,0,0,0,0
212,Ground or treated mineral and earth manufacturing,0,0,0,0,0,0
213,Mineral wool manufacturing,0,0,0,0,0,0
214,Miscellaneous nonmetallic mineral products manufacturing,0,0,0,0,0,0
215,Iron and steel mills and ferroalloy manufacturing,0,0,0,0,0,0
216,"Iron, steel pipe and tube manufacturing from purchased steel",0,0,0,0,0,0
217,Rolled steel shape manufacturing,0,0,0,0,0,0
218,Steel wire drawing,0,0,0,0,0,0
219,Alumina refining and primary aluminum production,0,0,0,0,0,0
220,Secondary smelting and alloying of aluminum,0,0,0,0,0,0
221,"Aluminum sheet, plate, and foil manufacturing",0,0,0,0,0,0
222,"Other aluminum rolling, drawing and extruding",0,0,0,0,0,0
223,Nonferrous metal (exc aluminum) smelting and refining,0,0,0,0,0,0
224,"Copper rolling, drawing, extruding and alloying",0,0,0,0,0,0
225,"Nonferrous metal, except copper and aluminum, shaping",0,0,0,0,0,0
226,Secondary processing of other nonferrous metals,0,0,0,0,0,0
227,Ferrous metal foundries,0,0,0,0,0,0
228,Nonferrous metal foundries,1.0490461587905884,150252.8041601181,0,-1329.6182733029127,0,3846.4583922177553
229,Custom roll forming,0,0,0,0,0,0
230,Crown and closure manufacturing and metal stamping,0,0,0,0,0,0
231,Iron and steel forging,0,0,0,0,0,0
232,Nonferrous forging,0,0,0,0,0,0
233,"Cutlery, utensil, pot, and pan manufacturing",0,0,0,0,0,0
234,Handtool manufacturing,0,0,0,0,0,0
235,Prefabricated metal buildings and components manufacturing,0,0,0,0,0,0
236,Fabricated structural metal manufacturing,0,0,0,0,0,0
237,Plate work manufacturing,0,0,0,0,0,0
238,Metal window and door manufacturing,0,0,0,0,0,0
239,Sheet metal work manufacturing,54.442249298095703,11184690.475463867,3241720.1995849609,35510.56981086731,728681.74314498901,187160.1790189743
240,Ornamental and architectural metal work manufacturing,0,0,0,0,0,0
241,Power boiler and heat exchanger manufacturing,0,0,0,0,0,0
242,Metal tank (heavy gauge) manufacturing,0,0,0,0,0,0
243,Metal cans manufacturing,0,0,0,0,0,0
244,"Metal barrels, drums and pails manufacturing",0,0,0,0,0,0
245,Hardware manufacturing,0,0,0,0,0,0
246,Spring and wire product manufacturing,64.875289916992188,15525473.594665527,3517982.7213287354,30086.396262049675,990563.75026702881,263722.50914573669
247,Machine shops,15.333100318908691,2086586.7137908936,828295.76730728149,6503.1377598643303,96748.277544975281,35583.630204200745
248,"Turned product and screw, nut, and bolt manufacturing",0,0,0,0,0,0
249,Metal heat treating,0,0,0,0,0,0
250,Metal coating and nonprecious engraving,0,0,0,0,0,0
251,"Electroplating, anodizing, and coloring metal",0,0,0,0,0,0
252,"Valve and fittings, other than plumbing, manufacturing",0,0,0,0,0,0
253,Plumbing fixture fitting and trim manufacturing,0,0,0,0,0,0
254,Ball and roller bearing manufacturing,0,0,0,0,0,0
255,Small arms ammunition manufacturing,0,0,0,0,0,0
256,"Ammunition, except for small arms, manufacturing",0,0,0,0,0,0
257,"Small arms, ordnance, and accessories manufacturing",0,0,0,0,0,0
258,Fabricated pipe and pipe fitting manufacturing,0,0,0,0,0,0
259,Other fabricated metal manufacturing,0,0,0,0,0,0
260,Farm machinery and equipment manufacturing,0,0,0,0,0,0
261,Lawn and garden equipment manufacturing,0,0,0,0,0,0
262,Construction machinery manufacturing,104.48526000976563,62210475.921630859,7329719.066619873,4010.8314715325832,8041988.3728027344,1423640.4895782471
263,Mining machinery and equipment manufacturing,0,0,0,0,0,0
264,Oil and gas field machinery and equipment manufacturing,0,0,0,0,0,0
265,Semiconductor machinery manufacturing,0,0,0,0,0,0
266,Food product machinery manufacturing,0,0,0,0,0,0
267,"Sawmill, woodworking, and paper machinery",0,0,0,0,0,0
268,Printing machinery and equipment manufacturing,0,0,0,0,0,0
269,All other industrial machinery manufacturing,0,0,0,0,0,0
270,Optical instrument and lens manufacturing,0,0,0,0,0,0
271,Photographic and photocopying equipment manufacturing,0,0,0,0,0,0
272,Other commercial service industry machinery manufacturing,0,0,0,0,0,0
273,Air purification and ventilation equipment manufacturing,0,0,0,0,0,0
274,Heating equipment (except warm air furnaces) manufacturing,0,0,0,0,0,0
275,"Air conditioning, refrigeration, and warm air heating equipment manufacturing",0,0,0,0,0,0
276,Industrial mold manufacturing,0,0,0,0,0,0
277,"Special tool, die, jig, and fixture manufacturing",0,0,0,0,0,0
278,Cutting tool and machine tool accessory manufacturing,0,0,0,0,0,0
279,Machine tool manufacturing,0,0,0,0,0,0
280,Rolling mill and other metalworking machinery manufacturing,0,0,0,0,0,0
281,Turbine and turbine generator set units manufacturing,0,0,0,0,0,0
282,"Speed changer, industrial high-speed drive, and gear manufacturing",0,0,0,0,0,0
283,Mechanical power transmission equipment manufacturing,0,0,0,0,0,0
284,Other engine equipment manufacturing,0,0,0,0,0,0
285,Pump and pumping equipment manufacturing,0,0,0,0,0,0
286,Air and gas compressor manufacturing,0,0,0,0,0,0
287,Elevator and moving stairway manufacturing,0,0,0,0,0,0
288,Conveyor and conveying equipment manufacturing,0,0,0,0,0,0
289,"Overhead cranes, hoists, and monorail systems manufacturing",0,0,0,0,0,0
290,"Industrial truck, trailer, and stacker manufacturing",0,0,0,0,0,0
291,Power-driven handtool manufacturing,0,0,0,0,0,0
292,Welding and soldering equipment manufacturing,0,0,0,0,0,0
293,Packaging machinery manufacturing,0,0,0,0,0,0
294,Industrial process furnace and oven manufacturing,0,0,0,0,0,0
295,Fluid power cylinder and actuator manufacturing,0,0,0,0,0,0
296,Fluid power pump and motor manufacturing,0,0,0,0,0,0
297,"Scales, balances, and miscellaneous general purpose machinery manufacturing",0,0,0,0,0,0
298,Electronic computer manufacturing,0,0,0,0,0,0
299,Computer storage device manufacturing,0,0,0,0,0,0
300,Computer terminals and other computer peripheral equipment manufacturing,0,0,0,0,0,0
301,Telephone apparatus manufacturing,0,0,0,0,0,0
302,Broadcast and wireless communications equipment manufacturing,0,0,0,0,0,0
303,Other communications equipment manufacturing,0,0,0,0,0,0
304,Audio and video equipment manufacturing,0,0,0,0,0,0
305,Printed circuit assembly (electronic assembly) manufacturing,0,0,0,0,0,0
306,Bare printed circuit board manufacturing,0,0,0,0,0,0
307,Semiconductor and related device manufacturing,0,0,0,0,0,0
308,"Capacitor, resistor, coil, transformer, and other inductor manufacturing",0,0,0,0,0,0
309,Electronic connector manufacturing,0,0,0,0,0,0
310,Other electronic component manufacturing,0,0,0,0,0,0
311,Electromedical and electrotherapeutic apparatus manufacturing,0,0,0,0,0,0
312,"Search, detection, and navigation instruments manufacturing",0,0,0,0,0,0
313,Automatic environmental control manufacturing,0,0,0,0,0,0
314,Industrial process variable instruments manufacturing,0,0,0,0,0,0
315,Totalizing fluid meter and counting device manufacturing,0,0,0,0,0,0
316,Electricity and signal testing instruments manufacturing,0,0,0,0,0,0
317,Analytical laboratory instrument manufacturing,0,0,0,0,0,0
318,Irradiation apparatus manufacturing,0,0,0,0,0,0
319,"Watch, clock, and other measuring and controlling device manufacturing",10.502352714538574,3443684.1011047363,1083229.0649414063,0,416765.66004753113,63640.989363193512
320,Blank magnetic and optical recording media manufacturing,0,0,0,0,0,0
321,Software and other prerecorded and record reproducing,0,0,0,0,0,0
322,Electric lamp bulb and part manufacturing,0,0,0,0,0,0
323,Lighting fixture manufacturing,0,0,0,0,0,0
324,Small electrical appliance manufacturing,0,0,0,0,0,0
325,Household cooking appliance manufacturing,0,0,0,0,0,0
326,Household refrigerator and home freezer manufacturing,0,0,0,0,0,0
327,Household laundry equipment manufacturing,0,0,0,0,0,0
328,Other major household appliance manufacturing,0,0,0,0,0,0
329,"Power, distribution, and specialty transformer manufacturing",0,0,0,0,0,0
330,Motor and generator manufacturing,0,0,0,0,0,0
331,Switchgear and switchboard apparatus manufacturing,0,0,0,0,0,0
332,Relay and industrial control manufacturing,0,0,0,0,0,0
333,Storage battery manufacturing,0,0,0,0,0,0
334,Primary battery manufacturing,0,0,0,0,0,0
335,Fiber optic cable manufacturing,1.5683823823928833,842541.99266433716,104326.65795087814,0,4027.5240316987038,14893.59512925148
336,Other communication and energy wire manufacturing,0,0,0,0,0,0
337,Wiring device manufacturing,0,0,0,0,0,0
338,Carbon and graphite product manufacturing,0,0,0,0,0,0
339,All other miscellaneous electrical equipment and component manufacturing,0,0,0,0,0,0
340,Automobile manufacturing,0,0,0,0,0,0
341,Light truck and utility vehicle manufacturing,0,0,0,0,0,0
342,Heavy duty truck manufacturing,0,0,0,0,0,0
343,Motor vehicle body manufacturing,0,0,0,0,0,0
344,Truck trailer manufacturing,0,0,0,0,0,0
345,Motor home manufacturing,0,0,0,0,0,0
346,Travel trailer and camper manufacturing,0,0,0,0,0,0
347,Motor vehicle gasoline engine and engine parts manufacturing,0,0,0,0,0,0
348,Motor vehicle electrical and electronic equipment manufacturing,0.8147239089012146,329901.81446075439,0,3587.3099695891142,0,6910.9327159821987
349,Motor vehicle transmission and power train parts manufacturing,0,0,0,0,0,0
