Industry Detail ,,,,,,,
IndustryCode,Description,Employment,Output,EmployeeCompensation,ProprietorIncome,OtherPropertyTypeIncome,TaxOnProductionAndImports
0,Total,17511.528008446097,2405504689.9374571,608180068.46518254,100999611.7702467,372580774.20436895,171472010.41662082
1,Oilseed farming,0.5299413800239563,227713.07826042175,410.3297833353281,179493.9786195755,38018.260151147842,-2683.2290459424257
2,Grain farming,7.9118390083312988,1196703.314781189,67808.456718921661,339884.1917514801,287952.15487480164,-499117.43402481079
3,Vegetable and melon farming,164.54902648925781,10214657.783508301,1492588.2816314697,1092986.2260818481,2485337.9726409912,1761.0394861549139
4,Fruit farming,41.285713195800781,1848753.3330917358,185101.00245475769,278731.16731643677,566782.29570388794,394.23434645868838
5,Tree nut farming,0.48855611681938171,19764.145836234093,6692.7401348948479,1851.6518175601959,10254.599153995514,8.4034127212362364
6,"Greenhouse, nursery, and floriculture production",41.070476531982422,4947566.032409668,892549.99160766602,320827.60334014893,1821835.994720459,472.10539923980832
7,Tobacco farming,0,0,0,0,0,0
8,Cotton farming,0,0,0,0,0,0
9,Sugarcane and sugar beet farming,0,0,0,0,0,0
10,All other crop farming,814.901611328125,6994326.114654541,1339775.4430770874,889285.80284118652,2216252.326965332,-109980.38202524185
11,"Beef cattle ranching and farming, including feedlots and dual-purpose ranching and farming",183.82402038574219,13163628.578186035,119050.82315206528,2290443.6588287354,2584810.733795166,622878.43227386475
12,Dairy cattle and milk production,4.0020456314086914,1475979.9242019653,34653.369337320328,83625.972270965576,155253.97658348084,5539.4037626683712
13,Poultry and egg production,0.22134669125080109,160212.15915679932,5500.3762245178223,1301.2876734137535,11577.724479138851,5006.7659467458725
14,"Animal production, except cattle and poultry and eggs",34.201099395751953,4542977.8099060059,232979.22313213348,1782990.574836731,2036352.3960113525,287166.98288917542
15,"Forestry, forest products, and timber tract production",19.748451232910156,2345868.3490753174,1760908.3652496338,160933.85219573975,-6399.0922644734383,45181.389898061752
16,Commercial logging,189.56880187988281,18278270.721435547,7733453.2737731934,4135972.0230102539,-509492.75493621826,566816.62797927856
17,Commercial fishing,105.98777008056641,3683202.5051116943,137625.09822845459,1242078.7811279297,961607.03897476196,1318022.7279663086
18,Commercial hunting and trapping,0,0,0,0,0,0
19,Support activities for agriculture and forestry,104.17245483398438,5719099.9984741211,2000533.3423614502,3227474.4510650635,-428049.05772209167,134490.04292488098
20,Oil and gas extraction,20.651594161987305,4699147.7012634277,0,188.65115998778492,0,3894.5961277931929
21,Coal mining,0,0,0,0,0,0
22,"Copper, nickel, lead, and zinc mining",0,0,0,0,0,0
23,Iron ore mining,0,0,0,0,0,0
24,Gold ore mining,0,0,0,0,0,0
25,Silver ore mining,0,0,0,0,0,0
26,Uranium-radium-vanadium ore mining,0,0,0,0,0,0
27,Other metal ore mining,0,0,0,0,0,0
28,Stone mining and quarrying,30.147714614868164,5534207.820892334,1739919.3048477173,9634.098969399929,-44977.344572544098,235774.17433261871
29,Sand and gravel mining,42.579925537109375,7174611.0916137695,3383430.4809570312,7684.3132264912128,-35358.745604753494,280401.70669555664
30,"Other clay, ceramic, refractory minerals mining",0,0,0,0,0,0
31,"Potash, soda, and borate mineral mining",0,0,0,0,0,0
32,Phosphate rock mining,0,0,0,0,0,0
33,Other chemical and fertilizer mineral mining,0,0,0,0,0,0
34,Other nonmetallic minerals,0,0,0,0,0,0
35,Drilling oil and gas wells,1.5618523359298706,364296.52571678162,0,14.085097063798457,0,7163.3490733802319
36,Support activities for oil and gas operations,2.2316882610321045,381453.69291305542,0,20.175088138785213,0,7852.0281240344048
37,Metal mining services,2.2298321723937988,506474.49493408203,0,20.207218767609447,0,9424.6426597237587
38,Other nonmetallic minerals services,7.5427303314208984,1970873.1174468994,307471.93098068237,992.37333051860332,-6025.8815065026283,6102.2159643471241
39,Electric power generation - Hydroelectric,120.01810455322266,92770545.959472656,12474509.239196777,-97798.824310302734,37206005.096435547,15231848.71673584
40,Electric power generation - Fossil fuel,0,0,0,0,0,0
41,Electric power generation - Nuclear,0,0,0,0,0,0
42,Electric power generation - Solar,0,0,0,0,0,0
43,Electric power generation - Wind,0,0,0,0,0,0
44,Electric power generation - Geothermal,0,0,0,0,0,0
45,Electric power generation - Biomass,0,0,0,0,0,0
46,Electric power generation - All other,0,0,0,0,0,0
47,Electric power transmission and distribution,38.179691314697266,67659126.281738281,5006693.3631896973,-274.54269002191722,19414157.867431641,13307748.794555664
48,Natural gas distribution,53.637985229492188,48677341.461181641,4893030.6434631348,-7476.5686877071857,14136393.547058106,7516497.1351623535
49,"Water, sewage and other systems",0,0,0,0,0,0
50,Construction of new health care structures,28.28009033203125,3376458.1680297852,560494.00568008423,662881.97040557861,347255.70678710938,64786.545932292938
51,Construction of new manufacturing structures,54.039131164550781,6945772.1710205078,1452478.7664413452,1055840.9690856934,517890.09571075439,112373.91084432602
52,Construction of new power and communication structures,69.292549133300781,9977592.4682617188,1690047.025680542,1487015.6049728394,1573894.9775695801,212256.28256797791
53,Construction of new educational and vocational structures,74.373268127441406,8193728.4469604492,2011288.6428833008,1400766.0150527954,918229.10308837891,136079.77330684662
54,Construction of new highways and streets,63.643947601318359,10907120.704650879,1697265.1481628418,1290423.2740402222,1619827.0320892334,187528.0886888504
55,"Construction of new commercial structures, including farm structures",109.55738067626953,11475208.282470703,1984846.830368042,2561743.4978485107,461821.76470756531,309919.41690444946
56,Construction of other new nonresidential structures,156.98527526855469,12496577.262878418,3447268.9628601074,3551771.879196167,-1896904.9453735352,222327.3515701294
57,Construction of new single-family residential structures,175.48976135253906,19871129.989624023,3028866.5294647217,4253474.7123718262,1745567.9178237915,445943.4449672699
58,Construction of new multifamily residential structures,54.080055236816406,4196599.4834899902,945725.02374649048,1320381.4029693604,553881.70480728149,90963.482856750488
59,Construction of other new residential structures,122.11711120605469,20434885.025024414,2274061.2030029297,2920220.8518981934,1482343.6737060547,587358.71315002441
60,Maintenance and repair construction of nonresidential structures,82.81256103515625,14105755.805969238,1454274.1775512695,2012135.0288391113,766637.08686828613,383039.83211517334
61,Maintenance and repair construction of residential structures,39.620220184326172,7108782.7682495117,688245.17726898193,884127.02083587646,448898.52404594421,350031.07786178589
62,"Maintenance and repair construction of highways, streets, bridges, and tunnels",30.079278945922852,2744197.6070404053,524030.44700622559,718202.11410522461,-232205.13761043549,76876.945793628693
63,Dog and cat food manufacturing,10.88890266418457,12261620.52154541,139626.81591510773,10035.869665443897,345117.09213256836,239189.17775154114
64,Other animal food manufacturing,1.718246340751648,1615456.9387435913,23218.242451548576,1231.5578060224652,14310.915023088455,44643.107801675797
65,Flour milling,0,0,0,0,0,0
66,Rice milling,0,0,0,0,0,0
67,Malt manufacturing,0,0,0,0,0,0
68,Wet corn milling,0,0,0,0,0,0
69,Soybean and other oilseed processing,0,0,0,0,0,0
70,Fats and oils refining and blending,0,0,0,0,0,0
71,Breakfast cereal manufacturing,0,0,0,0,0,0
72,Beet sugar manufacturing,0,0,0,0,0,0
73,Sugar cane mills and refining,0,0,0,0,0,0
74,Nonchocolate confectionery manufacturing,0,0,0,0,0,0
75,Chocolate and confectionery manufacturing from cacao beans,0,0,0,0,0,0
76,Confectionery manufacturing from purchased chocolate,0,0,0,0,0,0
77,"Frozen fruits, juices and vegetables manufacturing",0,0,0,0,0,0
78,Frozen specialties manufacturing,0,0,0,0,0,0
79,Canned fruits and vegetables manufacturing,0,0,0,0,0,0
80,Canned specialties,0,0,0,0,0,0
81,Dehydrated food products manufacturing,0,0,0,0,0,0
82,Cheese manufacturing,0,0,0,0,0,0
83,"Dry, condensed, and evaporated dairy product manufacturing",0,0,0,0,0,0
84,Fluid milk manufacturing,0,0,0,0,0,0
85,Creamery butter manufacturing,0,0,0,0,0,0
86,Ice cream and frozen dessert manufacturing,0,0,0,0,0,0
87,Frozen cakes and other pastries manufacturing,18.084463119506836,1642961.1444473267,542076.88570022583,10390.501469373703,62883.60059261322,303670.61495780945
88,Poultry processing,0,0,0,0,0,0
89,"Animal, except poultry, slaughtering",7.1314144134521484,4567135.3340148926,174292.6687002182,2721.3906869292259,56031.148880720139,33205.371350049973
90,Meat processed from carcasses,0.61324834823608398,308171.21267318726,26599.664241075516,0,2352.2621486335993,3194.6445815265179
91,Rendering and meat byproduct processing,0.61401480436325073,218372.12145328522,26616.973802447319,0,3150.952747091651,4651.0733664035797
92,Seafood product preparation and packaging,0,0,0,0,0,0
93,"Bread and bakery product, except frozen, manufacturing",21.269670486450195,2695429.801940918,596688.38977813721,28676.923364400864,136946.14171981812,159086.85326576233
94,Cookie and cracker manufacturing,0,0,0,0,0,0
95,"Dry pasta, mixes, and dough manufacturing",0,0,0,0,0,0
96,Tortilla manufacturing,0,0,0,0,0,0
97,Roasted nuts and peanut butter manufacturing,1.9769066572189331,943995.35655975342,130456.03036880493,0,142158.61260890961,4469.8384590446949
98,Other snack food manufacturing,2.0111727714538574,1038558.840751648,134779.22976016998,0,122037.72366046906,6481.9147810339928
99,Coffee and tea manufacturing,0,0,0,0,0,0
100,Flavoring syrup and concentrate manufacturing,0,0,0,0,0,0
101,"Mayonnaise, dressing, and sauce manufacturing",0,0,0,0,0,0
102,Spice and extract manufacturing,0,0,0,0,0,0
103,All other food manufacturing,0,0,0,0,0,0
104,Bottled and canned soft drinks & water,0,0,0,0,0,0
105,Manufactured ice,0,0,0,0,0,0
106,Breweries,9.0902318954467773,3412857.2940826416,125123.59023094177,23865.804076194763,160152.97174453735,314087.48030662537
107,Wineries,8.3526725769042969,2336583.137512207,141171.61929607391,4351.2172996997833,86345.069110393524,77556.140720844269
108,Distilleries,8.730712890625,7908432.4836730957,160680.20462989807,17705.578356981277,391968.90592575073,2078219.8905944824
109,Tobacco product manufacturing,0,0,0,0,0,0
110,"Fiber, yarn, and thread mills",0,0,0,0,0,0
111,Broadwoven fabric mills,0.46140196919441223,78365.147113800049,0,2523.1167674064636,0,1225.1230655238032
112,Narrow fabric mills and schiffli machine embroidery,0,0,0,0,0,0
113,Nonwoven fabric mills,0,0,0,0,0,0
114,Knit fabric mills,0,0,0,0,0,0
115,Textile and fabric finishing mills,0,0,0,0,0,0
116,Fabric coating mills,0,0,0,0,0,0
117,Carpet and rug mills,0,0,0,0,0,0
118,Curtain and linen mills,0,0,0,0,0,0
119,Textile bag and canvas mills,0,0,0,0,0,0
120,"Rope, cordage, twine, tire cord and tire fabric mills",0,0,0,0,0,0
121,Other textile product mills,2.2415416240692139,213331.47585391998,0,1186.1419770866633,0,3610.0666038691998
122,Hosiery and sock mills,0,0,0,0,0,0
123,Other apparel knitting mills,0,0,0,0,0,0
124,Cut and sew apparel contractors,6.2038059234619141,202296.88286781311,0,4690.4073096811771,0,13264.358043670654
125,Mens and boys cut and sew apparel manufacturing,0,0,0,0,0,0
126,Womens and girls cut and sew apparel manufacturing,0,0,0,0,0,0
127,Other cut and sew apparel manufacturing,0,0,0,0,0,0
128,Apparel accessories and other apparel manufacturing,0,0,0,0,0,0
129,Leather and hide tanning and finishing,0,0,0,0,0,0
130,Footwear manufacturing,0,0,0,0,0,0
131,Other leather and allied product manufacturing,2.1277227401733398,146148.57733249664,0,1637.2223617509008,0,1681.6768329590559
132,Sawmills,400.68377685546875,112567031.86035156,21919073.104858398,98837.204277515411,8966433.5250854492,1003575.8018493652
133,Wood preservation,0,0,0,0,0,0
134,Veneer and plywood manufacturing,193.75917053222656,54199192.047119141,12199114.799499512,16549.989581108093,5003637.7906799316,446340.23308753967
135,Engineered wood member and truss manufacturing,0,0,0,0,0,0
136,Reconstituted wood product manufacturing,0,0,0,0,0,0
137,Wood windows and door manufacturing,0,0,0,0,0,0
138,"Cut stock, resawing lumber, and planing",0,0,0,0,0,0
139,"Other millwork, including flooring",0,0,0,0,0,0
140,Wood container and pallet manufacturing,31.321311950683594,4614772.7966308594,1270195.6033706665,10319.340042769909,245849.59447383881,42367.938905954361
141,Manufactured home (mobile home) manufacturing,0,0,0,0,0,0
142,Prefabricated wood building manufacturing,0,0,0,0,0,0
143,All other miscellaneous wood product manufacturing,27.434127807617188,4640351.7723083496,1180204.0338516235,10867.350734770298,342739.10522460938,42933.8738322258
144,Pulp mills,0,0,0,0,0,0
145,Paper mills,0.45367333292961121,273455.97743988037,0,11419.061571359634,0,3568.337531760335
146,Paperboard mills,0,0,0,0,0,0
147,Paperboard container manufacturing,0,0,0,0,0,0
148,Paper bag and coated and treated paper manufacturing,0,0,0,0,0,0
149,Stationery product manufacturing,0,0,0,0,0,0
150,Sanitary paper product manufacturing,0,0,0,0,0,0
151,All other converted paper product manufacturing,0,0,0,0,0,0
152,Printing,6.9254846572875977,857031.04734420776,159879.84836101532,38233.600556850433,46335.563063621521,12081.041932106018
153,Support activities for printing,5.503605842590332,476542.94967651367,138021.43931388855,20795.369520783424,38356.620818376541,6218.9153395593166
154,Petroleum refineries,0.66126424074172974,4358187.6754760742,0,1493.0253382772207,0,19351.271912455559
155,Asphalt paving mixture and block manufacturing,0,0,0,0,0,0
156,Asphalt shingle and coating materials manufacturing,0,0,0,0,0,0
157,Petroleum lubricating oil and grease manufacturing,0,0,0,0,0,0
158,All other petroleum and coal products manufacturing,0,0,0,0,0,0
159,Petrochemical manufacturing,0,0,0,0,0,0
160,Industrial gas manufacturing,0,0,0,0,0,0
161,Synthetic dye and pigment manufacturing,0,0,0,0,0,0
162,Other basic inorganic chemical manufacturing,0,0,0,0,0,0
163,Other basic organic chemical manufacturing,0,0,0,0,0,0
164,Plastics material and resin manufacturing,0,0,0,0,0,0
165,Synthetic rubber manufacturing,0,0,0,0,0,0
166,Artificial and synthetic fibers and filaments manufacturing,0,0,0,0,0,0
167,Nitrogenous fertilizer manufacturing,0,0,0,0,0,0
168,Phosphatic fertilizer manufacturing,0,0,0,0,0,0
169,Fertilizer mixing,0,0,0,0,0,0
170,Pesticide and other agricultural chemical manufacturing,0,0,0,0,0,0
171,Medicinal and botanical manufacturing,0,0,0,0,0,0
172,Pharmaceutical preparation manufacturing,12.392450332641602,13878445.625305176,652776.65853500366,1165.6463611871004,2136863.9469146729,581280.64870834351
173,In-vitro diagnostic substance manufacturing,0,0,0,0,0,0
174,Biological product (except diagnostic) manufacturing,0,0,0,0,0,0
175,Paint and coating manufacturing,0,0,0,0,0,0
176,Adhesive manufacturing,0,0,0,0,0,0
177,Soap and other detergent manufacturing,0,0,0,0,0,0
178,Polish and other sanitation good manufacturing,0,0,0,0,0,0
179,Surface active agent manufacturing,0,0,0,0,0,0
180,Toilet preparation manufacturing,5.2438230514526367,3266371.9654083252,97831.062972545624,6125.9102076292038,336737.09630966187,77625.945210456848
181,Printing ink manufacturing,0,0,0,0,0,0
182,Explosives manufacturing,0,0,0,0,0,0
183,Custom compounding of purchased resins,0,0,0,0,0,0
184,Photographic film and chemical manufacturing,0,0,0,0,0,0
185,Other miscellaneous chemical product manufacturing,0,0,0,0,0,0
186,Plastics packaging materials and unlaminated film and sheet manufacturing,0,0,0,0,0,0
187,Unlaminated plastics profile shape manufacturing,0,0,0,0,0,0
188,Plastics pipe and pipe fitting manufacturing,0,0,0,0,0,0
189,"Laminated plastics plate, sheet (except packaging), and shape manufacturing",0,0,0,0,0,0
190,Polystyrene foam product manufacturing,0,0,0,0,0,0
191,Urethane and other foam product (except polystyrene) manufacturing,0,0,0,0,0,0
192,Plastics bottle manufacturing,0,0,0,0,0,0
193,Other plastics product manufacturing,2.5044524669647217,468637.94326782227,0,-9887.1868103742599,0,4827.7960158884525
194,Tire manufacturing,0,0,0,0,0,0
195,Rubber and plastics hoses and belting manufacturing,0,0,0,0,0,0
196,Other rubber product manufacturing,0,0,0,0,0,0
197,"Pottery, ceramics, and plumbing fixture manufacturing",0,0,0,0,0,0
198,"Brick, tile, and other structural clay product manufacturing",0,0,0,0,0,0
199,Flat glass manufacturing,0,0,0,0,0,0
200,Other pressed and blown glass and glassware manufacturing,0,0,0,0,0,0
201,Glass container manufacturing,0,0,0,0,0,0
202,Glass product manufacturing made of purchased glass,0,0,0,0,0,0
203,Cement manufacturing,0,0,0,0,0,0
204,Ready-mix concrete manufacturing,14.64305591583252,5193654.0603637695,592825.11472702026,19846.456125378609,407380.46169281006,58987.144380807877
205,Concrete block and brick manufacturing,0,0,0,0,0,0
206,Concrete pipe manufacturing,0,0,0,0,0,0
207,Other concrete product manufacturing,0,0,0,0,0,0
208,Lime manufacturing,3.9068169593811035,1843295.0973510742,149128.16882133484,12381.807900965214,212015.80762863159,27316.071093082428
209,Gypsum product manufacturing,0,0,0,0,0,0
210,Abrasive product manufacturing,0,0,0,0,0,0
211,Cut stone and stone product manufacturing,0,0,0,0,0,0
212,Ground or treated mineral and earth manufacturing,0,0,0,0,0,0
213,Mineral wool manufacturing,0,0,0,0,0,0
214,Miscellaneous nonmetallic mineral products manufacturing,0,0,0,0,0,0
215,Iron and steel mills and ferroalloy manufacturing,0,0,0,0,0,0
216,"Iron, steel pipe and tube manufacturing from purchased steel",0,0,0,0,0,0
217,Rolled steel shape manufacturing,0,0,0,0,0,0
218,Steel wire drawing,0,0,0,0,0,0
219,Alumina refining and primary aluminum production,0,0,0,0,0,0
220,Secondary smelting and alloying of aluminum,0,0,0,0,0,0
221,"Aluminum sheet, plate, and foil manufacturing",0,0,0,0,0,0
222,"Other aluminum rolling, drawing and extruding",0,0,0,0,0,0
223,Nonferrous metal (exc aluminum) smelting and refining,2.2148902416229248,2045435.6670379639,101586.22264862061,0,375723.39177131653,34651.163965463638
224,"Copper rolling, drawing, extruding and alloying",0,0,0,0,0,0
225,"Nonferrous metal, except copper and aluminum, shaping",0,0,0,0,0,0
226,Secondary processing of other nonferrous metals,0,0,0,0,0,0
227,Ferrous metal foundries,0,0,0,0,0,0
228,Nonferrous metal foundries,0,0,0,0,0,0
229,Custom roll forming,0,0,0,0,0,0
230,Crown and closure manufacturing and metal stamping,0,0,0,0,0,0
231,Iron and steel forging,0,0,0,0,0,0
232,Nonferrous forging,0,0,0,0,0,0
233,"Cutlery, utensil, pot, and pan manufacturing",0,0,0,0,0,0
234,Handtool manufacturing,0,0,0,0,0,0
235,Prefabricated metal buildings and components manufacturing,0,0,0,0,0,0
236,Fabricated structural metal manufacturing,0,0,0,0,0,0
237,Plate work manufacturing,0,0,0,0,0,0
238,Metal window and door manufacturing,0,0,0,0,0,0
239,Sheet metal work manufacturing,0,0,0,0,0,0
240,Ornamental and architectural metal work manufacturing,0,0,0,0,0,0
241,Power boiler and heat exchanger manufacturing,0,0,0,0,0,0
242,Metal tank (heavy gauge) manufacturing,0,0,0,0,0,0
243,Metal cans manufacturing,0,0,0,0,0,0
244,"Metal barrels, drums and pails manufacturing",0,0,0,0,0,0
245,Hardware manufacturing,0,0,0,0,0,0
246,Spring and wire product manufacturing,0,0,0,0,0,0
247,Machine shops,99.083213806152344,11608562.469482422,3386874.9141693115,252227.33616828919,607191.14542007446,128293.36524009705
248,"Turned product and screw, nut, and bolt manufacturing",0,0,0,0,0,0
249,Metal heat treating,0,0,0,0,0,0
250,Metal coating and nonprecious engraving,0,0,0,0,0,0
251,"Electroplating, anodizing, and coloring metal",0,0,0,0,0,0
252,"Valve and fittings, other than plumbing, manufacturing",0,0,0,0,0,0
253,Plumbing fixture fitting and trim manufacturing,0,0,0,0,0,0
254,Ball and roller bearing manufacturing,0,0,0,0,0,0
255,Small arms ammunition manufacturing,0,0,0,0,0,0
256,"Ammunition, except for small arms, manufacturing",0,0,0,0,0,0
257,"Small arms, ordnance, and accessories manufacturing",0,0,0,0,0,0
258,Fabricated pipe and pipe fitting manufacturing,0,0,0,0,0,0
259,Other fabricated metal manufacturing,0,0,0,0,0,0
260,Farm machinery and equipment manufacturing,19.399391174316406,7657353.8780212402,1028357.1481704712,22608.699277043343,201341.01808071137,86678.914725780487
261,Lawn and garden equipment manufacturing,0,0,0,0,0,0
262,Construction machinery manufacturing,15.400138854980469,8109362.6022338867,881733.59632492065,9326.995350420475,415113.77692222595,110018.5289978981
263,Mining machinery and equipment manufacturing,0,0,0,0,0,0
264,Oil and gas field machinery and equipment manufacturing,0,0,0,0,0,0
265,Semiconductor machinery manufacturing,0,0,0,0,0,0
266,Food product machinery manufacturing,0,0,0,0,0,0
267,"Sawmill, woodworking, and paper machinery",0,0,0,0,0,0
268,Printing machinery and equipment manufacturing,0,0,0,0,0,0
269,All other industrial machinery manufacturing,0,0,0,0,0,0
270,Optical instrument and lens manufacturing,0,0,0,0,0,0
271,Photographic and photocopying equipment manufacturing,0,0,0,0,0,0
272,Other commercial service industry machinery manufacturing,33.928787231445312,11537774.085998535,2276982.7842712402,8794.805034995079,921313.52424621582,120281.50260448456
273,Air purification and ventilation equipment manufacturing,0,0,0,0,0,0
274,Heating equipment (except warm air furnaces) manufacturing,113.83533477783203,29056287.76550293,6916917.8009033203,6947.806105017662,1905853.3906936646,310973.16741943359
275,"Air conditioning, refrigeration, and warm air heating equipment manufacturing",29.537967681884766,10717273.712158203,1590456.8433761597,16714.148223400116,705109.95388031006,131873.45862388611
276,Industrial mold manufacturing,103.86764526367188,18767917.633056641,8471047.4014282227,6957.6259702444077,662401.19934082031,153527.08101272583
277,"Special tool, die, jig, and fixture manufacturing",0,0,0,0,0,0
278,Cutting tool and machine tool accessory manufacturing,0,0,0,0,0,0
279,Machine tool manufacturing,0,0,0,0,0,0
280,Rolling mill and other metalworking machinery manufacturing,0,0,0,0,0,0
281,Turbine and turbine generator set units manufacturing,0,0,0,0,0,0
282,"Speed changer, industrial high-speed drive, and gear manufacturing",0,0,0,0,0,0
283,Mechanical power transmission equipment manufacturing,0,0,0,0,0,0
284,Other engine equipment manufacturing,0,0,0,0,0,0
285,Pump and pumping equipment manufacturing,0,0,0,0,0,0
286,Air and gas compressor manufacturing,0,0,0,0,0,0
287,Elevator and moving stairway manufacturing,0,0,0,0,0,0
288,Conveyor and conveying equipment manufacturing,0,0,0,0,0,0
289,"Overhead cranes, hoists, and monorail systems manufacturing",0,0,0,0,0,0
290,"Industrial truck, trailer, and stacker manufacturing",0,0,0,0,0,0
291,Power-driven handtool manufacturing,0,0,0,0,0,0
292,Welding and soldering equipment manufacturing,0,0,0,0,0,0
293,Packaging machinery manufacturing,31.416791915893555,9318675.0411987305,2278924.7035980225,5173.2994616031647,641917.94395446777,91683.804988861084
294,Industrial process furnace and oven manufacturing,0,0,0,0,0,0
295,Fluid power cylinder and actuator manufacturing,0,0,0,0,0,0
296,Fluid power pump and motor manufacturing,0,0,0,0,0,0
297,"Scales, balances, and miscellaneous general purpose machinery manufacturing",0,0,0,0,0,0
298,Electronic computer manufacturing,0,0,0,0,0,0
299,Computer storage device manufacturing,0,0,0,0,0,0
300,Computer terminals and other computer peripheral equipment manufacturing,0,0,0,0,0,0
301,Telephone apparatus manufacturing,0,0,0,0,0,0
302,Broadcast and wireless communications equipment manufacturing,0,0,0,0,0,0
303,Other communications equipment manufacturing,0,0,0,0,0,0
304,Audio and video equipment manufacturing,0,0,0,0,0,0
305,Printed circuit assembly (electronic assembly) manufacturing,0,0,0,0,0,0
306,Bare printed circuit board manufacturing,0,0,0,0,0,0
307,Semiconductor and related device manufacturing,0,0,0,0,0,0
308,"Capacitor, resistor, coil, transformer, and other inductor manufacturing",0,0,0,0,0,0
309,Electronic connector manufacturing,0,0,0,0,0,0
310,Other electronic component manufacturing,0,0,0,0,0,0
311,Electromedical and electrotherapeutic apparatus manufacturing,0,0,0,0,0,0
312,"Search, detection, and navigation instruments manufacturing",0,0,0,0,0,0
313,Automatic environmental control manufacturing,0,0,0,0,0,0
314,Industrial process variable instruments manufacturing,0,0,0,0,0,0
315,Totalizing fluid meter and counting device manufacturing,0,0,0,0,0,0
316,Electricity and signal testing instruments manufacturing,0,0,0,0,0,0
317,Analytical laboratory instrument manufacturing,0,0,0,0,0,0
318,Irradiation apparatus manufacturing,0,0,0,0,0,0
319,"Watch, clock, and other measuring and controlling device manufacturing",0,0,0,0,0,0
320,Blank magnetic and optical recording media manufacturing,0,0,0,0,0,0
321,Software and other prerecorded and record reproducing,0,0,0,0,0,0
322,Electric lamp bulb and part manufacturing,0,0,0,0,0,0
323,Lighting fixture manufacturing,3.6554172039031982,718027.65130996704,0,-52355.162799358368,0,9437.77896463871
324,Small electrical appliance manufacturing,0,0,0,0,0,0
325,Household cooking appliance manufacturing,0,0,0,0,0,0
326,Household refrigerator and home freezer manufacturing,0,0,0,0,0,0
327,Household laundry equipment manufacturing,0,0,0,0,0,0
328,Other major household appliance manufacturing,0,0,0,0,0,0
329,"Power, distribution, and specialty transformer manufacturing",0,0,0,0,0,0
330,Motor and generator manufacturing,0,0,0,0,0,0
331,Switchgear and switchboard apparatus manufacturing,0,0,0,0,0,0
332,Relay and industrial control manufacturing,0,0,0,0,0,0
