Industry Detail ,,,,,,,
245,Hardware manufacturing,20.628894805908203,7274087.4290466309,1693977.8327941895,18759.068101644516,839362.44249343872,130420.77422142029
246,Spring and wire product manufacturing,83.856536865234375,23788246.154785156,7301377.7732849121,229672.52135276794,2055860.0425720215,340841.79997444153
247,Machine shops,302.65353393554688,44781276.702880859,18912923.812866211,860486.14978790283,2209105.7300567627,702298.10476303101
248,"Turned product and screw, nut, and bolt manufacturing",112.52588653564453,27130029.678344727,7489024.1622924805,198372.45345115662,2286119.6994781494,443299.59154129028
249,Metal heat treating,26.948322296142578,7630379.1999816895,2336471.7960357666,36795.709282159805,1015140.4142379761,118716.43364429474
250,Metal coating and nonprecious engraving,2.8961751461029053,706496.7155456543,154875.29337406158,43109.670281410217,94255.149364471436,11483.115144073963
251,"Electroplating, anodizing, and coloring metal",285.57318115234375,45365890.502929688,20285734.176635742,72730.898857116699,1697956.3236236572,640352.18954086304
252,"Valve and fittings, other than plumbing, manufacturing",105.60040283203125,36156608.581542969,9482069.9691772461,216520.30944824219,4545357.7041625977,616224.76577758789
253,Plumbing fixture fitting and trim manufacturing,0,0,0,0,0,0
254,Ball and roller bearing manufacturing,145.21870422363281,45228424.072265625,10936923.027038574,26803.00734937191,7015279.2930603027,672904.43181991577
255,Small arms ammunition manufacturing,0,0,0,0,0,0
256,"Ammunition, except for small arms, manufacturing",0,0,0,0,0,0
257,"Small arms, ordnance, and accessories manufacturing",84.779220581054688,31809106.826782227,5909198.7609863281,92299.714684486389,7293244.3618774414,812259.91249084473
258,Fabricated pipe and pipe fitting manufacturing,10.831631660461426,2441264.8677825928,812376.43957138062,90000.219643115997,99281.840026378632,40508.024394512177
259,Other fabricated metal manufacturing,54.509746551513672,11607118.606567383,2983884.5729827881,233015.38825035095,789130.5685043335,221849.9481678009
260,Farm machinery and equipment manufacturing,0,0,0,0,0,0
261,Lawn and garden equipment manufacturing,78.526168823242188,42454227.447509766,4752334.5947265625,36507.736891508102,4227744.5793151855,741762.45927810669
262,Construction machinery manufacturing,0,0,0,0,0,0
263,Mining machinery and equipment manufacturing,0,0,0,0,0,0
264,Oil and gas field machinery and equipment manufacturing,0,0,0,0,0,0
265,Semiconductor machinery manufacturing,0,0,0,0,0,0
266,Food product machinery manufacturing,0,0,0,0,0,0
267,"Sawmill, woodworking, and paper machinery",1.7080700397491455,447010.81514358521,117120.06479501724,9146.7723250389099,11412.102729082108,9746.7470914125443
268,Printing machinery and equipment manufacturing,0,0,0,0,0,0
269,All other industrial machinery manufacturing,149.48658752441406,42495124.816894531,12055043.22052002,15885.978937149048,4634633.0642700195,659033.59651565552
270,Optical instrument and lens manufacturing,3.5364820957183838,1242079.0195465088,274900.58541297913,9081.3562273979187,189078.39059829712,17227.822914719582
271,Photographic and photocopying equipment manufacturing,42.119564056396484,19929864.883422852,4257214.5462036133,31882.476061582565,2617443.7999725342,243675.15742778778
272,Other commercial service industry machinery manufacturing,39.738597869873047,14742737.770080566,2489606.8572998047,20363.146439194679,2347604.0363311768,268851.66764259338
273,Air purification and ventilation equipment manufacturing,74.524002075195312,23170543.670654297,6571399.6887207031,19772.997125983238,3401271.1048126221,384502.79831886292
274,Heating equipment (except warm air furnaces) manufacturing,0,0,0,0,0,0
275,"Air conditioning, refrigeration, and warm air heating equipment manufacturing",188.82289123535156,88915702.819824219,16911302.56652832,37921.879440546036,17472635.269165039,1607527.6136398315
276,Industrial mold manufacturing,0,0,0,0,0,0
277,"Special tool, die, jig, and fixture manufacturing",16.951301574707031,2717497.5872039795,902932.64389038086,20528.815686702728,351359.39717292786,48565.808683633804
278,Cutting tool and machine tool accessory manufacturing,8.6865110397338867,1942619.6813583374,866957.36646652222,5652.1585211157799,104136.25091314316,26517.352089285851
279,Machine tool manufacturing,14.295135498046875,3719774.0077972412,1308790.2069091797,11289.592832326889,199330.10637760162,53542.41281747818
280,Rolling mill and other metalworking machinery manufacturing,24.464000701904297,6986281.8717956543,2160805.2253723145,49161.814153194427,748704.07581329346,103609.68858003616
281,Turbine and turbine generator set units manufacturing,0,0,0,0,0,0
282,"Speed changer, industrial high-speed drive, and gear manufacturing",79.020454406738281,26119174.957275391,6998293.399810791,8097.0153212547302,4053356.1706542969,403674.69191551208
283,Mechanical power transmission equipment manufacturing,0,0,0,0,0,0
284,Other engine equipment manufacturing,0,0,0,0,0,0
285,Pump and pumping equipment manufacturing,28.128566741943359,13811786.651611328,2927328.8249969482,13450.560159981251,2675152.5402069092,225165.11380672455
286,Air and gas compressor manufacturing,0,0,0,0,0,0
287,Elevator and moving stairway manufacturing,8.3786478042602539,3605804.2049407959,513882.81583786011,4287.0761826634407,381338.59634399414,62608.666718006134
288,Conveyor and conveying equipment manufacturing,9.9371500015258789,2339200.9735107422,728132.12871551514,7328.9503343403339,21675.197407603264,44008.597731590271
289,"Overhead cranes, hoists, and monorail systems manufacturing",0,0,0,0,0,0
290,"Industrial truck, trailer, and stacker manufacturing",18.089740753173828,6765090.9423828125,1120258.4505081177,8080.3036689758301,729121.50621414185,128244.95136737824
291,Power-driven handtool manufacturing,0,0,0,0,0,0
292,Welding and soldering equipment manufacturing,0,0,0,0,0,0
293,Packaging machinery manufacturing,116.76049041748047,38229515.075683594,8519932.746887207,48857.800662517548,5592835.9031677246,650316.11919403076
294,Industrial process furnace and oven manufacturing,36.770431518554688,9388599.3957519531,2908175.2300262451,38143.802434206009,1013783.0972671509,147338.8671875
295,Fluid power cylinder and actuator manufacturing,0,0,0,0,0,0
296,Fluid power pump and motor manufacturing,80.451629638671875,38436695.098876953,10053065.299987793,13772.760517895222,6475748.0621337891,587557.79266357422
297,"Scales, balances, and miscellaneous general purpose machinery manufacturing",77.341041564941406,23510581.970214844,6347000.1220703125,13790.90640693903,2366443.6340332031,377302.28900909424
298,Electronic computer manufacturing,0,0,0,0,0,0
299,Computer storage device manufacturing,0,0,0,0,0,0
300,Computer terminals and other computer peripheral equipment manufacturing,152.93882751464844,88701499.938964844,18762447.357177734,-408171.20671272278,7179037.5709533691,1741608.5004806519
301,Telephone apparatus manufacturing,0,0,0,0,0,0
302,Broadcast and wireless communications equipment manufacturing,874.7696533203125,316519378.66210938,96892410.278320312,-656469.58351135254,21469831.466674805,5722632.4081420898
303,Other communications equipment manufacturing,4.5433049201965332,1298766.1361694336,261912.43529319763,-108530.48413991928,76591.894030570984,30233.213678002357
304,Audio and video equipment manufacturing,3.4338352680206299,1247823.95362854,40897.499769926071,-52501.700818538666,14730.138704180718,36165.721714496613
305,Printed circuit assembly (electronic assembly) manufacturing,3.201509952545166,800164.93797302246,48579.69656586647,-43516.635894775391,14117.549173533917,19670.478999614716
306,Bare printed circuit board manufacturing,1.2074621915817261,176608.69657993317,6651.017814874649,-12162.233702838421,1009.1646108776331,5313.6562928557396
307,Semiconductor and related device manufacturing,18.428192138671875,9295770.6451416016,1160753.3693313599,-223431.2891960144,436855.34596443176,244284.79373455048
308,"Capacitor, resistor, coil, transformer, and other inductor manufacturing",0,0,0,0,0,0
309,Electronic connector manufacturing,233.25167846679688,76351127.624511719,21591821.670532227,-130537.16719150543,4964415.5502319336,1313186.8839263916
310,Other electronic component manufacturing,51.802883148193359,11993573.188781738,3219079.0176391602,-225697.8303194046,178407.16242790222,222253.66532802582
311,Electromedical and electrotherapeutic apparatus manufacturing,3.6200966835021973,931698.62031936646,112596.97377681732,-253182.85822868347,63688.725233078003,37219.848483800888
312,"Search, detection, and navigation instruments manufacturing",2636.89013671875,1048360107.421875,327744201.66015625,-704196.92993164062,126636375.42724609,17573837.280273438
313,Automatic environmental control manufacturing,0,0,0,0,0,0
314,Industrial process variable instruments manufacturing,208.51972961425781,60043170.928955078,20045997.619628906,-433399.40905570984,4272681.713104248,1173957.9439163208
315,Totalizing fluid meter and counting device manufacturing,0,0,0,0,0,0
316,Electricity and signal testing instruments manufacturing,30.267084121704102,13411103.248596191,3890673.3989715576,-237494.69220638275,827561.67650222778,249031.55863285065
317,Analytical laboratory instrument manufacturing,0,0,0,0,0,0
318,Irradiation apparatus manufacturing,0,0,0,0,0,0
319,"Watch, clock, and other measuring and controlling device manufacturing",110.08265686035156,38670192.718505859,13265956.878662109,-73035.135865211487,5103994.3695068359,667149.48415756226
320,Blank magnetic and optical recording media manufacturing,0,0,0,0,0,0
321,Software and other prerecorded and record reproducing,0,0,0,0,0,0
322,Electric lamp bulb and part manufacturing,0,0,0,0,0,0
323,Lighting fixture manufacturing,50.431442260742188,15174230.575561523,4213020.8015441895,5582.6497264206409,169120.04351615906,288237.89954185486
324,Small electrical appliance manufacturing,0,0,0,0,0,0
325,Household cooking appliance manufacturing,0,0,0,0,0,0
326,Household refrigerator and home freezer manufacturing,0,0,0,0,0,0
327,Household laundry equipment manufacturing,0,0,0,0,0,0
328,Other major household appliance manufacturing,0,0,0,0,0,0
329,"Power, distribution, and specialty transformer manufacturing",3.3556201457977295,1031456.9473266602,222380.01227378845,1201.8439592793584,7620.1404444873333,21863.996982574463
330,Motor and generator manufacturing,137.97718811035156,43013065.338134766,7913975.715637207,-10325.951501727104,327303.91621589661,963723.30188751221
331,Switchgear and switchboard apparatus manufacturing,8.4354991912841797,2984800.3387451172,735078.39441299438,-830.88158862665296,33816.57600402832,61645.239591598511
332,Relay and industrial control manufacturing,386.15213012695312,103172195.43457031,21377153.396606445,-3819.307079538703,543572.48544692993,2391463.7565612793
333,Storage battery manufacturing,0,0,0,0,0,0
334,Primary battery manufacturing,0,0,0,0,0,0
335,Fiber optic cable manufacturing,11.93155574798584,6191614.6278381348,581109.40456390381,2402.5174789130688,22433.692589402199,113598.33180904388
336,Other communication and energy wire manufacturing,0,0,0,0,0,0
337,Wiring device manufacturing,934.53912353515625,370266540.52734375,126350372.31445313,-23894.390091300011,9705945.9686279297,5816988.468170166
338,Carbon and graphite product manufacturing,0,0,0,0,0,0
339,All other miscellaneous electrical equipment and component manufacturing,119.00879669189453,33350914.001464844,10537220.001220703,2943.9004138112068,117726.84007883072,571305.87100982666
340,Automobile manufacturing,0,0,0,0,0,0
341,Light truck and utility vehicle manufacturing,0,0,0,0,0,0
342,Heavy duty truck manufacturing,0,0,0,0,0,0
343,Motor vehicle body manufacturing,0,0,0,0,0,0
344,Truck trailer manufacturing,0,0,0,0,0,0
345,Motor home manufacturing,0,0,0,0,0,0
346,Travel trailer and camper manufacturing,0,0,0,0,0,0
347,Motor vehicle gasoline engine and engine parts manufacturing,5.4293704032897949,3024428.129196167,428225.15964508057,0,71937.970817089081,47108.806669712067
348,Motor vehicle electrical and electronic equipment manufacturing,19.133874893188477,9123659.1339111328,1234814.4054412842,0,224107.5336933136,163511.55936717987
349,Motor vehicle transmission and power train parts manufacturing,28.267030715942383,16880458.831787109,2466568.2315826416,0,503327.36968994141,262630.25403022766
350,Motor vehicle seating and interior trim manufacturing,0,0,0,0,0,0
351,Motor vehicle metal stamping,0,0,0,0,0,0
352,Other motor vehicle parts manufacturing,7.3611207008361816,4208795.0706481934,695354.58087921143,0,186859.53319072723,66178.120672702789
353,"Motor vehicle steering, suspension component (except spring), and brake systems manufacturing",0,0,0,0,0,0
354,Aircraft manufacturing,0,0,0,0,0,0
355,Aircraft engine and engine parts manufacturing,6.8742036819458008,6940578.4606933594,559952.13985443115,2551639.0800476074,905061.06615066528,46213.731169700623
356,Other aircraft parts and auxiliary equipment manufacturing,25.202384948730469,10224005.699157715,2374339.1036987305,1312438.7264251709,1589635.0145339966,95704.592764377594
357,Guided missile and space vehicle manufacturing,0,0,0,0,0,0
358,Propulsion units and parts for space vehicles and guided missiles manufacturing,0,0,0,0,0,0
359,Railroad rolling stock manufacturing,0,0,0,0,0,0
360,Ship building and repairing,0,0,0,0,0,0
361,Boat building,0,0,0,0,0,0
362,"Motorcycle, bicycle, and parts manufacturing",0,0,0,0,0,0
363,"Military armored vehicle, tank, and tank component manufacturing",0,0,0,0,0,0
364,All other transportation equipment manufacturing,0,0,0,0,0,0
365,Wood kitchen cabinet and countertop manufacturing,120.36840057373047,16902597.427368164,5601033.6875915527,406942.09933280945,1281221.1513519287,149943.26233863831
366,Upholstered household furniture manufacturing,0,0,0,0,0,0
367,Nonupholstered wood household furniture manufacturing,484.4566650390625,69508773.803710938,26705450.057983398,47874.867916107178,2346520.9007263184,563965.61861038208
368,Other household nonupholstered furniture manufacturing,12.817975997924805,3356638.6699676514,652922.92833328247,41631.478816270828,154084.48874950409,34172.635525465012
369,Institutional furniture manufacturing,26.838663101196289,5137451.171875,1353374.2427825928,122315.95069169998,56517.418473958969,51949.556916952133
370,Wood office furniture manufacturing,17.652233123779297,3554920.4349517822,689210.95132827759,42513.541877269745,162602.14149951935,39887.286722660065
371,Custom architectural woodwork and millwork,162.34429931640625,27144050.598144531,9944375.0381469727,292481.42242431641,-581427.45494842529,217127.51686573029
372,"Office furniture, except wood, manufacturing",0,0,0,0,0,0
373,"Showcase, partition, shelving, and locker manufacturing",26.70478630065918,4901305.1986694336,1012222.6476669312,202121.03426456451,221606.15026950836,49072.243273258209
374,Mattress manufacturing,28.817270278930664,9846515.6555175781,1328949.5706558228,24826.0498046875,798037.05215454102,95129.907131195068
375,Blind and shade manufacturing,0,0,0,0,0,0
376,Surgical and medical instrument manufacturing,1389.0555419921875,593162902.83203125,157735565.18554688,708661.67545318604,45499092.102050781,11767837.524414063
377,Surgical appliance and supplies manufacturing,26.805826187133789,9777296.0662841797,1569953.9184570313,770193.57681274414,465784.81793403625,213458.53805541992
378,Dental equipment and supplies manufacturing,0,0,0,0,0,0
379,Ophthalmic goods manufacturing,245.37260437011719,64746810.913085938,14771644.592285156,500016.27206802368,5063149.9290466309,1437806.4870834351
380,Dental laboratories,19.134195327758789,2380348.2055664062,991306.18572235107,710518.36013793945,-95903.873443603516,28643.859550356865
381,Jewelry and silverware manufacturing,59.970756530761719,9017945.2896118164,1952263.7128829956,80658.480525016785,311156.27288818359,451257.05003738403
382,Sporting and athletic goods manufacturing,28.541057586669922,6516398.4298706055,959221.72069549561,572820.12701034546,113540.61961174011,153935.16421318054
383,"Doll, toy, and game manufacturing",0,0,0,0,0,0
384,Office supplies (except paper) manufacturing,47.992401123046875,11071479.797363281,3065337.8963470459,447707.14640617371,314885.88452339172,166833.87756347656
385,Sign manufacturing,145.06547546386719,18304851.531982422,4467981.3385009766,5238672.2564697266,-1476055.6221008301,264786.2434387207
386,"Gasket, packing, and sealing device manufacturing",197.34605407714844,45092803.955078125,15164230.346679688,798018.57471466064,1351305.4847717285,769899.30868148804
387,Musical instrument manufacturing,11.904064178466797,1546284.556388855,430164.66498374939,288683.83169174194,-4119.320772588253,23696.12455368042
388,"Fasteners, buttons, needles, and pins manufacturing",0,0,0,0,0,0
389,"Broom, brush, and mop manufacturing",0,0,0,0,0,0
390,Burial casket manufacturing,0,0,0,0,0,0
391,All other miscellaneous manufacturing,243.81808471679688,43862522.125244141,13324835.777282715,5029881.477355957,599307.5966835022,659463.40560913086
392,Wholesale - Motor vehicle and motor vehicle parts and supplies,1016.55419921875,370500488.28125,60321781.158447266,2644646.167755127,76351615.905761719,23509176.254272461
393,Wholesale - Professional and commercial equipment and supplies,1196.5921630859375,384350250.24414062,114197181.70166016,3898593.1873321533,73790237.426757812,26226043.701171875
394,Wholesale - Household appliances and electrical and electronic goods,1034.0880126953125,517603027.34375,104209930.41992188,3601991.4150238037,128858169.55566406,31331037.521362305
395,"Wholesale - Machinery, equipment, and supplies",1552.74267578125,424829498.29101562,124896247.86376953,6154525.7568359375,87986518.859863281,31512964.248657227
396,Wholesale - Other durable goods merchant wholesalers,1950.8016357421875,500886077.88085938,157578536.98730469,6742610.9313964844,78181007.385253906,35281612.396240234
397,Wholesale - Drugs and druggists’ sundries,663.6488037109375,456862274.16992188,56234268.188476562,435708.07576179504,103516304.01611328,14563272.476196289
398,Wholesale - Grocery and related product wholesalers,2635.689208984375,541563781.73828125,207671432.49511719,2745798.5877990723,71233673.095703125,14312624.931335449
399,Wholesale - Petroleum and petroleum products,142.10765075683594,309714904.78515625,11025995.254516602,470937.8182888031,20869888.305664062,252351409.91210938
400,Wholesale - Other nondurable goods merchant wholesalers,1229.7733154296875,412779388.42773438,101668548.58398438,3484465.1222229004,66621520.99609375,72657897.94921875
401,Wholesale - Wholesale electronic markets and agents and brokers,870.62615966796875,45509590.148925781,77187301.635742188,9011128.4255981445,-48552310.943603516,745415.03190994263
402,Retail - Motor vehicle and parts dealers,1491.552001953125,209638473.51074219,83710266.11328125,3452675.3425598145,15469489.097595215,48419387.817382812
403,Retail - Furniture and home furnishings stores,992.7501220703125,95483596.801757812,39129955.291748047,1617610.3353500366,3257433.6528778076,16839088.439941406
404,Retail - Electronics and appliance stores,1296.2276611328125,125021697.99804688,66255226.135253906,3303265.8100128174,-13958595.275878906,22101095.199584961
405,Retail - Building material and garden equipment and supplies stores,2385.902099609375,289611785.88867188,98916061.401367188,2283654.9282073975,35004276.275634766,69688896.179199219
406,Retail - Food and beverage stores,6402.759765625,467462890.625,174883087.15820313,8259342.1936035156,29949682.235717773,70756996.154785156
407,Retail - Health and personal care stores,2345.989013671875,200045898.4375,93863670.349121094,12045613.288879395,7640609.2643737793,20535127.639770508
408,Retail - Gasoline stores,844.53515625,102198883.05664063,23971731.185913086,4957310.676574707,5610098.3619689941,25036327.362060547
409,Retail - Clothing and clothing accessories stores,2685.375244140625,226603134.15527344,49356243.133544922,2595936.7752075195,9358285.9039306641,45659427.642822266
410,"Retail - Sporting goods, hobby, musical instrument and book stores",1458.3551025390625,85773536.682128906,31766160.96496582,4345427.5131225586,3133858.9191436768,14830011.367797852
411,Retail - General merchandise stores,4251.119140625,321686157.2265625,118362632.75146484,280658.18548202515,9283235.5499267578,78155967.712402344
412,Retail - Miscellaneous store retailers,2407.5888671875,134384628.29589844,44940547.943115234,26794775.009155273,-4692357.5401306152,22821193.695068359
413,Retail - Nonstore retailers,1914.1397705078125,270816772.4609375,31204587.936401367,8496493.3395385742,62454013.824462891,31201744.079589844
414,Air transportation,94.681915283203125,31554187.774658203,5671350.0022888184,4664974.6894836426,4324657.9170227051,4718756.1988830566
415,Rail transportation,277.52188110351562,120424850.46386719,41033908.843994141,0,49502544.403076172,-24570369.720458984
416,Water transportation,2.4509108066558838,1763132.9298019409,0,-2188775.7778167725,0,68553.946912288666
417,Truck transportation,3181.454345703125,557082641.6015625,225157989.50195313,6861094.4747924805,28555398.941040039,14043328.285217285
418,Transit and ground passenger transportation,2195.612548828125,114041755.67626953,33613025.665283203,33779861.450195312,12081684.112548828,2610275.7453918457
419,Pipeline transportation,86.126449584960938,34287128.448486328,9647794.7235107422,631192.08812713623,-1697785.7351303101,14198607.444763184
420,Scenic and sightseeing transportation and support activities for transportation,739.86822509765625,111194572.44873047,42857563.018798828,868673.86102676392,3743895.2922821045,2872799.1580963135
421,Couriers and messengers,2205.9462890625,263335205.078125,114831878.66210938,1628996.8490600586,37651931.762695312,4128301.1436462402
422,Warehousing and storage,2255.14208984375,284024291.9921875,130639556.88476563,-1322452.0683288574,18772438.049316406,3599668.9796447754
423,Newspaper publishers,289.8414306640625,43474754.333496094,18964973.449707031,154540.35997390747,15112927.436828613,942136.28768920898
424,Periodical publishers,40.818252563476562,6509723.6633300781,1958399.1765975952,68443.10462474823,1155002.1171569824,218561.50031089783
425,Book publishers,30.165327072143555,11380743.026733398,1378490.5672073364,17393.356189131737,3777627.4681091309,383271.18754386902
426,"Directory, mailing list, and other publishers",28.278274536132812,5866774.5590209961,722839.77270126343,40447.14942574501,1931686.282157898,252440.98901748657
427,Greeting card publishing,0,0,0,0,0,0
428,Software publishers,173.430908203125,44409511.566162109,9771835.3271484375,454305.82761764526,19644584.655761719,2823193.3116912842
429,Motion picture and video industries,432.726806640625,81119277.954101562,8621858.5968017578,2040445.08934021,8455449.104309082,8575557.7087402344
430,Sound recording industries,6.2437338829040527,2241859.6744537354,99015.973508358002,27977.051213383675,691185.5936050415,631981.84967041016
431,Radio and television broadcasting,613.15008544921875,194001892.08984375,36852210.998535156,25375696.182250977,-12821455.955505371,4079229.3548583984
432,Cable and other subscription programming,0,0,0,0,0,0
433,Wired telecommunications carriers,1790.7596435546875,1000964050.2929688,174077438.35449219,109155.00670671463,310536346.43554688,71558502.197265625
434,Wireless telecommunications carriers (except satellite),55.953289031982422,110709823.60839844,4623001.0986328125,28365.658596158028,45648765.563964844,5138453.0067443848
435,"Satellite, telecommunications resellers, and all other telecommunications",46.696102142333984,15338615.417480469,2981982.7079772949,20662.471652030945,1640633.225440979,899125.81443786621
436,"Data processing, hosting, and related services",398.22650146484375,143586608.88671875,20790872.573852539,2345824.2416381836,25392501.831054688,3824236.3929748535
437,"News syndicates, libraries, archives and all other information services",229.375732421875,26318319.320678711,5622138.0233764648,419445.24645805359,4201502.799987793,683692.39568710327
438,Internet publishing and broadcasting and web search portals,265.388916015625,199926544.18945313,14316892.623901367,159191.5637254715,28589229.583740234,4133544.921875
439,Nondepository credit intermediation and related activities,883.9268798828125,206243820.19042969,57947978.973388672,3627412.0807647705,62071468.353271484,11269322.395324707
440,Securities and commodity contracts intermediation and brokerage,1006.839599609375,222163726.80664063,83714271.545410156,5705688.4765625,-3163431.8828582764,5485012.5312805176
441,Monetary authorities and depository credit intermediation,2314.9833984375,1298972900.390625,148787445.06835938,751741.64772033691,765302246.09375,38927299.499511719
442,Other financial investment activities,5308.90283203125,507871673.58398438,29305677.41394043,31443353.652954102,2420796.3943481445,19432716.369628906
443,Direct life insurance carriers,845.32135009765625,302335876.46484375,96000953.674316406,4672.3941341042519,91800659.1796875,16277288.436889648
444,"Insurance carriers, except direct life",2645.1484375,2007710571.2890625,271383178.7109375,199171.54312133789,639484191.89453125,84504692.077636719
445,"Insurance agencies, brokerages, and related activities",2849.25537109375,750831665.0390625,215242630.00488281,2994064.8078918457,149150100.70800781,4262019.6342468262
446,"Funds, trusts, and other financial vehicles",1043.6800537109375,341066650.390625,30461254.119873047,3155843.0194854736,25849296.569824219,3898311.8534088135
447,Other real estate,7463.2119140625,1293323120.1171875,92719329.833984375,170964248.65722656,142023361.20605469,28019006.729125977
448,Tenant-occupied housing,3088.462158203125,631558288.57421875,28601350.784301758,60675910.949707031,313827667.23632812,104769882.20214844
449,Owner-occupied dwellings,0,2572693115.234375,0,0,1743673461.9140625,292509399.4140625
