Industry Detail ,,,,,,,
IndustryCode,Description,Employment,Output,EmployeeCompensation,ProprietorIncome,OtherPropertyTypeIncome,TaxOnProductionAndImports
0,Total,43367.992944724858,7238945527.6154909,1948077621.7031817,322525931.8625322,1034787404.2217736,697909885.36484277
1,Oilseed farming,0.022353716194629669,105931.21498823166,365.81201129592955,103811.50245666504,-3075.8378561586142,-1248.2274323701859
2,Grain farming,78.06158447265625,35060100.555419922,3807145.1187133789,12379901.885986328,4182670.1164245605,-14622760.772705078
3,Vegetable and melon farming,1473.507568359375,182771316.52832031,51181518.5546875,24314117.431640625,15238418.579101563,31510.356813669205
4,Fruit farming,1364.6884765625,175307342.52929688,33637123.107910156,32859905.242919922,31230606.079101562,37383.124232292175
5,Tree nut farming,1.557409405708313,84050.931036472321,54545.305669307709,9790.0154069066048,15436.184592545033,35.737171856453642
6,"Greenhouse, nursery, and floriculture production",30.012392044067383,3911228.6567687988,1352206.7070007324,315320.99843025208,731917.6197052002,373.21628769859672
7,Tobacco farming,0,0,0,0,0,0
8,Cotton farming,0,0,0,0,0,0
9,Sugarcane and sugar beet farming,0.87116038799285889,91318.383812904358,55266.808718442917,30451.824888586998,-20499.110221862793,-1392.4204977229238
10,All other crop farming,1079.5616455078125,69294555.6640625,25437484.741210938,10953532.218933106,7649825.5729675293,-1089603.4240722656
11,"Beef cattle ranching and farming, including feedlots and dual-purpose ranching and farming",68.29351806640625,52362823.486328125,907546.2818145752,11327305.793762207,7631700.5157470703,2477711.4391326904
12,Dairy cattle and milk production,114.68589782714844,89829895.01953125,4041800.4989624023,6327631.4735412598,6278131.0081481934,337134.68909263611
13,Poultry and egg production,6.2775030136108398,6982365.1313781738,459397.28617668152,70508.256554603577,271104.81262207031,218204.84101772308
14,"Animal production, except cattle and poultry and eggs",5.1537384986877441,2305435.6575012207,226578.41444015503,1124918.3416366577,695216.05968475342,145729.30335998535
15,"Forestry, forest products, and timber tract production",1.7636086940765381,187841.54951572418,149937.89792060852,0,-544.87015586346388,4044.8424406349659
16,Commercial logging,41.847164154052734,12157649.040222168,160971.87995910645,10480343.818664551,-10605.095885694027,124844.37972307205
17,Commercial fishing,0,0,0,0,0,0
18,Commercial hunting and trapping,7.2017922401428223,2506880.0449371338,0,2318277.12059021,0,72874.106466770172
19,Support activities for agriculture and forestry,2447.732666015625,97801696.77734375,90225540.161132812,5300467.0143127441,-19305330.276489258,3142441.987991333
20,Oil and gas extraction,0,0,0,0,0,0
21,Coal mining,0,0,0,0,0,0
22,"Copper, nickel, lead, and zinc mining",0,0,0,0,0,0
23,Iron ore mining,0,0,0,0,0,0
24,Gold ore mining,0,0,0,0,0,0
25,Silver ore mining,0,0,0,0,0,0
26,Uranium-radium-vanadium ore mining,0,0,0,0,0,0
27,Other metal ore mining,0,0,0,0,0,0
28,Stone mining and quarrying,0,0,0,0,0,0
29,Sand and gravel mining,59.106807708740234,8759113.3117675781,3493544.1017150879,580.19766584038734,-36509.495228528976,389637.44044303894
30,"Other clay, ceramic, refractory minerals mining",0,0,0,0,0,0
31,"Potash, soda, and borate mineral mining",0,0,0,0,0,0
32,Phosphate rock mining,0,0,0,0,0,0
33,Other chemical and fertilizer mineral mining,0,0,0,0,0,0
34,Other nonmetallic minerals,0,0,0,0,0,0
35,Drilling oil and gas wells,9.7889537811279297,3098269.4625854492,820072.82972335815,0,-6032.2466306388378,45974.951237440109
36,Support activities for oil and gas operations,17.811246871948242,4680910.587310791,1644230.1273345947,0,-8849.9002158641815,63952.155411243439
37,Metal mining services,0,0,0,0,0,0
38,Other nonmetallic minerals services,0,0,0,0,0,0
39,Electric power generation - Hydroelectric,0,0,0,0,0,0
40,Electric power generation - Fossil fuel,0,0,0,0,0,0
41,Electric power generation - Nuclear,0,0,0,0,0,0
42,Electric power generation - Solar,0,0,0,0,0,0
43,Electric power generation - Wind,0,0,0,0,0,0
44,Electric power generation - Geothermal,0,0,0,0,0,0
45,Electric power generation - Biomass,0,0,0,0,0,0
46,Electric power generation - All other,0,0,0,0,0,0
47,Electric power transmission and distribution,7.3511562347412109,9963767.0516967773,333717.55480766296,-33.712734875734895,1294036.7460250855,2573139.6675109863
48,Natural gas distribution,0,0,0,0,0,0
49,"Water, sewage and other systems",8.4515218734741211,1441770.6727981567,36183.636635541916,-67.286870034877211,63881.173729896545,374634.56392288208
50,Construction of new health care structures,72.040489196777344,10968253.135681152,3270414.1139984131,1072275.9962081909,2026194.8108673096,164256.11078739166
51,Construction of new manufacturing structures,118.93442535400391,17844131.469726562,5551033.4968566895,1688273.3106613159,1979254.6033859253,246350.49700737
52,Construction of new power and communication structures,166.10401916503906,29817607.879638672,7708656.3110351562,2403376.1024475098,7178863.0485534668,506539.34478759766
53,Construction of new educational and vocational structures,217.74430847167969,30024885.177612305,11303547.859191895,2253184.3185424805,5160495.7580566406,394966.81094169617
54,Construction of new highways and streets,150.94601440429688,31874101.638793945,7588190.5555725098,2103290.7962799072,7241977.6916503906,444470.34597396851
55,"Construction of new commercial structures, including farm structures",284.26910400390625,36674793.243408203,12750480.651855469,4182096.9581604004,2966702.2228240967,800232.88726806641
56,Construction of other new nonresidential structures,376.84979248046875,31376138.687133789,17177732.467651367,5901762.0086669922,-9452272.4151611328,531953.87125015259
57,Construction of new single-family residential structures,452.49185180664062,66974761.962890625,20373180.389404297,6907450.6759643555,11741280.555725098,1143978.476524353
58,Construction of new multifamily residential structures,140.40573120117188,15802397.727966309,6363593.1015014648,2138987.7796173096,3726958.5132598877,234985.48567295075
59,Construction of other new residential structures,322.76470947265625,65733894.348144531,14926129.341125488,4722791.1949157715,9729578.0181884766,1543714.4041061401
60,Maintenance and repair construction of nonresidential structures,217.12425231933594,44394496.917724609,9989232.063293457,3259493.350982666,5265936.3746643066,999097.88370132446
61,Maintenance and repair construction of residential structures,102.81224822998047,22176511.764526367,4512620.4490661621,1523107.1710586548,2943295.2404022217,903992.4144744873
62,"Maintenance and repair construction of highways, streets, bridges, and tunnels",79.578498840332031,7829821.1097717285,3728352.5466918945,1166657.6862335205,-1652084.4697952271,202318.74287128449
63,Dog and cat food manufacturing,0,0,0,0,0,0
64,Other animal food manufacturing,39.249649047851562,40520668.029785156,2793077.9457092285,-7875.087670981884,1721555.8290481567,1017443.5377120972
65,Flour milling,0,0,0,0,0,0
66,Rice milling,0,0,0,0,0,0
67,Malt manufacturing,0,0,0,0,0,0
68,Wet corn milling,0,0,0,0,0,0
69,Soybean and other oilseed processing,0,0,0,0,0,0
70,Fats and oils refining and blending,0,0,0,0,0,0
71,Breakfast cereal manufacturing,0,0,0,0,0,0
72,Beet sugar manufacturing,0,0,0,0,0,0
73,Sugar cane mills and refining,0,0,0,0,0,0
74,Nonchocolate confectionery manufacturing,0,0,0,0,0,0
75,Chocolate and confectionery manufacturing from cacao beans,0,0,0,0,0,0
76,Confectionery manufacturing from purchased chocolate,0,0,0,0,0,0
77,"Frozen fruits, juices and vegetables manufacturing",1781.4361572265625,782675415.0390625,98025520.324707031,-124590.83646535873,76151931.762695312,4420884.6092224121
78,Frozen specialties manufacturing,185.64231872558594,70025802.612304688,10833262.443542481,0,5142885.684967041,300033.65874290466
79,Canned fruits and vegetables manufacturing,4.7132105827331543,2077958.8222503662,153585.68727970123,-29338.428750634193,113779.48522567749,10668.888688087463
80,Canned specialties,0,0,0,0,0,0
81,Dehydrated food products manufacturing,254.2557373046875,111382095.33691406,14180740.356445313,-21840.387955307961,11049972.534179688,563594.69890594482
82,Cheese manufacturing,0,0,0,0,0,0
83,"Dry, condensed, and evaporated dairy product manufacturing",0,0,0,0,0,0
84,Fluid milk manufacturing,0,0,0,0,0,0
85,Creamery butter manufacturing,0,0,0,0,0,0
86,Ice cream and frozen dessert manufacturing,0,0,0,0,0,0
87,Frozen cakes and other pastries manufacturing,39.133129119873047,3729282.8559875488,1311112.9999160767,42491.551488637924,152095.60096263886,657043.57624053955
88,Poultry processing,0,0,0,0,0,0
89,"Animal, except poultry, slaughtering",4.3513789176940918,2851405.3821563721,179569.27418708801,-30443.31818819046,57727.46354341507,20278.798416256905
90,Meat processed from carcasses,1.4087616205215454,717264.53304290771,72058.126330375671,0,6372.2454942762852,4746.9502314925194
91,Rendering and meat byproduct processing,1.4105222225189209,510131.3591003418,72105.012834072113,0,8535.8880460262299,6911.0705517232418
92,Seafood product preparation and packaging,0,0,0,0,0,0
93,"Bread and bakery product, except frozen, manufacturing",43.537799835205078,5649424.5529174805,1374047.8754043579,2904.5783448964357,315358.16192626953,325772.85170555115
94,Cookie and cracker manufacturing,0,0,0,0,0,0
95,"Dry pasta, mixes, and dough manufacturing",0,0,0,0,0,0
96,Tortilla manufacturing,8.7690582275390625,1675903.2011032105,228279.59060668945,-2495.7454297691584,43955.087661743164,11892.269365489483
97,Roasted nuts and peanut butter manufacturing,53.440792083740234,25509382.247924805,3523251.2950897217,-2206.7476529628038,3839305.4008483887,120743.22998523712
98,Other snack food manufacturing,1.8569384813308716,1030480.6232452393,162002.3250579834,0,146687.23940849304,5984.8246164619923
99,Coffee and tea manufacturing,0,0,0,0,0,0
100,Flavoring syrup and concentrate manufacturing,0,0,0,0,0,0
101,"Mayonnaise, dressing, and sauce manufacturing",51.118831634521484,28762941.360473633,3399485.8264923096,-2500.4020426422358,2878886.4612579346,157496.88446521759
102,Spice and extract manufacturing,0,0,0,0,0,0
103,All other food manufacturing,156.26145935058594,54793437.957763672,8431221.0083007812,-16443.582251667976,2772259.4738006592,269461.60197257996
104,Bottled and canned soft drinks & water,0,0,0,0,0,0
105,Manufactured ice,0,0,0,0,0,0
106,Breweries,0,0,0,0,0,0
107,Wineries,23.079723358154297,7310693.2640075684,889768.95809173584,61168.603599071503,544211.08961105347,214191.0046339035
108,Distilleries,0,0,0,0,0,0
109,Tobacco product manufacturing,0,0,0,0,0,0
110,"Fiber, yarn, and thread mills",0,0,0,0,0,0
111,Broadwoven fabric mills,0.46140196919441223,101536.16964817047,0,-552469.96879577637,0,1225.1230655238032
112,Narrow fabric mills and schiffli machine embroidery,0,0,0,0,0,0
113,Nonwoven fabric mills,0,0,0,0,0,0
114,Knit fabric mills,0,0,0,0,0,0
115,Textile and fabric finishing mills,0,0,0,0,0,0
116,Fabric coating mills,0,0,0,0,0,0
117,Carpet and rug mills,0,0,0,0,0,0
118,Curtain and linen mills,0,0,0,0,0,0
119,Textile bag and canvas mills,0,0,0,0,0,0
120,"Rope, cordage, twine, tire cord and tire fabric mills",0,0,0,0,0,0
121,Other textile product mills,2.0837976932525635,289771.22902870178,84797.784686088562,0,7785.48838570714,3327.9191702604294
122,Hosiery and sock mills,0,0,0,0,0,0
123,Other apparel knitting mills,0,0,0,0,0,0
124,Cut and sew apparel contractors,0.67631888389587402,38619.805127382278,0,-388602.43558883667,0,1550.4328766837716
125,Mens and boys cut and sew apparel manufacturing,0,0,0,0,0,0
126,Womens and girls cut and sew apparel manufacturing,0,0,0,0,0,0
127,Other cut and sew apparel manufacturing,0,0,0,0,0,0
128,Apparel accessories and other apparel manufacturing,0,0,0,0,0,0
129,Leather and hide tanning and finishing,0,0,0,0,0,0
130,Footwear manufacturing,0,0,0,0,0,0
131,Other leather and allied product manufacturing,0.85557413101196289,66010.922193527222,0,-474276.48305892944,0,676.21556809172034
132,Sawmills,0,0,0,0,0,0
133,Wood preservation,0,0,0,0,0,0
134,Veneer and plywood manufacturing,0,0,0,0,0,0
135,Engineered wood member and truss manufacturing,0,0,0,0,0,0
136,Reconstituted wood product manufacturing,0,0,0,0,0,0
137,Wood windows and door manufacturing,11.959212303161621,2394637.1078491211,417907.02939033508,25019.120424985886,144826.11417770386,24557.612836360931
138,"Cut stock, resawing lumber, and planing",0,0,0,0,0,0
139,"Other millwork, including flooring",0,0,0,0,0,0
140,Wood container and pallet manufacturing,37.140174865722656,5471621.036529541,1452167.1533584595,76435.402035713196,281070.64962387085,50015.140324831009
141,Manufactured home (mobile home) manufacturing,0.71529906988143921,173172.33979701996,8571.7895999550819,41404.865682125092,5794.3831197917461,1813.2099648937583
142,Prefabricated wood building manufacturing,0,0,0,0,0,0
143,All other miscellaneous wood product manufacturing,0,0,0,0,0,0
144,Pulp mills,0,0,0,0,0,0
145,Paper mills,0,0,0,0,0,0
146,Paperboard mills,0,0,0,0,0,0
147,Paperboard container manufacturing,0,0,0,0,0,0
148,Paper bag and coated and treated paper manufacturing,0,0,0,0,0,0
149,Stationery product manufacturing,0,0,0,0,0,0
150,Sanitary paper product manufacturing,0,0,0,0,0,0
151,All other converted paper product manufacturing,44.432258605957031,14385037.422180176,3180583.2386016846,0,916347.9208946228,154174.29804801941
152,Printing,14.326900482177734,1761506.3190460205,318659.30557250977,83287.589251995087,92352.218925952911,24937.732145190239
153,Support activities for printing,0,0,0,0,0,0
154,Petroleum refineries,0,0,0,0,0,0
155,Asphalt paving mixture and block manufacturing,0,0,0,0,0,0
156,Asphalt shingle and coating materials manufacturing,0,0,0,0,0,0
157,Petroleum lubricating oil and grease manufacturing,0,0,0,0,0,0
158,All other petroleum and coal products manufacturing,0,0,0,0,0,0
159,Petrochemical manufacturing,0,0,0,0,0,0
160,Industrial gas manufacturing,0,0,0,0,0,0
161,Synthetic dye and pigment manufacturing,0,0,0,0,0,0
162,Other basic inorganic chemical manufacturing,0,0,0,0,0,0
163,Other basic organic chemical manufacturing,0,0,0,0,0,0
164,Plastics material and resin manufacturing,0,0,0,0,0,0
165,Synthetic rubber manufacturing,0,0,0,0,0,0
166,Artificial and synthetic fibers and filaments manufacturing,0,0,0,0,0,0
167,Nitrogenous fertilizer manufacturing,6.3325247764587402,5697270.393371582,317240.95344543457,0,505359.4708442688,98543.807864189148
168,Phosphatic fertilizer manufacturing,0,0,0,0,0,0
169,Fertilizer mixing,2.4155433177947998,1324085.8316421509,134289.42859172821,0,177745.05913257599,20455.863326787949
170,Pesticide and other agricultural chemical manufacturing,0,0,0,0,0,0
171,Medicinal and botanical manufacturing,0,0,0,0,0,0
172,Pharmaceutical preparation manufacturing,0,0,0,0,0,0
173,In-vitro diagnostic substance manufacturing,0,0,0,0,0,0
174,Biological product (except diagnostic) manufacturing,0,0,0,0,0,0
175,Paint and coating manufacturing,0,0,0,0,0,0
176,Adhesive manufacturing,0,0,0,0,0,0
177,Soap and other detergent manufacturing,0,0,0,0,0,0
178,Polish and other sanitation good manufacturing,0,0,0,0,0,0
179,Surface active agent manufacturing,0,0,0,0,0,0
180,Toilet preparation manufacturing,0,0,0,0,0,0
181,Printing ink manufacturing,0,0,0,0,0,0
182,Explosives manufacturing,0,0,0,0,0,0
183,Custom compounding of purchased resins,0,0,0,0,0,0
184,Photographic film and chemical manufacturing,0,0,0,0,0,0
185,Other miscellaneous chemical product manufacturing,0,0,0,0,0,0
186,Plastics packaging materials and unlaminated film and sheet manufacturing,0,0,0,0,0,0
187,Unlaminated plastics profile shape manufacturing,0,0,0,0,0,0
188,Plastics pipe and pipe fitting manufacturing,0,0,0,0,0,0
189,"Laminated plastics plate, sheet (except packaging), and shape manufacturing",0,0,0,0,0,0
190,Polystyrene foam product manufacturing,0,0,0,0,0,0
191,Urethane and other foam product (except polystyrene) manufacturing,0,0,0,0,0,0
192,Plastics bottle manufacturing,0,0,0,0,0,0
193,Other plastics product manufacturing,0,0,0,0,0,0
194,Tire manufacturing,95.916122436523438,35088600.158691406,5916000.3662109375,0,1288681.2686920166,338469.26689147949
195,Rubber and plastics hoses and belting manufacturing,0,0,0,0,0,0
196,Other rubber product manufacturing,0,0,0,0,0,0
197,"Pottery, ceramics, and plumbing fixture manufacturing",0,0,0,0,0,0
198,"Brick, tile, and other structural clay product manufacturing",0,0,0,0,0,0
199,Flat glass manufacturing,0,0,0,0,0,0
200,Other pressed and blown glass and glassware manufacturing,0,0,0,0,0,0
201,Glass container manufacturing,0,0,0,0,0,0
202,Glass product manufacturing made of purchased glass,0,0,0,0,0,0
203,Cement manufacturing,74.742362976074219,48392322.540283203,6471667.7665710449,0,9281611.442565918,539138.85354995728
204,Ready-mix concrete manufacturing,80.512161254882812,31698232.650756836,5186512.4702453613,0,3564093.1129455566,324169.39735412598
205,Concrete block and brick manufacturing,0,0,0,0,0,0
206,Concrete pipe manufacturing,0,0,0,0,0,0
207,Other concrete product manufacturing,0,0,0,0,0,0
208,Lime manufacturing,0,0,0,0,0,0
209,Gypsum product manufacturing,0,0,0,0,0,0
210,Abrasive product manufacturing,0,0,0,0,0,0
211,Cut stone and stone product manufacturing,0,0,0,0,0,0
212,Ground or treated mineral and earth manufacturing,0,0,0,0,0,0
213,Mineral wool manufacturing,0,0,0,0,0,0
214,Miscellaneous nonmetallic mineral products manufacturing,0,0,0,0,0,0
215,Iron and steel mills and ferroalloy manufacturing,0.57461053133010864,413860.32104492188,0,-44107.172638177872,0,7500.2294033765793
216,"Iron, steel pipe and tube manufacturing from purchased steel",0,0,0,0,0,0
217,Rolled steel shape manufacturing,0,0,0,0,0,0
218,Steel wire drawing,0,0,0,0,0,0
219,Alumina refining and primary aluminum production,0,0,0,0,0,0
220,Secondary smelting and alloying of aluminum,0,0,0,0,0,0
221,"Aluminum sheet, plate, and foil manufacturing",0,0,0,0,0,0
222,"Other aluminum rolling, drawing and extruding",0,0,0,0,0,0
223,Nonferrous metal (exc aluminum) smelting and refining,0,0,0,0,0,0
224,"Copper rolling, drawing, extruding and alloying",0,0,0,0,0,0
225,"Nonferrous metal, except copper and aluminum, shaping",0,0,0,0,0,0
226,Secondary processing of other nonferrous metals,0,0,0,0,0,0
227,Ferrous metal foundries,0,0,0,0,0,0
228,Nonferrous metal foundries,0,0,0,0,0,0
229,Custom roll forming,0,0,0,0,0,0
230,Crown and closure manufacturing and metal stamping,0,0,0,0,0,0
231,Iron and steel forging,0,0,0,0,0,0
232,Nonferrous forging,0,0,0,0,0,0
233,"Cutlery, utensil, pot, and pan manufacturing",0,0,0,0,0,0
234,Handtool manufacturing,0,0,0,0,0,0
235,Prefabricated metal buildings and components manufacturing,0,0,0,0,0,0
236,Fabricated structural metal manufacturing,36.583816528320312,11739636.421203613,2436123.3711242676,0,1424223.0653762817,112965.92652797699
237,Plate work manufacturing,0,0,0,0,0,0
238,Metal window and door manufacturing,0,0,0,0,0,0
239,Sheet metal work manufacturing,0,0,0,0,0,0
240,Ornamental and architectural metal work manufacturing,0,0,0,0,0,0
241,Power boiler and heat exchanger manufacturing,0,0,0,0,0,0
242,Metal tank (heavy gauge) manufacturing,0,0,0,0,0,0
243,Metal cans manufacturing,0,0,0,0,0,0
244,"Metal barrels, drums and pails manufacturing",0,0,0,0,0,0
245,Hardware manufacturing,0,0,0,0,0,0
246,Spring and wire product manufacturing,0,0,0,0,0,0
247,Machine shops,27.31688117980957,4031412.1246337891,1697390.3179168701,0,304304.24213409424,35336.878150701523
248,"Turned product and screw, nut, and bolt manufacturing",0,0,0,0,0,0
249,Metal heat treating,0,0,0,0,0,0
250,Metal coating and nonprecious engraving,11.011621475219727,2650973.5584259033,566311.18059158325,0,528988.89780044556,24278.206750750542
251,"Electroplating, anodizing, and coloring metal",0,0,0,0,0,0
252,"Valve and fittings, other than plumbing, manufacturing",0,0,0,0,0,0
253,Plumbing fixture fitting and trim manufacturing,0,0,0,0,0,0
254,Ball and roller bearing manufacturing,0,0,0,0,0,0
255,Small arms ammunition manufacturing,0,0,0,0,0,0
256,"Ammunition, except for small arms, manufacturing",0,0,0,0,0,0
257,"Small arms, ordnance, and accessories manufacturing",0,0,0,0,0,0
258,Fabricated pipe and pipe fitting manufacturing,0,0,0,0,0,0
259,Other fabricated metal manufacturing,6.0619049072265625,1351001.6202926636,367463.43970298767,0,149158.99932384491,13750.913552939892
260,Farm machinery and equipment manufacturing,6.8243827819824219,3103219.5091247559,710218.66798400879,0,139052.98709869385,31251.106411218643
261,Lawn and garden equipment manufacturing,0,0,0,0,0,0
262,Construction machinery manufacturing,0,0,0,0,0,0
263,Mining machinery and equipment manufacturing,0,0,0,0,0,0
264,Oil and gas field machinery and equipment manufacturing,0,0,0,0,0,0
265,Semiconductor machinery manufacturing,0,0,0,0,0,0
266,Food product machinery manufacturing,0,0,0,0,0,0
267,"Sawmill, woodworking, and paper machinery",0,0,0,0,0,0
268,Printing machinery and equipment manufacturing,0,0,0,0,0,0
269,All other industrial machinery manufacturing,0,0,0,0,0,0
270,Optical instrument and lens manufacturing,0,0,0,0,0,0
271,Photographic and photocopying equipment manufacturing,0,0,0,0,0,0
272,Other commercial service industry machinery manufacturing,0,0,0,0,0,0
273,Air purification and ventilation equipment manufacturing,0,0,0,0,0,0
274,Heating equipment (except warm air furnaces) manufacturing,0,0,0,0,0,0
275,"Air conditioning, refrigeration, and warm air heating equipment manufacturing",0,0,0,0,0,0
276,Industrial mold manufacturing,0,0,0,0,0,0
277,"Special tool, die, jig, and fixture manufacturing",0,0,0,0,0,0
278,Cutting tool and machine tool accessory manufacturing,0,0,0,0,0,0
279,Machine tool manufacturing,0,0,0,0,0,0
280,Rolling mill and other metalworking machinery manufacturing,0,0,0,0,0,0
281,Turbine and turbine generator set units manufacturing,0,0,0,0,0,0
282,"Speed changer, industrial high-speed drive, and gear manufacturing",0,0,0,0,0,0
283,Mechanical power transmission equipment manufacturing,0,0,0,0,0,0
284,Other engine equipment manufacturing,0,0,0,0,0,0
285,Pump and pumping equipment manufacturing,0,0,0,0,0,0
286,Air and gas compressor manufacturing,0,0,0,0,0,0
287,Elevator and moving stairway manufacturing,0,0,0,0,0,0
288,Conveyor and conveying equipment manufacturing,0,0,0,0,0,0
289,"Overhead cranes, hoists, and monorail systems manufacturing",0,0,0,0,0,0
290,"Industrial truck, trailer, and stacker manufacturing",0,0,0,0,0,0
291,Power-driven handtool manufacturing,0,0,0,0,0,0
292,Welding and soldering equipment manufacturing,0,0,0,0,0,0
293,Packaging machinery manufacturing,14.335931777954102,4836663.2461547852,1497656.5837860107,0,421853.66153717041,41927.37489938736
294,Industrial process furnace and oven manufacturing,0,0,0,0,0,0
295,Fluid power cylinder and actuator manufacturing,0,0,0,0,0,0
296,Fluid power pump and motor manufacturing,0,0,0,0,0,0
297,"Scales, balances, and miscellaneous general purpose machinery manufacturing",0,0,0,0,0,0
298,Electronic computer manufacturing,0,0,0,0,0,0
299,Computer storage device manufacturing,0,0,0,0,0,0
300,Computer terminals and other computer peripheral equipment manufacturing,0,0,0,0,0,0
301,Telephone apparatus manufacturing,0,0,0,0,0,0
302,Broadcast and wireless communications equipment manufacturing,0,0,0,0,0,0
303,Other communications equipment manufacturing,0,0,0,0,0,0
304,Audio and video equipment manufacturing,0,0,0,0,0,0
305,Printed circuit assembly (electronic assembly) manufacturing,0,0,0,0,0,0
306,Bare printed circuit board manufacturing,0,0,0,0,0,0
307,Semiconductor and related device manufacturing,0,0,0,0,0,0
308,"Capacitor, resistor, coil, transformer, and other inductor manufacturing",0,0,0,0,0,0
309,Electronic connector manufacturing,16.089750289916992,4505710.1249694824,960580.46817779541,-241878.79264354706,379149.19853210449,54576.043039560318
310,Other electronic component manufacturing,0,0,0,0,0,0
311,Electromedical and electrotherapeutic apparatus manufacturing,0,0,0,0,0,0
312,"Search, detection, and navigation instruments manufacturing",0,0,0,0,0,0
313,Automatic environmental control manufacturing,0,0,0,0,0,0
314,Industrial process variable instruments manufacturing,0,0,0,0,0,0
315,Totalizing fluid meter and counting device manufacturing,0,0,0,0,0,0
316,Electricity and signal testing instruments manufacturing,0,0,0,0,0,0
317,Analytical laboratory instrument manufacturing,0,0,0,0,0,0
318,Irradiation apparatus manufacturing,0,0,0,0,0,0
319,"Watch, clock, and other measuring and controlling device manufacturing",58.805397033691406,18725364.685058594,5029065.1321411133,-366944.5812702179,3321669.5785522461,214695.37913799286
320,Blank magnetic and optical recording media manufacturing,0,0,0,0,0,0
321,Software and other prerecorded and record reproducing,0,0,0,0,0,0
322,Electric lamp bulb and part manufacturing,0,0,0,0,0,0
323,Lighting fixture manufacturing,0.86692464351654053,151956.9605588913,0,-30748.268589377403,0,2238.2787428796291
324,Small electrical appliance manufacturing,0,0,0,0,0,0
325,Household cooking appliance manufacturing,0,0,0,0,0,0
326,Household refrigerator and home freezer manufacturing,0,0,0,0,0,0
327,Household laundry equipment manufacturing,0,0,0,0,0,0
328,Other major household appliance manufacturing,0,0,0,0,0,0
329,"Power, distribution, and specialty transformer manufacturing",0,0,0,0,0,0
330,Motor and generator manufacturing,0,0,0,0,0,0
331,Switchgear and switchboard apparatus manufacturing,0,0,0,0,0,0
332,Relay and industrial control manufacturing,0,0,0,0,0,0
333,Storage battery manufacturing,0,0,0,0,0,0
334,Primary battery manufacturing,0,0,0,0,0,0
335,Fiber optic cable manufacturing,0,0,0,0,0,0
336,Other communication and energy wire manufacturing,0,0,0,0,0,0
337,Wiring device manufacturing,0,0,0,0,0,0
338,Carbon and graphite product manufacturing,0,0,0,0,0,0
