Industry Detail ,,,,,,,
IndustryCode,Description,Employment,Output,EmployeeCompensation,ProprietorIncome,OtherPropertyTypeIncome,TaxOnProductionAndImports
0,Total,149567.13373014331,21790585114.989429,7966502722.6945381,912197034.92443657,3654177744.4256296,1187282803.0987475
1,Oilseed farming,0,0,0,0,0,0
2,Grain farming,0.41975438594818115,63293.501734733582,10601.875372231007,41788.976639509201,-15597.14786708355,-26398.263871669769
3,Vegetable and melon farming,83.862274169921875,4347771.167755127,1878058.5527420044,1081472.9928970337,-801146.26884460449,749.56956086680293
4,Fruit farming,73.118385314941406,3219068.5272216797,952766.0608291626,1128223.0615615845,-286472.40996360779,686.4449824206531
5,Tree nut farming,1.8839837312698364,51047.336310148239,51100.511103868484,11117.637157440186,-13741.686008870602,21.704548998968676
6,"Greenhouse, nursery, and floriculture production",636.35736083984375,45081306.457519531,24041616.439819336,6795709.1331481934,-3181020.7366943359,4301.7370626330376
7,Tobacco farming,0,0,0,0,0,0
8,Cotton farming,0,0,0,0,0,0
9,Sugarcane and sugar beet farming,0,0,0,0,0,0
10,All other crop farming,172.42709350585938,1941869.4972991943,1099594.1162109375,573949.45621490479,-439369.11225318909,-30534.399673342705
11,"Beef cattle ranching and farming, including feedlots and dual-purpose ranching and farming",119.55092620849609,11985671.043395996,320438.98105621338,4848021.0304260254,-621073.96125793457,567139.62554931641
12,Dairy cattle and milk production,68.672607421875,21791608.810424805,1512448.4300613403,2870173.6927032471,-344131.29091262817,81784.665584564209
13,Poultry and egg production,112.97133636474609,59437824.249267578,6032343.864440918,1122274.0411758423,-335966.22943878174,1857482.5525283814
14,"Animal production, except cattle and poultry and eggs",307.820556640625,42777523.040771484,6485126.9721984863,39028530.120849609,-7673622.1313476562,2704017.6391601562
15,"Forestry, forest products, and timber tract production",139.29812622070313,17676578.521728516,13806292.533874512,884430.70650100708,-50171.680748462677,318664.34216499329
16,Commercial logging,264.55447387695312,31003805.160522461,19249568.939208984,3367365.3602600098,-1268193.6025619507,791140.79475402832
17,Commercial fishing,152.94375610351563,6824622.1542358398,2138575.7923126221,1417193.2935714722,1324934.6017837524,1899691.7009353638
18,Commercial hunting and trapping,0,0,0,0,0,0
19,Support activities for agriculture and forestry,294.74188232421875,16442707.061767578,13771406.173706055,3018558.7406158447,-2946632.8620910645,379323.18449020386
20,Oil and gas extraction,403.02017211914062,91702301.025390625,0,1131.90698903054,0,76003.856956958771
21,Coal mining,0,0,0,0,0,0
22,"Copper, nickel, lead, and zinc mining",0,0,0,0,0,0
23,Iron ore mining,0,0,0,0,0,0
24,Gold ore mining,0,0,0,0,0,0
25,Silver ore mining,0,0,0,0,0,0
26,Uranium-radium-vanadium ore mining,0,0,0,0,0,0
27,Other metal ore mining,0,0,0,0,0,0
28,Stone mining and quarrying,89.803909301757812,13756051.063537598,866931.02121353149,1497660.0408554077,-22410.381585359573,708499.4912147522
29,Sand and gravel mining,0,0,0,0,0,0
30,"Other clay, ceramic, refractory minerals mining",0,0,0,0,0,0
31,"Potash, soda, and borate mineral mining",0,0,0,0,0,0
32,Phosphate rock mining,0,0,0,0,0,0
33,Other chemical and fertilizer mineral mining,0,0,0,0,0,0
34,Other nonmetallic minerals,0,0,0,0,0,0
35,Drilling oil and gas wells,30.479875564575195,7109132.2898864746,0,84.510582382790744,0,139794.26026344299
36,Support activities for oil and gas operations,46.938320159912109,8134380.3405761719,49425.695091485977,62676.213681697845,-266.02874277159572,165135.2196931839
37,Metal mining services,47.3345947265625,10865416.526794434,104230.80623149872,10593.205690383911,-314.4348447676748,200024.58989620209
38,Other nonmetallic minerals services,43.522457122802734,9627385.139465332,0,122.17972835060209,0,35406.544804573059
39,Electric power generation - Hydroelectric,0,0,0,0,0,0
40,Electric power generation - Fossil fuel,0,0,0,0,0,0
41,Electric power generation - Nuclear,0,0,0,0,0,0
42,Electric power generation - Solar,0,0,0,0,0,0
43,Electric power generation - Wind,0,0,0,0,0,0
44,Electric power generation - Geothermal,0,0,0,0,0,0
45,Electric power generation - Biomass,0,0,0,0,0,0
46,Electric power generation - All other,0,0,0,0,0,0
47,Electric power transmission and distribution,79.798553466796875,157310638.42773438,13725518.226623535,2074.9703980982304,53222629.547119141,27802690.505981445
48,Natural gas distribution,42.598049163818359,46057582.855224609,5788518.4288024902,-3799.1213612258434,16723537.445068359,5967124.9389648438
49,"Water, sewage and other systems",101.33554077148438,39805736.541748047,8586526.8707275391,7965.1931300759315,15159268.379211426,4455778.5987854004
50,Construction of new health care structures,229.03579711914063,36846302.032470703,11451542.854309082,3676977.1575927734,7094837.6655578613,522548.8543510437
51,Construction of new manufacturing structures,359.23345947265625,55619831.085205078,17532747.268676758,5782045.3643798828,6251407.1464538574,744756.34098052979
52,Construction of new power and communication structures,502.99658203125,92900047.302246094,24119901.657104492,8383067.1310424805,22462209.701538086,1535350.3227233887
53,Construction of new educational and vocational structures,606.93292236328125,86110282.897949219,32164115.905761719,7741662.0254516602,14684130.668640137,1102719.0685272217
54,Construction of new highways and streets,638.67999267578125,152478286.74316406,42008373.260498047,7161624.9084472656,40091732.025146484,1880622.6253509522
55,"Construction of new commercial structures, including farm structures",913.515380859375,122438911.43798828,44103610.992431641,14162729.263305664,10261753.082275391,2573313.7130737305
56,Construction of other new nonresidential structures,1290.7078857421875,111562110.90087891,71452667.236328125,18636726.379394531,-39317764.282226562,1822512.6266479492
57,Construction of new single-family residential structures,1419.0850830078125,218454742.43164063,67876060.485839844,23793684.005737305,39117691.040039062,3590502.7389526367
58,Construction of new multifamily residential structures,437.09292602539062,51958545.684814453,21127336.502075195,7334484.1003417969,12373622.894287109,732068.95589828491
59,Construction of other new residential structures,987.26220703125,207460571.2890625,48494895.935058594,16147661.209106445,31611333.847045898,4725841.9990539551
60,Maintenance and repair construction of nonresidential structures,666.47723388671875,140248275.75683594,32523017.883300781,11138194.084167481,17144876.480102539,3069126.1291503906
61,Maintenance and repair construction of residential structures,333.27044677734375,72739440.91796875,15165645.599365234,4900382.0419311523,9891585.3500366211,2931913.6142730713
62,"Maintenance and repair construction of highways, streets, bridges, and tunnels",240.3411865234375,24398605.346679688,11782908.439636231,3983146.4290618896,-5221169.4717407227,611520.29037475586
63,Dog and cat food manufacturing,0,0,0,0,0,0
64,Other animal food manufacturing,4.7161102294921875,4884135.7231140137,336519.92678642273,12865.12054502964,207419.14212703705,122269.94335651398
65,Flour milling,0,0,0,0,0,0
66,Rice milling,0,0,0,0,0,0
67,Malt manufacturing,0,0,0,0,0,0
68,Wet corn milling,0,0,0,0,0,0
69,Soybean and other oilseed processing,0,0,0,0,0,0
70,Fats and oils refining and blending,0,0,0,0,0,0
71,Breakfast cereal manufacturing,0,0,0,0,0,0
72,Beet sugar manufacturing,0,0,0,0,0,0
73,Sugar cane mills and refining,0,0,0,0,0,0
74,Nonchocolate confectionery manufacturing,40.191619873046875,15748121.26159668,1744581.5801620483,140999.83870983124,736101.98497772217,85833.914577960968
75,Chocolate and confectionery manufacturing from cacao beans,0,0,0,0,0,0
76,Confectionery manufacturing from purchased chocolate,14.404488563537598,4685142.5170898438,481582.79061317444,55438.455194234848,191589.53428268433,26718.538254499435
77,"Frozen fruits, juices and vegetables manufacturing",0,0,0,0,0,0
78,Frozen specialties manufacturing,0,0,0,0,0,0
79,Canned fruits and vegetables manufacturing,40.200603485107422,19509386.06262207,2132070.5413818359,104475.46094655991,1579482.4361801148,90939.678251743317
80,Canned specialties,30.145988464355469,23244464.874267578,1208017.2300338745,206344.14255619049,1579174.0417480469,107874.74364042282
81,Dehydrated food products manufacturing,0,0,0,0,0,0
82,Cheese manufacturing,0,0,0,0,0,0
83,"Dry, condensed, and evaporated dairy product manufacturing",0,0,0,0,0,0
84,Fluid milk manufacturing,2.2970235347747803,1659380.7935714722,78168.205916881561,116985.4998588562,46637.192368507385,10312.261991202831
85,Creamery butter manufacturing,0,0,0,0,0,0
86,Ice cream and frozen dessert manufacturing,0,0,0,0,0,0
87,Frozen cakes and other pastries manufacturing,115.30180358886719,11221210.479736328,4130750.1792907715,59638.816863298416,479187.45875358582,1935985.2075576782
88,Poultry processing,0,0,0,0,0,0
89,"Animal, except poultry, slaughtering",47.137367248535156,31742055.892944336,2323361.1583709717,24278.070777654648,746908.06865692139,219434.9616765976
90,Meat processed from carcasses,27.609003067016602,14293996.810913086,1479089.7369384766,165731.05752468109,130798.89118671417,91494.768857955933
91,Rendering and meat byproduct processing,4.539736270904541,1719050.2882003784,292669.29626464844,9904.2737856507301,34646.58185839653,21767.24374294281
92,Seafood product preparation and packaging,0,0,0,0,0,0
93,"Bread and bakery product, except frozen, manufacturing",206.22453308105469,26648946.762084961,5967348.575592041,569135.48707962036,1369567.9903030396,1542402.0290374756
94,Cookie and cracker manufacturing,0,0,0,0,0,0
95,"Dry pasta, mixes, and dough manufacturing",0,0,0,0,0,0
96,Tortilla manufacturing,0,0,0,0,0,0
97,Roasted nuts and peanut butter manufacturing,47.534873962402344,24851760.864257812,4032607.5553894043,281489.72988128662,4394353.8665771484,107386.61885261536
98,Other snack food manufacturing,40.292316436767578,23310131.072998047,4013997.5547790527,0,3634529.8290252686,129860.22233963013
99,Coffee and tea manufacturing,116.09600067138672,70935234.069824219,4497632.0266723633,425247.60961532593,4032421.1120605469,431093.99080276489
100,Flavoring syrup and concentrate manufacturing,0,0,0,0,0,0
101,"Mayonnaise, dressing, and sauce manufacturing",3.9181451797485352,2119864.9406433105,40730.834007263184,320969.87962722778,34493.286162614822,12158.798053860664
102,Spice and extract manufacturing,0,0,0,0,0,0
103,All other food manufacturing,4.8958449363708496,1603262.4244689941,61491.359025239944,155276.14951133728,20218.899473547935,8481.5854206681252
104,Bottled and canned soft drinks & water,210.85008239746094,163942703.24707031,19275093.078613281,214205.86109161377,18519731.521606445,1318081.6173553467
105,Manufactured ice,0,0,0,0,0,0
106,Breweries,254.654052734375,107627410.88867188,8464360.237121582,1369466.9008255005,10834026.336669922,8810839.6530151367
107,Wineries,47.459522247314453,13711103.439331055,899320.90044021606,299617.73753166199,550053.35807800293,443881.36267662048
108,Distilleries,17.199731826782227,16236978.530883789,391407.69839286804,406392.4252986908,954813.59958648682,4122308.7310791016
109,Tobacco product manufacturing,0,0,0,0,0,0
110,"Fiber, yarn, and thread mills",0,0,0,0,0,0
111,Broadwoven fabric mills,22.047027587890625,6192836.7614746094,2131981.6112518311,149240.47887325287,382327.40759849548,60008.075088262558
112,Narrow fabric mills and schiffli machine embroidery,0,0,0,0,0,0
113,Nonwoven fabric mills,0,0,0,0,0,0
114,Knit fabric mills,0,0,0,0,0,0
115,Textile and fabric finishing mills,0,0,0,0,0,0
116,Fabric coating mills,0,0,0,0,0,0
117,Carpet and rug mills,0,0,0,0,0,0
118,Curtain and linen mills,0,0,0,0,0,0
119,Textile bag and canvas mills,0,0,0,0,0,0
120,"Rope, cordage, twine, tire cord and tire fabric mills",0,0,0,0,0,0
121,Other textile product mills,16.269477844238281,2090353.7273406982,434748.47078323364,76110.780239105225,39915.300905704498,25995.774194598198
122,Hosiery and sock mills,1.4735496044158936,137388.57209682465,34974.314272403717,0,3135.9391286969185,20481.351763010025
123,Other apparel knitting mills,1.4774396419525147,157313.06374073029,35071.324557065964,0,2980.8881226927042,30332.528054714203
124,Cut and sew apparel contractors,1.467305064201355,81473.015248775482,34904.707223176956,0,281.06040554121137,3764.3888499587774
125,Mens and boys cut and sew apparel manufacturing,1.4672204256057739,175676.68855190277,34898.877143859863,0,3199.8264603316784,5079.6396099030972
126,Womens and girls cut and sew apparel manufacturing,30.767183303833008,6216216.5641784668,764289.02149200439,614149.33204650879,118665.30030965805,100503.66818904877
127,Other cut and sew apparel manufacturing,1.4703898429870606,155356.19854927063,34943.554550409317,0,3036.4096164703369,9508.2428306341171
128,Apparel accessories and other apparel manufacturing,1.4681723117828369,142949.9089717865,34916.598349809647,0,2865.5563946813345,8040.7252535223961
129,Leather and hide tanning and finishing,0,0,0,0,0,0
130,Footwear manufacturing,0,0,0,0,0,0
131,Other leather and allied product manufacturing,9.5678472518920898,736409.12771224976,0,92230.193316936493,0,7562.0883144438267
132,Sawmills,32.002803802490234,9339150.4287719727,1946917.1762466431,79883.888363838196,796425.28295516968,80032.169818878174
133,Wood preservation,0,0,0,0,0,0
134,Veneer and plywood manufacturing,0,0,0,0,0,0
135,Engineered wood member and truss manufacturing,57.898532867431641,12652044.296264648,2858496.4275360107,115899.59263801575,962108.73126983643,106531.13573789597
136,Reconstituted wood product manufacturing,0,0,0,0,0,0
137,Wood windows and door manufacturing,14.012044906616211,3063227.8919219971,647903.26356887817,73710.933327674866,224531.54623508453,28813.660144805908
138,"Cut stock, resawing lumber, and planing",0,0,0,0,0,0
139,"Other millwork, including flooring",4.9758610725402832,941138.92316818237,146866.45567417145,73981.009423732758,65688.654780387878,9330.70108294487
140,Wood container and pallet manufacturing,21.964427947998047,3283437.967300415,810680.38940429688,150128.51357460022,156909.25717353821,29649.117961525917
141,Manufactured home (mobile home) manufacturing,0,0,0,0,0,0
142,Prefabricated wood building manufacturing,0,0,0,0,0,0
143,All other miscellaneous wood product manufacturing,39.359020233154297,6219865.7989501953,1121302.2470474243,316202.22330093384,325633.61525535583,61450.626701116562
144,Pulp mills,0,0,0,0,0,0
145,Paper mills,55.011451721191406,45129833.221435547,6983032.2265625,37997.92006611824,6340072.1549987793,427389.4727230072
146,Paperboard mills,32.565536499023438,27789377.212524414,3642079.8301696777,0,2919160.8428955078,299951.82156562805
147,Paperboard container manufacturing,134.52784729003906,67479721.069335938,12821766.85333252,52848.134189844131,3781388.7596130371,660729.22945022583
148,Paper bag and coated and treated paper manufacturing,0,0,0,0,0,0
149,Stationery product manufacturing,0,0,0,0,0,0
150,Sanitary paper product manufacturing,0,0,0,0,0,0
151,All other converted paper product manufacturing,0,0,0,0,0,0
152,Printing,172.74659729003906,24808311.462402344,7054182.0526123047,429882.58600234985,2044407.1292877197,301176.72681808472
153,Support activities for printing,0,0,0,0,0,0
154,Petroleum refineries,2.5076093673706055,16531665.802001953,0,10451.177135109901,0,73382.80975818634
155,Asphalt paving mixture and block manufacturing,0,0,0,0,0,0
156,Asphalt shingle and coating materials manufacturing,0,0,0,0,0,0
157,Petroleum lubricating oil and grease manufacturing,0,0,0,0,0,0
158,All other petroleum and coal products manufacturing,0,0,0,0,0,0
159,Petrochemical manufacturing,0,0,0,0,0,0
160,Industrial gas manufacturing,0,0,0,0,0,0
161,Synthetic dye and pigment manufacturing,0,0,0,0,0,0
162,Other basic inorganic chemical manufacturing,0,0,0,0,0,0
163,Other basic organic chemical manufacturing,0,0,0,0,0,0
164,Plastics material and resin manufacturing,0,0,0,0,0,0
165,Synthetic rubber manufacturing,0,0,0,0,0,0
166,Artificial and synthetic fibers and filaments manufacturing,0,0,0,0,0,0
167,Nitrogenous fertilizer manufacturing,0,0,0,0,0,0
168,Phosphatic fertilizer manufacturing,0,0,0,0,0,0
169,Fertilizer mixing,0,0,0,0,0,0
170,Pesticide and other agricultural chemical manufacturing,0,0,0,0,0,0
171,Medicinal and botanical manufacturing,0,0,0,0,0,0
172,Pharmaceutical preparation manufacturing,60.434909820556641,72726455.688476562,4358986.3777160645,26848.651468753815,14269141.19720459,2834569.9310302734
173,In-vitro diagnostic substance manufacturing,0,0,0,0,0,0
174,Biological product (except diagnostic) manufacturing,0,0,0,0,0,0
175,Paint and coating manufacturing,0,0,0,0,0,0
176,Adhesive manufacturing,0,0,0,0,0,0
177,Soap and other detergent manufacturing,0,0,0,0,0,0
178,Polish and other sanitation good manufacturing,0,0,0,0,0,0
179,Surface active agent manufacturing,0,0,0,0,0,0
180,Toilet preparation manufacturing,66.006927490234375,49066455.841064453,3018533.9450836182,94066.515564918518,10389873.504638672,972716.09306335449
181,Printing ink manufacturing,0,0,0,0,0,0
182,Explosives manufacturing,0,0,0,0,0,0
183,Custom compounding of purchased resins,0,0,0,0,0,0
184,Photographic film and chemical manufacturing,31.825733184814453,22638462.066650391,2277684.6885681152,31168.287619948387,3120541.3341522217,316240.54908752441
185,Other miscellaneous chemical product manufacturing,26.79656982421875,15302803.039550781,1989081.0251235962,34747.947007417679,1250815.749168396,242291.58461093903
186,Plastics packaging materials and unlaminated film and sheet manufacturing,0,0,0,0,0,0
187,Unlaminated plastics profile shape manufacturing,0,0,0,0,0,0
188,Plastics pipe and pipe fitting manufacturing,62.524368286132812,27771926.879882812,3800189.9719238281,-14665.858820080757,3515076.1604309082,220386.62433624268
189,"Laminated plastics plate, sheet (except packaging), and shape manufacturing",10.953244209289551,3104971.6472625732,519368.23129653931,-10591.326281428337,290538.84744644165,24898.22544157505
190,Polystyrene foam product manufacturing,48.863307952880859,17011375.427246094,3483367.6815032959,-35824.347287416458,1452403.6645889282,128255.51629066467
191,Urethane and other foam product (except polystyrene) manufacturing,0,0,0,0,0,0
192,Plastics bottle manufacturing,64.643440246582031,26654876.708984375,4081235.408782959,-14744.122512638569,1684076.189994812,183052.70373821259
193,Other plastics product manufacturing,0,0,0,0,0,0
194,Tire manufacturing,0,0,0,0,0,0
195,Rubber and plastics hoses and belting manufacturing,5.1523561477661133,1431724.5483398438,305503.69620323181,-3935.3109896183014,118664.89797830582,10642.198845744133
196,Other rubber product manufacturing,0,0,0,0,0,0
197,"Pottery, ceramics, and plumbing fixture manufacturing",0,0,0,0,0,0
198,"Brick, tile, and other structural clay product manufacturing",0,0,0,0,0,0
199,Flat glass manufacturing,0,0,0,0,0,0
200,Other pressed and blown glass and glassware manufacturing,0,0,0,0,0,0
201,Glass container manufacturing,0,0,0,0,0,0
202,Glass product manufacturing made of purchased glass,0,0,0,0,0,0
203,Cement manufacturing,0,0,0,0,0,0
204,Ready-mix concrete manufacturing,154.99630737304688,61112483.978271484,10013520.240783691,39977.487176656723,6881139.7552490234,624769.33002471924
205,Concrete block and brick manufacturing,14.205717086791992,4071156.5017700195,606537.1036529541,16297.724097967148,533169.80600357056,55023.163557052612
206,Concrete pipe manufacturing,0,0,0,0,0,0
207,Other concrete product manufacturing,0,0,0,0,0,0
208,Lime manufacturing,0,0,0,0,0,0
209,Gypsum product manufacturing,0,0,0,0,0,0
210,Abrasive product manufacturing,0,0,0,0,0,0
211,Cut stone and stone product manufacturing,34.133380889892578,3194727.897644043,460767.98439025879,58903.791010379791,73613.449931144714,44812.526553869247
212,Ground or treated mineral and earth manufacturing,0,0,0,0,0,0
213,Mineral wool manufacturing,0,0,0,0,0,0
214,Miscellaneous nonmetallic mineral products manufacturing,8.5544338226318359,2374155.5213928223,124264.40417766571,9622.3792061209679,191382.79557228088,36707.188934087753
215,Iron and steel mills and ferroalloy manufacturing,0,0,0,0,0,0
216,"Iron, steel pipe and tube manufacturing from purchased steel",0,0,0,0,0,0
217,Rolled steel shape manufacturing,0,0,0,0,0,0
218,Steel wire drawing,0,0,0,0,0,0
219,Alumina refining and primary aluminum production,0,0,0,0,0,0
220,Secondary smelting and alloying of aluminum,0,0,0,0,0,0
221,"Aluminum sheet, plate, and foil manufacturing",0,0,0,0,0,0
222,"Other aluminum rolling, drawing and extruding",0,0,0,0,0,0
223,Nonferrous metal (exc aluminum) smelting and refining,0,0,0,0,0,0
224,"Copper rolling, drawing, extruding and alloying",0,0,0,0,0,0
225,"Nonferrous metal, except copper and aluminum, shaping",0,0,0,0,0,0
226,Secondary processing of other nonferrous metals,0,0,0,0,0,0
227,Ferrous metal foundries,0,0,0,0,0,0
228,Nonferrous metal foundries,10.735530853271484,4024914.7415161133,1774391.2935256958,-27784.237638115883,728947.75867462158,27895.92556655407
229,Custom roll forming,0,0,0,0,0,0
230,Crown and closure manufacturing and metal stamping,0,0,0,0,0,0
231,Iron and steel forging,0,0,0,0,0,0
232,Nonferrous forging,0,0,0,0,0,0
233,"Cutlery, utensil, pot, and pan manufacturing",0,0,0,0,0,0
234,Handtool manufacturing,0,0,0,0,0,0
235,Prefabricated metal buildings and components manufacturing,0,0,0,0,0,0
236,Fabricated structural metal manufacturing,16.083986282348633,4818195.3430175781,849624.99141693115,7605.8362610638142,496713.60850334167,49805.533140897751
237,Plate work manufacturing,0,0,0,0,0,0
238,Metal window and door manufacturing,0,0,0,0,0,0
239,Sheet metal work manufacturing,21.646657943725586,4540565.4907226562,1271803.617477417,8502.9089823365211,438784.09266471863,41553.549468517303
240,Ornamental and architectural metal work manufacturing,19.21800422668457,3904902.458190918,933460.2952003479,8829.2872533202171,381483.19721221924,37029.556930065155
241,Power boiler and heat exchanger manufacturing,0,0,0,0,0,0
242,Metal tank (heavy gauge) manufacturing,0,0,0,0,0,0
243,Metal cans manufacturing,56.825168609619141,51027790.069580078,6136731.1477661133,1432.9542173072696,9376006.1264038086,423759.72867012024
244,"Metal barrels, drums and pails manufacturing",0,0,0,0,0,0
245,Hardware manufacturing,0,0,0,0,0,0
246,Spring and wire product manufacturing,0,0,0,0,0,0
247,Machine shops,47.611804962158203,6204139.232635498,2240257.9784393311,24347.316473722458,401628.31544876099,61811.011284589767
248,"Turned product and screw, nut, and bolt manufacturing",29.945823669433594,7347245.2163696289,1928053.0214309692,2235.7646375894547,903360.66484451294,65810.680389404297
249,Metal heat treating,0,0,0,0,0,0
250,Metal coating and nonprecious engraving,13.723360061645508,2597905.158996582,335942.56639480591,9322.6088210940361,313802.54030227661,30318.360775709152
251,"Electroplating, anodizing, and coloring metal",9.668147087097168,1169687.1519088745,343911.17095947266,2014.2090506851673,44182.524085044861,12110.899202525616
252,"Valve and fittings, other than plumbing, manufacturing",4.022822380065918,1503341.1979675293,390161.63349151611,0,287063.50922584534,14833.424240350723
253,Plumbing fixture fitting and trim manufacturing,0,0,0,0,0,0
254,Ball and roller bearing manufacturing,0,0,0,0,0,0
255,Small arms ammunition manufacturing,0,0,0,0,0,0
256,"Ammunition, except for small arms, manufacturing",0,0,0,0,0,0
257,"Small arms, ordnance, and accessories manufacturing",21.815101623535156,8905499.4583129883,1460945.2486038208,5202.7441561222076,2767544.5079803467,116761.74402236939
258,Fabricated pipe and pipe fitting manufacturing,0,0,0,0,0,0
259,Other fabricated metal manufacturing,0,0,0,0,0,0
260,Farm machinery and equipment manufacturing,0,0,0,0,0,0
261,Lawn and garden equipment manufacturing,0,0,0,0,0,0
262,Construction machinery manufacturing,4.3436689376831055,2316479.2060852051,269244.07482147217,1660.3466356173158,126758.1433057785,30982.069671154022
263,Mining machinery and equipment manufacturing,5.0991067886352539,1328227.4007797241,298669.99387741089,6448.0057917535305,40338.151156902313,16130.039468407631
264,Oil and gas field machinery and equipment manufacturing,0,0,0,0,0,0
265,Semiconductor machinery manufacturing,0,0,0,0,0,0
266,Food product machinery manufacturing,0,0,0,0,0,0
267,"Sawmill, woodworking, and paper machinery",0,0,0,0,0,0
268,Printing machinery and equipment manufacturing,0,0,0,0,0,0
269,All other industrial machinery manufacturing,9.2977838516235352,2333519.458770752,641563.41552734375,1582.3075082153082,105837.55373954773,21464.522927999496
270,Optical instrument and lens manufacturing,0,0,0,0,0,0
271,Photographic and photocopying equipment manufacturing,0,0,0,0,0,0
272,Other commercial service industry machinery manufacturing,13.115118980407715,4466466.9036865234,885050.83322525024,3131.2170904129744,358109.56358909607,46457.979828119278
273,Air purification and ventilation equipment manufacturing,3.3068497180938721,826209.12790298462,203248.81374835968,1195.2277272939682,45140.359550714493,8935.0873604416847
274,Heating equipment (except warm air furnaces) manufacturing,0,0,0,0,0,0
275,"Air conditioning, refrigeration, and warm air heating equipment manufacturing",0,0,0,0,0,0
276,Industrial mold manufacturing,0,0,0,0,0,0
277,"Special tool, die, jig, and fixture manufacturing",0,0,0,0,0,0
278,Cutting tool and machine tool accessory manufacturing,9.2900390625,1600875.2584457398,549640.53630828857,3436.060156673193,28329.348191618919,14847.474172711372
279,Machine tool manufacturing,1.4515841007232666,335789.05463218689,106484.94213819504,1488.8891018927097,6958.965677767992,2859.5842886716127
280,Rolling mill and other metalworking machinery manufacturing,0,0,0,0,0,0
281,Turbine and turbine generator set units manufacturing,0,0,0,0,0,0
